"Title","video_url","Published_date","Views"
"THIS WILL TRANSFORM YOUR LIFE! | John Assaraf on Impact Theory","https://www.youtube.com/watch?v=Vv2hNbblo3E","2019-01-16",3677
"How To Build Self Confidence | Ed Mylett on Impact Theory","https://www.youtube.com/watch?v=WGtCFqdMLbA","2019-01-06",11798
"How To Find True Happiness | Wim Hof on Impact Theory","https://www.youtube.com/watch?v=w1XzAHey0T0","2019-01-02",5327
"WHY ATTITUDE IS EVERYTHING | Robert Greene on Impact Theory","https://www.youtube.com/watch?v=KxADX7UuG2E","2019-01-01",34035
"Learn How To LOVE TO LOSE | Gary Vaynerchuk on Impact Theory","https://www.youtube.com/watch?v=vOcowdceYwg","2018-12-18",12048
