"Title","video_url","Published_date","Views"
"Jordan Peterson Quotes you should know before you Get Old! Life changing quotes","https://www.youtube.com/watch?v=VCT2SmsR_z4","2023-04-26",271
"JORDAND PETERSON VS FEMINIST - DEFINE TOXIC MASCULINITY #shorts","https://www.youtube.com/watch?v=rG4wpJLAT90","2023-01-04",23259
"JORDAN PETERSON SCHOOLING FEMINIST ON TOXIC MASCULINITY #shorts","https://www.youtube.com/watch?v=csbLy685Rig","2023-01-04",10453
"Gabor Mate Criticism On Jordan Peterson","https://www.youtube.com/watch?v=Fgmp17UsFdk","2023-01-03",7464
"Jordan Peterson on Greta Thunberg","https://www.youtube.com/watch?v=IetovUoOmRo","2023-01-02",1426916
"The Real Reasons You Can't Focus On Your Work - Jordan Peterson","https://www.youtube.com/watch?v=qHA2Ys_hn_w","2022-12-30",2122
"The Horrific Dangers of Being Single - Jordan Peterson","https://www.youtube.com/watch?v=fB-xFQEJX3w","2022-12-20",293279
"Jordan Peterson Criticizes Trump #shorts","https://www.youtube.com/watch?v=Mt7xTJUZNYg","2022-12-19",199339
"The Best ADVICE To Young MEN Seeking Intimacy and Marriage - Jordan Peterson","https://www.youtube.com/watch?v=LI2aDYoW3Y0","2022-12-18",5968
"Learning Attitude Live Stream","https://www.youtube.com/watch?v=W1eNAFrWAxk","2022-12-18",0
"Jordan Peterson Answers a Question of a HOUSE WIFE #shorts","https://www.youtube.com/watch?v=SqOq2LXMasQ","2022-12-16",2192600
"Jordan Peterson on Hypergamy and Polygamy","https://www.youtube.com/watch?v=Y86bDBLEX-I","2022-12-14",7018
"Jordan Peterson Vs Feminist on TOXIC-MASCULINITY #shorts","https://www.youtube.com/watch?v=NJcsgG-iGJY","2022-12-13",2321613
"I'm Not ANTI FEMINIST - Jordan Peterson #shorts","https://www.youtube.com/watch?v=-_UcsrjhHBU","2022-12-13",393496
"The Best Way To IDENTIFY High Quality Women - Jordan Peterson","https://www.youtube.com/watch?v=MKzzqOCAEV8","2022-12-12",4643
"Women Were Freed By Technology - Jordan Peterson #shorts","https://www.youtube.com/watch?v=x1w0pyJdq_8","2022-12-11",11246
"How to Know WHAT TO SAY- Jordan Peterson(How to be WITTY)","https://www.youtube.com/watch?v=_mFP2L1uW3s","2022-12-08",2647
"Divorce is Very Complicated - Jordan Peterson #shorts","https://www.youtube.com/watch?v=UqPEHAXby18","2022-12-08",6733
"Most MEN and WOMEN Do NOT BENEFIT in Relationships - Jordan Peterson","https://www.youtube.com/watch?v=qWVVCt6szHE","2022-12-06",353638
"The Best ADVICE to YOUNG Men in Their 20s - Jordan Peterson","https://www.youtube.com/watch?v=tn8Dnzm3Db0","2022-12-06",3017
"Jordan Peterson on Why Society is Falling Apart","https://www.youtube.com/watch?v=S2viTtk3rho","2022-12-05",3679
"It's Hard to Believe This is Real - Jordan Peterson","https://www.youtube.com/watch?v=kYU3bxkSo0E","2022-12-04",4854
"Jordan Peterson on Importance of FAMILY and MEANING in Life #shorts","https://www.youtube.com/watch?v=NzMsOPeEOeg","2022-12-04",5146
"Jordan Peterson: What WOMEN don't understand about MEN","https://www.youtube.com/watch?v=NE_s_Kr7Lm4","2022-12-03",640089
"The Science Behind Attractive Women And Eye Contact - Jordan Peterson","https://www.youtube.com/watch?v=mM7LvAONmqU","2022-12-01",10921
"The Simple Reason Why You Can't Find HAPPINESS In Your Life | JORDAN PETERSON and JOE ROGAN ADVICE","https://www.youtube.com/watch?v=uhw2_ZWthV0","2022-11-30",1658
"Making People Poor Does Not Make Planet Healthier - JORDAN PETERSON #shorts","https://www.youtube.com/watch?v=S3v5fFjTh0o","2022-11-29",4688
"Neuroscientist: Why Men Don't Choose The Most Attractive Girl - Andrew Huberman #shorts","https://www.youtube.com/watch?v=BsluEXsewhY","2022-11-28",496944
"Neuroscientist: What Women Want of a Man - Andrew Huberman #shorts","https://www.youtube.com/watch?v=5jwp5qx5K8Y","2022-11-28",631346
"MEN Are JUDGED By Society For Trying To Improve Themselves - Jordan Peterson and Joe Rogan","https://www.youtube.com/watch?v=u_AMnpsDY-0","2022-11-26",2530
"The Simple Reason Why 90% of MEN Can't Improve Themselves | JORDAN PETERSON and JOE ROGAN Advice","https://www.youtube.com/watch?v=15vHImev0IU","2022-11-25",3898
"MEN Just Don't Do This Anymore! | STOP dressing like a fool! | JORDAN PETERSON Fashion Advice","https://www.youtube.com/watch?v=TjBwSB3qakI","2022-11-25",4625
"What Women ACTUALLY WANT off a Man - Jordan Peterson","https://www.youtube.com/watch?v=seLAfOvZ3Ag","2022-11-24",804976
"Jordan Peterson Destroys Two Feminists on Equality of Outcome #shorts","https://www.youtube.com/watch?v=mpaSsIx3wGE","2022-11-24",39784
"What to do when you are stuck in the Past - Jordan Peterson #shorts","https://www.youtube.com/watch?v=V5oFe4dJMjM","2022-11-23",19443
"A Parent's MOST IMPORTANT JOB - Jordan Peterson","https://www.youtube.com/watch?v=biN2cfaxMUU","2022-11-23",2380
"The Results & Features of a Person with a High IQ - Jordan Peterson","https://www.youtube.com/watch?v=KyKWGQS745E","2022-11-22",5266
"How Jordan Peterson Handles Disrespect #shorts","https://www.youtube.com/watch?v=uxSRNxw9d30","2022-11-22",463673
"The ONLY DATING ADVICE You Will Ever Need! - Jordan Peterson","https://www.youtube.com/watch?v=FyzdDldy2wQ","2022-11-22",932867
"Feminists don't know there's DIFFERENT types of EQUALITY - Jordan Peterson #shorts","https://www.youtube.com/watch?v=RehbA1VlplM","2022-11-21",14654
"You want more Women in POLITICS do you also want more Women as Bricklayers - Jordan Peterson #shorts","https://www.youtube.com/watch?v=uC6UTVo_S90","2022-11-21",44871
"5 Steps to Lifetime SUCCESS - Jordan Peterson","https://www.youtube.com/watch?v=JJ18Q6dE6CY","2022-11-21",1913
"Jordan Peterson on the Importance of Reading and Writing","https://www.youtube.com/watch?v=HSoZhKbjd8A","2022-11-21",4498
"Jordan Peterson Criticizes Elliot page's transition #shorts","https://www.youtube.com/watch?v=VtcLQzWZrsE","2022-11-20",12647
"Jordan Peterson Destroys Feminist's Claims #shorts","https://www.youtube.com/watch?v=Uq1heClJqc0","2022-11-19",391076
"Cristiano Ronaldo on Jordan Peterson - HE IS AN AMAZING MAN","https://www.youtube.com/watch?v=JDuiZlw8WHE","2022-11-18",13410
"You are a MAD MEAN WHITE MAN - Jordan Peterson #shorts","https://www.youtube.com/watch?v=R1yrm28TYU8","2022-11-18",38113
"Jordan Peterson and the Value of a Punchline","https://www.youtube.com/watch?v=3dWBq9INv00","2022-11-17",1323
"Jordan Peterson Answers Will he convert to Islam?","https://www.youtube.com/watch?v=x9hE6kJM4Rs","2022-11-16",977070
"Become a Civilized MONSTER - Jordan Peterson(Best Advice)","https://www.youtube.com/watch?v=gsszWHOL2KQ","2022-11-15",3223
"Jordan Peterson DESTROYS Greta Thunberg #shorts","https://www.youtube.com/watch?v=kCEBNh0Be4Y","2022-11-15",546446
"Jordan Peterson - Difference Between Sexual Invitation and Harassment #shorts","https://www.youtube.com/watch?v=E_hd_6OFV6Y","2022-11-14",16169
"I'm Planning to Talk to KANYE WEST Jordan Peterson","https://www.youtube.com/watch?v=jzfiMBoGRQA","2022-11-12",1072
"Biggest Threat to Mankind is... - Jordan Peterson #shorts","https://www.youtube.com/watch?v=-9rvgmwDY3o","2022-11-11",738009
"Jordan Peterson & Andrew Huberman: How To Learn Anything Fast","https://www.youtube.com/watch?v=iUrUtwfhRgk","2022-11-10",2200
"Jordan Peterson ANSWERS a FEMINIST on Toxic Masculinity – You Can't Even Define Your Own Question","https://www.youtube.com/watch?v=7x57UV99ojA","2022-11-10",331964
"Why You Should Read CRIME AND PUNISHMENT? - Jordan Peterson","https://www.youtube.com/watch?v=MSlBUAWKDaI","2022-08-01",26692
"Fear Of God Is The Beginning Of Wisdom - Jordan Peterson","https://www.youtube.com/watch?v=2HKr0PFLcnk","2022-04-28",1773
"Jordan Peterson: Explains What Happens When You Date Lower Than Your Status(Best Advice)","https://www.youtube.com/watch?v=dE-9T-84aBI","2022-04-27",13983
"When You Are Too Different From Others - Jordan Peterson motivation(Best Advice)","https://www.youtube.com/watch?v=YoFH4XOUND0","2022-04-23",8546
"Jordan Peterson on How To Become Articulate - BEST ADVICE","https://www.youtube.com/watch?v=mD_tXCcsL0k","2022-04-17",30035
"Introverts Think Their Suffering Is Unique - Jordan Peterson","https://www.youtube.com/watch?v=2PCEEjJvIHY","2022-03-16",6289
"Jordan Peterson: Emotional Intelligence Does Not Exist","https://www.youtube.com/watch?v=fyGKS55PsUI","2022-03-11",16970
"Difference Between Introverts and Extroverts - Jordan Peterson #shorts","https://www.youtube.com/watch?v=g4sjZ70EWMU","2022-03-08",654128
"Jordan Peterson Cries talking about Jesus Christ #shorts","https://www.youtube.com/watch?v=TwrRRmor6bc","2022-02-27",18320
"Tatoos and piercings were associated with criminals and outcasts - Jordan Pterson #shorts","https://www.youtube.com/watch?v=XllcOOLu-_I","2022-02-26",893507
"I have feminine personality structure - Jordan Pterson #shorts","https://www.youtube.com/watch?v=C3DHnr4uHeY","2022-02-26",305143
"I used To Think | Jim Carrey Motivation #shorts","https://www.youtube.com/watch?v=hL4gAcy97QE","2022-02-24",6228
"Rap is the articulated voice of alienated people - Jordan Peterson #shorts","https://www.youtube.com/watch?v=M6mQu7R5P9E","2022-02-22",5701
"redemptive power of logos | Jordan Peterson #shorts","https://www.youtube.com/watch?v=-097dnaIQi8","2022-02-22",541679
"how to deal with Neuroticism  |  Jordan Peterson #shorts","https://www.youtube.com/watch?v=DaNDM9krSfo","2022-02-22",17675
"Jordan Peterson | cheating in relationships should be punished #shorts","https://www.youtube.com/watch?v=tlvF8xJ1zow","2022-02-19",65644
"Jordan Peterson's Savage Comeback #shorts","https://www.youtube.com/watch?v=nGnyXgTpEXA","2022-02-18",3884334
"Jordan Peterson quotes Carl Jung's statement On Catholicism #shorts","https://www.youtube.com/watch?v=MQlKBbCuLYE","2022-02-13",16175
"Jordan Peterson Says It's Pretty Funny When Muslim Says.... #shorts","https://www.youtube.com/watch?v=vUDkxOGFCbs","2022-02-13",172773
"Jordan Peterson: Why You Should Be Responsible #shorts","https://www.youtube.com/watch?v=izqRR1Hfd10","2022-02-13",7655
"Jordan Peterson Explains the job of a good Leader #shorts","https://www.youtube.com/watch?v=OvtY_gGAWBU","2022-02-10",17109
"Jordan Peterson defending joe rogan against CNN  #shorts","https://www.youtube.com/watch?v=tjws8tTd2HQ","2022-02-07",23550
"Jordan Peterson Talking About Interview With Cathy Newman #shorts","https://www.youtube.com/watch?v=qr7vyEYgiuo","2021-08-29",184961
"Jordan Peterson Destroyed A Feminist Talking About Male Dominance #shorts","https://www.youtube.com/watch?v=QkXUzAyOvxU","2021-08-29",350123
