"Title","video_url","Published_date","Views"
"More Python Code Smells: Avoid These 7 Smelly Snags","https://www.youtube.com/watch?v=zmWf_cHyo8s","2021-07-30",78330
"GitHub Copilot 🤖 The future of software development?","https://www.youtube.com/watch?v=FS_jj7Joj1w","2021-07-23",31142
"The Factory Pattern in Python // Separate creation from use","https://www.youtube.com/watch?v=s_4ZrtQs8Do","2021-07-16",128167
"A Closer Look At Structural Pattern Matching // New In Python 3.10!","https://www.youtube.com/watch?v=scNNi4860kk","2021-07-09",87894
"Answering Your Most Frequently Asked Python Questions // Q&A 07-2021","https://www.youtube.com/watch?v=LQdZNjhzE9o","2021-07-02",16838
"7 Python Code Smells: Olfactory Offenses To Avoid At All Costs","https://www.youtube.com/watch?v=LrtnLEkOwFE","2021-06-25",322262
"Do we still need dataclasses? // PYDANTIC tutorial","https://www.youtube.com/watch?v=Vj-iU-8_xLs","2021-06-18",148528
"Why COMPOSITION is better than INHERITANCE - detailed Python example","https://www.youtube.com/watch?v=0mcP8ZpUR38","2021-06-11",202924
"🎙 Interview with Sybren Stüvel, developer @ Blender 3D","https://www.youtube.com/watch?v=yrH0lWPGXsc","2021-06-08",5805
"Going all-in on software design in Python + an ANNOUNCEMENT 🎙","https://www.youtube.com/watch?v=F_Yn7nLaldw","2021-06-04",7912
"7 UX Design Tips for Developers","https://www.youtube.com/watch?v=uAQAgPSwZf0","2021-05-28",17116
"CODE ROAST: Yahtzee - New Python code refactoring series!","https://www.youtube.com/watch?v=l7E3y4te7sA","2021-05-21",61851
"Dependency INVERSION vs dependency INJECTION in Python","https://www.youtube.com/watch?v=2ejbLVkCndI","2021-05-14",109570
"If you're not using Python DATA CLASSES yet, you should 🚀","https://www.youtube.com/watch?v=vRVVyl9uaZc","2021-05-07",290753
"QUESTIONABLE object creation patterns in Python 🤔","https://www.youtube.com/watch?v=Rm4JP7JfsKY","2021-04-30",56882
"Uncle Bob's SOLID principles made easy 🍀 - in Python!","https://www.youtube.com/watch?v=pTB30aXS77U","2021-04-23",211687
"Why you should think about SOFTWARE ARCHITECTURE in Python 💡","https://www.youtube.com/watch?v=ihtIcGkTFBU","2021-04-16",56010
"GW BASIC games I wrote when I was a kid 🎮 Running 30 year old code","https://www.youtube.com/watch?v=HBeo3tGwLmY","2021-04-09",13416
"Monadic error handling in Python ⚠ Write better Python code part 7b","https://www.youtube.com/watch?v=J-HWmoTKhC8","2021-04-02",35615
"Exception handling tips in Python ⚠ Write better Python code part 7","https://www.youtube.com/watch?v=ZsvftkbbrR0","2021-03-26",101052
"Channel trailer ArjanCodes - March 2021","https://www.youtube.com/watch?v=OLDednK-zwA","2021-03-22",22727
"1000 subscribers! 🚀 WHY I started this channel and WHAT'S NEXT","https://www.youtube.com/watch?v=PP808csBLyc","2021-03-19",3837
"Two UNDERRATED design patterns 💡 Write BETTER PYTHON CODE Part 6","https://www.youtube.com/watch?v=t0mCrXHsLbI","2021-03-12",58920
"100% CODE COVERAGE - think you're done? Think AGAIN.☝","https://www.youtube.com/watch?v=jmP3fp_BhmE","2021-02-26",31821
"Observer Pattern Tutorial: I NEVER knew events were THIS powerful 🚀","https://www.youtube.com/watch?v=oNalXg67XEE","2021-02-19",164067
"Build a GLASSMORPHISM React component - Typescript & Material-UI","https://www.youtube.com/watch?v=IHHK46a9wM4","2021-02-12",7133
"The strategy pattern: write BETTER PYTHON CODE Part 3","https://www.youtube.com/watch?v=WQ8bNdxREHU","2021-02-05",85723
"Dependency inversion: write BETTER PYTHON CODE Part 2","https://www.youtube.com/watch?v=Kv5jhbSkqLE","2021-01-29",65283
"Cohesion and coupling: write BETTER PYTHON CODE Part 1","https://www.youtube.com/watch?v=eiDyK_ofPPM","2021-01-22",186227
"FROM PRODUCT IDEA TO SOFTWARE - turn your idea into reality in a few steps","https://www.youtube.com/watch?v=G2F0evNym5s","2021-01-08",6372
"Full stack WEB DEVELOPMENT in 2021 - the ULTIMATE tech stack for FAST web app development","https://www.youtube.com/watch?v=rDbGlE42MOc","2020-12-18",25392
