"Title","video_url","Published_date","Views"
"The Advertising Industry Is About To Change FOREVER - Are You Ready? 😱","https://www.youtube.com/watch?v=QaivfzdXK3I","2023-05-31",2028
"Use The Content Strategy Your Competitors Use To DOMINATE TikTok Ads!","https://www.youtube.com/watch?v=NXerAcDVuH4","2023-05-30",1561
"E-commerce Intelligence: Leveraging 7 Must-Have GA4 Custom Reports","https://www.youtube.com/watch?v=0962qL0RYFs","2023-05-30",5472
"Meta Is Coming After Twitter - Check Out How 😱","https://www.youtube.com/watch?v=9w6WBApgQUU","2023-05-30",2346
"Alternative Marketing Methods Outperforming AI","https://www.youtube.com/watch?v=yD9STLejnbk","2023-05-29",2989
"The Biggest Chink In ChatGPT’s Armor EXPOSED! 😱","https://www.youtube.com/watch?v=AUTb6_21Xa8","2023-05-28",6137
"The 2 Keys To My Success As An Investor 🔑","https://www.youtube.com/watch?v=8bVKeikOPEU","2023-05-28",2392
"Navigating Growth: Essential Tips for Expanding Your Small Business","https://www.youtube.com/watch?v=luLpx7-Pdtg","2023-05-27",2954
"Major UPGRADE Alert 🚨: Google Merchant Center is getting revamped!","https://www.youtube.com/watch?v=wiLikcvbMTo","2023-05-26",2953
"HUGE News for Google Advertisers: New Campaign Types Just Dropped 🙌","https://www.youtube.com/watch?v=QNMTENR5JAY","2023-05-26",3465
"Impactful Marketing: Why You Should Incorporate Giving Back into Your Strategy","https://www.youtube.com/watch?v=jNjE5CGiULs","2023-05-25",2354
"Marketing DO’S And DON’TS: Part 2 (SEO Explained)!","https://www.youtube.com/watch?v=D3wK9BLgC68","2023-05-24",2979
"What I Think The Future Of Google Will Look Like For Digital Marketers","https://www.youtube.com/watch?v=r5OME_l9tzo","2023-05-23",2025
"The DO’S And DON’TS Of Marketing: Part 1 (Omnichannel Approach Explained)!","https://www.youtube.com/watch?v=hWrIXD1BIMQ","2023-05-23",901
"E-commerce Intelligence: Leveraging 7 Must-Have GA4 Custom Reports","https://www.youtube.com/watch?v=0962qL0RYFs","2023-05-22",0
"Unlocking Success: Omnichannel Strategies for 2023","https://www.youtube.com/watch?v=OfZ1WFGpMRs","2023-05-22",2115
"Google Ads Is Axing Several Features In The Next Month","https://www.youtube.com/watch?v=u1q7bThRLi0","2023-05-21",3518
"The 7-Step Process I Use To Rank Higher On Google: Part 2","https://www.youtube.com/watch?v=3MWz3pVHZSc","2023-05-21",3857
"New to Digital Marketing: 10 Essential Tips for a Strong Start","https://www.youtube.com/watch?v=4abNIEHj-10","2023-05-20",5872
"The 7-Step Process I Use To Rank Higher On Google: Part 1","https://www.youtube.com/watch?v=jYhhiOJUCWo","2023-05-19",4006
"This Isn’t Your Grandparent’s Shopping Experience (But It Is YOURS)!","https://www.youtube.com/watch?v=8MKsu-AxBKg","2023-05-19",3846
"My Secrets To Creating an SEO Friendly Website","https://www.youtube.com/watch?v=5I1hXX_xz7c","2023-05-18",14650
"My SEO Strategy That Saves At Least 4 Hours Every Month!","https://www.youtube.com/watch?v=rBSR5vu6lkM","2023-05-16",3144
"My SEO Strategy That Saves At Least 4 Hours Every Month!","https://www.youtube.com/watch?v=rBSR5vu6lkM","2023-05-16",5440
"Ugly Truths In Marketing You NEED TO KNOW For Your Business To Succeed!","https://www.youtube.com/watch?v=0C6_dPRcQd0","2023-05-16",2939
"Ugly Truths In Marketing You NEED TO KNOW For Your Business To Succeed!","https://www.youtube.com/watch?v=0C6_dPRcQd0","2023-05-16",4518
"Affiliate Marketing Shortcuts that can be Applied to Every Business","https://www.youtube.com/watch?v=8sLtjHs47Yg","2023-05-15",6153
"Webinars for Sales Funnel: A Guide to Understanding the Ins and Outs","https://www.youtube.com/watch?v=AJ79QnKgvDA","2023-05-15",2256
"Webinars for Sales Funnel: A Guide to Understanding the Ins and Outs","https://www.youtube.com/watch?v=AJ79QnKgvDA","2023-05-15",2610
"Affiliate Marketing Shortcuts that can be Applied to Every Business","https://www.youtube.com/watch?v=8sLtjHs47Yg","2023-05-15",7345
"Your Online Reputation Is EVERYTHING In Today’s Digital Landscape!","https://www.youtube.com/watch?v=VCoyZ8lKDZI","2023-05-14",1294
"Marketing Fads Can Only Get You So Far (Master The FUNDAMENTALS First)!","https://www.youtube.com/watch?v=Et-P2BdSNwE","2023-05-14",1167
"Human Intelligence vs Artificial Intelligence: Winning at Content Creation","https://www.youtube.com/watch?v=C2PH3lG8d9Q","2023-05-13",9463
"Chances Are Your Goals As An Entrepreneur Are ALL WRONG!","https://www.youtube.com/watch?v=zokngUSMHP8","2023-05-12",2465
"Keeping Up With Google’s Algorithm Updates Is IMPOSSIBLE! (Do THIS Instead)","https://www.youtube.com/watch?v=gMLohVabRNk","2023-05-12",2681
"Social Media Strategies to Connect with Your B2C Audience","https://www.youtube.com/watch?v=UK67TiEOEXM","2023-05-11",3488
"LinkedIn’s Latest AI-Collaborative Feature Is A GAME-CHANGER For Industry Experts And Marketers!","https://www.youtube.com/watch?v=_ciULrbNiso","2023-05-10",2270
"Single And Ready To Mingle? Google’s Got Your Back! 👀","https://www.youtube.com/watch?v=dPD0Y1YF6is","2023-05-09",4017
"Google’s Super Secret AI Project Has Been REVEALED! (PROJECT MAGI)😱","https://www.youtube.com/watch?v=-lo7rLfd7Ro","2023-05-09",4150
"The Transformation of Marketing: New Challenges and Opportunities","https://www.youtube.com/watch?v=eJ293rSqnZI","2023-05-08",4448
"Move Aside ChatGPT - There’s An Even BETTER AI Tool On The Horizon!","https://www.youtube.com/watch?v=_dor7N2AaRQ","2023-05-07",5946
"Why I Feel Investing In Real Estate Is A Mistake","https://www.youtube.com/watch?v=XTLHQGdcxsY","2023-05-06",2989
"Project Magi Is Coming - Is Your SEO Strategy Optimized For it?","https://www.youtube.com/watch?v=5z_JCCnwOc0","2023-05-05",4603
"Could Lemon8 Truly Replace TikTok As “The App?”","https://www.youtube.com/watch?v=8YE1wbZ3ubk","2023-05-05",2791
"The Power of AI: Discovering Its True Capabilities","https://www.youtube.com/watch?v=lA55yrabOSQ","2023-05-04",10681
"Google Wants You To Invest In SEO!","https://www.youtube.com/watch?v=xAaF2ioKx_g","2023-05-03",6370
"Affiliate Marketing Shortcuts that can be Applied to Every Business","https://www.youtube.com/watch?v=8sLtjHs47Yg","2023-05-03",0
"A Sure-Fire Content Creation Strategy For Those “Too Busy” To Create Content!","https://www.youtube.com/watch?v=l_adOZbhJjc","2023-05-02",3501
"Is Twitter REALLY A Sinking Ship?","https://www.youtube.com/watch?v=kfd6jOp9MD4","2023-05-02",4434
"Tips for Beginner Angel Investors","https://www.youtube.com/watch?v=f6NHHY0LAJs","2023-05-01",1634
"Does The YouTube Algorithm Hate You Or Is Your Content Not As Optimized As You Think It Is?","https://www.youtube.com/watch?v=TcN6V5hnkco","2023-04-30",2546
"Will Google’s Latest Algorithm Update Hurt Your Website Rankings? (Here’s How To Tell)!","https://www.youtube.com/watch?v=Zo1Z0chPmvE","2023-04-30",4564
"How to Build a Strong Personal Brand in Business","https://www.youtube.com/watch?v=rifqO7we8uo","2023-04-29",5791
"My FAVORITE Chrome Extensions To Save Time On Daily SEO Tasks!","https://www.youtube.com/watch?v=bNVOQM6rdY0","2023-04-28",5264
"Revolutionizing Marketing with AI: The Future is Here","https://www.youtube.com/watch?v=l_U4aQTj6Mg","2023-04-27",24737
"If You Are B2B, TikTok Is Where It’s At! (Here’s Why)","https://www.youtube.com/watch?v=fvyuZ_ghXwQ","2023-04-27",3737
"SEO Is FAR From Dead (Here’s How I Know)!","https://www.youtube.com/watch?v=-Bgds1IBXEQ","2023-04-25",8873
"Proven Tactics: Lessons Learned from Our Most Successful Clients","https://www.youtube.com/watch?v=bG6SvSWBC2Y","2023-04-25",3367
"TikTok Has Yet Another Trick Up It’s Sleeve To Compete With Google As A Search Engine.","https://www.youtube.com/watch?v=CKwAeSG5Txs","2023-04-25",3858
"Accelerate Your Business Success: Key Strategies for Entrepreneurs","https://www.youtube.com/watch?v=tJekpDfTp00","2023-04-24",3585
"The Simplest Way To Make Content Your Audience WANTS TO SEE!","https://www.youtube.com/watch?v=kZb8Ig5Sx8E","2023-04-23",5995
"If You Don’t Text Your Customers, You Should! (If You’re Doing This)🙌🏻","https://www.youtube.com/watch?v=XPzWmxJ6ZVU","2023-04-23",2952
"Essential Business Tips to Accelerate Your Companies Growth","https://www.youtube.com/watch?v=jI34N2EUHCI","2023-04-22",3798
"A Copywriting Trick To Improve Your Sales In The Next 30 Days!","https://www.youtube.com/watch?v=8k_oAoZE2hs","2023-04-21",5289
"Does Google Care If AI Writes All Your Content?","https://www.youtube.com/watch?v=Ilbpt-qD4SU","2023-04-21",9845
"Mind Blowing Marketing Experiments  Unconventional Tactics Tried by a Marketing Guru","https://www.youtube.com/watch?v=xtYv67lnlzk","2023-04-20",9502
"Google Is Stepping Into The AI Game In A BIG WAY! (Check Out These Updates)","https://www.youtube.com/watch?v=Jyea52DeIps","2023-04-18",5084
"Proven Tips for Captivating Audiences and Boosting Business Growth","https://www.youtube.com/watch?v=D74zHhxQ1RE","2023-04-17",3347
"The Art of Digital Marketing","https://www.youtube.com/watch?v=ExV24jFfi_g","2023-04-15",7845
"Marketing Advice For Young People: Neil Patel & David Meltzer","https://www.youtube.com/watch?v=iGh3juV5scM","2023-04-14",3615
"The Ultimate Guide to Launching Your Online Business","https://www.youtube.com/watch?v=awqqrgkP8G8","2023-04-10",5907
"Rich Kids Vs. Poor Kids | Who Is More Likely To Be Successful?","https://www.youtube.com/watch?v=L4Qm2Ho-cbE","2023-04-09",7865
"5 MUST-HAVE AI Tools For Marketers And Copywriters!","https://www.youtube.com/watch?v=qQH2XWtTsSw","2023-04-09",12511
"Top Skills Every Marketer Needs","https://www.youtube.com/watch?v=vpLR23NlO40","2023-04-08",6200
"An Easy Strategy To Exponentially Grow Your Personal Brand!","https://www.youtube.com/watch?v=aE4pUkFtAnU","2023-04-07",5838
"3 Marketing Fundamentals To Make You A Great Marketer!","https://www.youtube.com/watch?v=BR7g5G8YY6k","2023-04-07",7731
"Digital Marketing Tips for 2023","https://www.youtube.com/watch?v=Ji5urXQRoLo","2023-04-06",8607
"The Dark Side Of Entrepreneurship You Need To Brace Yourself For!","https://www.youtube.com/watch?v=9f8sK5IOaEk","2023-04-04",5974
"The 2023 Marketing Opportunity You Need To Jump On To Make More Money!","https://www.youtube.com/watch?v=DmabAWEimrw","2023-04-04",6943
"Future-Proof Your Content Strategy in the Age of AI","https://www.youtube.com/watch?v=8NBFZE3EOBY","2023-04-03",17835
"One Mistake All Entrepreneurs Need To AVOID!","https://www.youtube.com/watch?v=2nBTrHetrRE","2023-04-02",10427
"How Responding To DMs Creates Customers!","https://www.youtube.com/watch?v=yUmnweF-xOA","2023-04-02",4428
"Get More Traffic Now: Insider Tips for Success","https://www.youtube.com/watch?v=eL3aif7oF6c","2023-04-01",6328
"The Next Big Job In The Marketing World Is Here! | Copywriters Vs. AI","https://www.youtube.com/watch?v=FmSSgiqaMXU","2023-03-31",7419
"Your Niche Is Why You Struggle To Make $1,000,000+ | FIX THIS NOW!","https://www.youtube.com/watch?v=iws0QMe1djs","2023-03-31",7975
"Growth Hacks: How to Scale in Record Time","https://www.youtube.com/watch?v=fslIfiEouqs","2023-03-30",10377
"How To Use Disney’s Genius Marketing Strategy For Your Own Marketing!","https://www.youtube.com/watch?v=Pi8uQWcp5hM","2023-03-29",4892
"I Have Big Plans In The Works! | My 2023 Marketing Resolutions! 😏","https://www.youtube.com/watch?v=NKCeMW1j6Jk","2023-03-28",6778
"Avoid These Google Ad Mistakes If You Want To See Any Revenue!","https://www.youtube.com/watch?v=q3KAYgUYJ0Q","2023-03-28",12732
"How to Create User-Focused Content That Converts","https://www.youtube.com/watch?v=01qUWcCw1xw","2023-03-27",5654
"ChatGPT Cannot Kill Google Search Or Google Ads (Here’s Why)","https://www.youtube.com/watch?v=j7_bnj_0W7I","2023-03-26",8347
"Google vs. ChatGPT: There Can Be Only One! (How Google Will Destroy ChatGPT)","https://www.youtube.com/watch?v=kTX64TS8A-A","2023-03-26",14405
"Common Marketing Mistakes to Avoid: Tips for New Marketers","https://www.youtube.com/watch?v=4q9l-x2RSMg","2023-03-25",4795
"ChatGPT Won’t Help You Rank On Google (But This Will!)","https://www.youtube.com/watch?v=1UzfFAf1lZk","2023-03-24",13345
"Move Over Gen Z: There’s A New Target Audience In Town!","https://www.youtube.com/watch?v=NhxboIKIHL8","2023-03-24",7014
"Proven Secrets and Strategies for Effortless Blogging","https://www.youtube.com/watch?v=YXRuz23PPjw","2023-03-23",16707
"Your Website Load Time Is Costing You Money (Fix These Things For Faster Load Times!)","https://www.youtube.com/watch?v=y-d0CWvy4-w","2023-03-22",5769
"Why Content Scaling Is Not Hard 🙄","https://www.youtube.com/watch?v=gVxgC2kGsEE","2023-03-21",7317
"How To Make Millions Of Dollars Posting To LinkedIn 🚀","https://www.youtube.com/watch?v=7e7HAwUtK3k","2023-03-21",7941
"Overcoming Marketers' 5 Toughest Challenges","https://www.youtube.com/watch?v=C5Z1kD_aNcA","2023-03-20",3922
"1,000 New Customers Or 100 Returning Customers: Which Is Better For Your Business??","https://www.youtube.com/watch?v=uMp_8Q7YPOs","2023-03-19",4577
"This One Marketing Mistake Is Costing You Money (Fix It Now!)","https://www.youtube.com/watch?v=wvfMceYtwro","2023-03-19",4452
"From Novice to Expert  Easy Tips to Master Digital Marketing","https://www.youtube.com/watch?v=hON3LkphygI","2023-03-18",7167
"TikTok Or YouTube: Which Is Better For Marketing?","https://www.youtube.com/watch?v=dJwzonRwnp0","2023-03-17",4089
"The One Thing More Important Than SEO And PPC For Building A Huge Business!","https://www.youtube.com/watch?v=2PGhPS_sqas","2023-03-17",6433
"Fuel Your Motivation and Stay on Top of Marketing Trends","https://www.youtube.com/watch?v=-bqBAljfpXo","2023-03-16",4129
"The Easiest SEO Strategy To Rank Your Website Higher In Google #shorts #websiteranking","https://www.youtube.com/watch?v=BFIQncD9Vk0","2023-03-15",17095
"An SEO Strategy That Can Get You 500 Million Website Visitors A Month #shorts #seostrategy","https://www.youtube.com/watch?v=eDJhFO-srxM","2023-03-15",8179
"Google’s New Feature Will Help You Make More Money! #shorts #googlefeatures","https://www.youtube.com/watch?v=hAQiKdz8glg","2023-03-14",5945
"B2B Vs B2C SEO: Is There A Real Difference? #shorts #seotips","https://www.youtube.com/watch?v=huDOMiu4c6Y","2023-03-14",2813
"5 Marketing Predictions for 2023","https://www.youtube.com/watch?v=l3a-sdRL5Ns","2023-03-13",18483
"Google Search Results Listings Will Change In 2023 (Here’s How) #shorts #googlesearch","https://www.youtube.com/watch?v=7ThMew7SeuA","2023-03-12",9920
"My Take On Using Celebrity Endorsements For Marketing Campaigns #shorts #marketing","https://www.youtube.com/watch?v=YjyhQdkQAfg","2023-03-12",4248
"7 Steps to Ranking Number 1 on YouTube","https://www.youtube.com/watch?v=8kPi1U9PE8M","2023-03-11",17779
"I Spent $8.6 Million To Buy AnswerThePublic! (Here's Why) #shorts #marketing","https://www.youtube.com/watch?v=mvXcOC3exOA","2023-03-10",4160
"A Big Change Is Coming In SEO (You Have 3-6 Months To Prepare!) #shorts #seo","https://www.youtube.com/watch?v=AjmHQARiv9M","2023-03-10",34366
"5 Mistakes (Almost) Every New Marketer Makes","https://www.youtube.com/watch?v=R9QMSQQPV8Y","2023-03-09",5756
"Prepare For These 2023 Social Media Trends Before It's Too Late! #shorts #socialmediatrends","https://www.youtube.com/watch?v=5oYTXeF3PT8","2023-03-08",4289
"A Marketing Tip That Will Improve Your Copywriting and Drive More Sales! #shorts #marketingtip","https://www.youtube.com/watch?v=Z8OWUSORiEg","2023-03-08",4134
"How To Give Your Customers What They REALLY Want Without Them Telling You! #shorts #digitalmarketing","https://www.youtube.com/watch?v=p8wUA1rHpDM","2023-03-07",6060
"What Human Written Content And Vintage Cars Have In Common (Thanks To AI) #shorts #contentwriting","https://www.youtube.com/watch?v=H3CbeldKNBM","2023-03-07",3484
"Implement My Content Strategy Today To Be Sucessful In 2023! #shorts #contentstrategy","https://www.youtube.com/watch?v=xMFN18bTxr8","2023-03-06",2443
"My 5 Favorite PPC Strategies","https://www.youtube.com/watch?v=Pk4n-Ecr-lI","2023-03-06",4917
"Here’s The New Equation For Ranking Higher On Google! #shorts #googleupdate","https://www.youtube.com/watch?v=9ha2KvdabV4","2023-03-05",4128
"I Found The 50 Most Visited Websites So You Don’t Have To (Here’s What I Found) #shorts #marketing￼￼","https://www.youtube.com/watch?v=LQK7ewjbLuc","2023-03-05",17713
"Step-by-Step Strategy I Use to Drive 1 Million Visitors to My Blog Per Month","https://www.youtube.com/watch?v=1DWuQiVh7A4","2023-03-04",21244
"AI-Written Content VS Human-Written Content (Which One Google Ranks Higher) #shorts #google","https://www.youtube.com/watch?v=Z8yMMrO5S8Y","2023-03-03",5952
"The ONLY Future You Should Be Worried About! #shorts #future","https://www.youtube.com/watch?v=5v9V74CqHnI","2023-03-03",3339
"5 Ways to Eliminate Wasted Ad Spend","https://www.youtube.com/watch?v=Fd6mbzrXMu0","2023-03-02",4537
"How To Build A Personal Brand From Scratch In 2023! #shorts #personalbrand","https://www.youtube.com/watch?v=oY1b-Jj1mBc","2023-03-01",5973
"Will AI Replace Humans?? (The Answer Might Surprise You) #shorts #aitools","https://www.youtube.com/watch?v=1tcggst93iU","2023-03-01",5113
"My Company NP Digital Manages Over $500 Million In Ads! #shorts #digitalmarketing","https://www.youtube.com/watch?v=xoXPNvJ8aOk","2023-02-28",4438
"If You Have Trolls On Your Socials - GOOD! (Use Their Hate To Grow Faster)! #shorts #socialmedia","https://www.youtube.com/watch?v=4ooy8QAQ07I","2023-02-28",2270
"7 Tools to Write Content Faster","https://www.youtube.com/watch?v=b2RLM1QqdC0","2023-02-27",13367
"Prepare For These 2023 Social Media Trends Before It's Too Late! #shorts #socialmedia","https://www.youtube.com/watch?v=z74xcu4jIrU","2023-02-26",7603
"How To Make Millions! (You Only Need an iPad📱)#shorts #businessadvice","https://www.youtube.com/watch?v=S0JXdmzbK0c","2023-02-26",4234
"My Ultimate (Quick) Traffic Hack","https://www.youtube.com/watch?v=icTly7cEVPA","2023-02-25",24806
"Implement My Content Strategy Today To Be Sucessful In 2023! #shorts #contentstrategy","https://www.youtube.com/watch?v=CzykQsoxei4","2023-02-24",3819
"Two Marketing Strategies With MASSIVE ROI! #shorts #marketingstrategy","https://www.youtube.com/watch?v=6YyaPJm5TG8","2023-02-24",2895
"What I Wish I Knew When I Started My Blog","https://www.youtube.com/watch?v=2L4Jh0Ra7Rk","2023-02-23",6048
"If You Are A Marketer, This Site Will CHANGE YOUR LIFE! #shorts #marketing","https://www.youtube.com/watch?v=Gigq_NXaWww","2023-02-22",4395
"Kids Are Using ChatGPT To Plagiarize (And Teachers Shouldn't Care!) #shorts #chatgpt","https://www.youtube.com/watch?v=JeSw92VvJ_g","2023-02-22",11566
"How Elon Musk Bought Twitter In A Bad Market! #shorts #elonmusk","https://www.youtube.com/watch?v=hoNyDkwgh4U","2023-02-21",2987
"It's Time To Clear The Air About How I Feel About ChatGPT! #shorts #chatgpt","https://www.youtube.com/watch?v=lk2RhOC1nXo","2023-02-21",3502
"How to Optimize TikTok for SEO","https://www.youtube.com/watch?v=OsBevfjL_7I","2023-02-20",5874
"❌ Is Your Company Making These Mistakes? ❌ #shorts #businessadvice","https://www.youtube.com/watch?v=ZiSvYcceKa0","2023-02-19",2997
"How Much Money Would It Take For Me To Sell My Companies? (Hint: BIG $$$)😂 #shorts #businessadvice","https://www.youtube.com/watch?v=yK_L9oiT_cc","2023-02-19",2233
"My Favorite Customer Service Tip","https://www.youtube.com/watch?v=-mrmzlZcfmE","2023-02-18",3772
"Two Marketing Strategies With MASSIVE ROI! #shorts #marketingstrategy","https://www.youtube.com/watch?v=33_KxOFkBI0","2023-02-17",2969
"This Is Something Marketers Should NOT Do! #shorts #advertising","https://www.youtube.com/watch?v=qqmXD-2OkNM","2023-02-17",2434
"How to Use Customer Surveys to Boost Your Conversions","https://www.youtube.com/watch?v=4bXDMgc4O_w","2023-02-16",3053
"How To Stay Ahead Of Google Updates To Rank Higher! #shorts #google","https://www.youtube.com/watch?v=77MTJR0jtVM","2023-02-15",2558
"99% Of All Social Media Campaigns FAIL! (Here’s Why) #shorts #socialmedia","https://www.youtube.com/watch?v=lH0m0dA4dRw","2023-02-15",16561
"You're Losing Views Every Day You Aren't Doing This! #shorts #videoseo","https://www.youtube.com/watch?v=tE71g7YvNuw","2023-02-14",4422
"Becoming A Husband And Father Made Me A Better Entrepreneur! #shorts #entrepreneur","https://www.youtube.com/watch?v=9F-8Rj7abfk","2023-02-14",2932
"A Simple Way to Boost Your Amazon SEO","https://www.youtube.com/watch?v=J2RqIpeo6vc","2023-02-13",6977
"This SEO Mistake Is Why You Aren't Ranking Higher On Google! #shorts #seo","https://www.youtube.com/watch?v=Z6aeoRd1Cn0","2023-02-12",4003
"Super Bowl Ads Have The WORST ROI In Advertising (Here’s Why) #shorts #Superbowl","https://www.youtube.com/watch?v=R6zwPMR5n8Y","2023-02-12",3808
"Avoid This Email Marketing Strategy At All Costs","https://www.youtube.com/watch?v=GAwYtycQYoM","2023-02-11",7820
"Attract The RIGHT KIND Of Social Media Engagement #shorts #socialmedia","https://www.youtube.com/watch?v=meuQprpMFRc","2023-02-10",3440
"This Is Something Marketers Should NOT Do! #shorts #advertising","https://www.youtube.com/watch?v=CeXRREOxwBg","2023-02-10",2396
"This Low Effort Social Strategy Brings in a Ton of ROI","https://www.youtube.com/watch?v=dKn45bP4eZg","2023-02-09",5217
"My Opinion On Investing In Real Estate (Should You Do It?) #shorts #realestate","https://www.youtube.com/watch?v=ae8hou_6_pA","2023-02-08",3208
"Over 8,000 Companies Have Spoken (How To Spend Marketing Money In 2023!) #shorts #digitalmarketing","https://www.youtube.com/watch?v=DR_Csw7WvkE","2023-02-08",2860
"THIS Mr. Beast Title Hack Will Help Your Videos Go Viral! #shorts #mrbeast","https://www.youtube.com/watch?v=yjDvQnZ1Trs","2023-02-07",5170
"4 Steps To Create Over 300 Social Media Content Ideas! #shorts #keywordresearch","https://www.youtube.com/watch?v=47m2g7op2sM","2023-02-07",5781
"This Helped Me Get More Traffic Right Away","https://www.youtube.com/watch?v=jpa-ZNFo4gQ","2023-02-06",14961
"Cardi B Is NOT A Good Businesswoman! #shorts #marketing","https://www.youtube.com/watch?v=yH4m0bMqzsQ","2023-02-05",5260
"Steal My FAVORITE Digital Marketing Tip For Increasing Website Traffic! #shorts #digitalmarketingtip","https://www.youtube.com/watch?v=eU_gUwEYaFk","2023-02-05",5539
"3 Easy Ways to Boost Conversions","https://www.youtube.com/watch?v=4EmDUxOT6c8","2023-02-04",6358
"I Made $20,000/Month At 16 By Understanding Google! #shorts #google","https://www.youtube.com/watch?v=UZrWcBma-bQ","2023-02-03",4206
"This SEO Mistake Is Why You Aren't Ranking Higher On Google! #shorts #seo","https://www.youtube.com/watch?v=rY9UQw7luFQ","2023-02-03",9850
"Do This Before Google’s Next Algorithm Update","https://www.youtube.com/watch?v=KE2REzss-0w","2023-02-02",15752
"How Google Is Improving Searches With Broad Match Keywords! #shorts #keywords","https://www.youtube.com/watch?v=_fU68RzJqCQ","2023-02-01",2680
"Over 8,000 Companies Have Spoken (How To Spend Marketing Money In 2023!) #shorts #digitalmarketing","https://www.youtube.com/watch?v=2J4SMP9SmOU","2023-02-01",3143
"4 Steps To Create Over 300 Social Media Content Ideas! #shorts #keywordresearch","https://www.youtube.com/watch?v=m9TxgA-VCmY","2023-01-31",20462
"Is TikTok Really Getting Banned In The US? #shorts #tiktok","https://www.youtube.com/watch?v=FoTwF7ljo88","2023-01-31",3159
"My 7 Favorite SEO Strategies","https://www.youtube.com/watch?v=KB5GQYUW6IU","2023-01-30",10893
"Watch This BEFORE You Spend Another Marketing Dollar in 2023! #shorts #marketing","https://www.youtube.com/watch?v=WZ6UZ_ju47o","2023-01-29",5575
"What Gary Vee DOESN'T Do (But I Do Well!) #shorts #marketing","https://www.youtube.com/watch?v=5eGLVOwJHhI","2023-01-29",4718
"The Right Way to Segment Your Content","https://www.youtube.com/watch?v=-v3dJ5ID_s8","2023-01-28",9390
"Are Search Engines Getting Worse? #shorts #searchengine","https://www.youtube.com/watch?v=Be56SRaUR78","2023-01-27",3985
"I Made $20,000/Month At 16 By Understanding Google! #shorts #google","https://www.youtube.com/watch?v=M4g352loOZA","2023-01-27",8274
"Want to Increase Revenue in 2023? SELL LESS! #shorts #sales","https://www.youtube.com/watch?v=lpqvOtIY-no","2023-01-25",7053
"This Is What Everyone Gets WRONG About TikTok Vs. YouTube! #shorts #youtube","https://www.youtube.com/watch?v=aS9PtWHbz9M","2023-01-25",5979
"Smaller Phone = Success As An Entrepreneur!? #shorts #entrepreneur","https://www.youtube.com/watch?v=3Vhvk30xEgw","2023-01-24",5466
"ChatGPT's Days Are Numbered! #shorts #chatgpt","https://www.youtube.com/watch?v=JUAKjdnKndI","2023-01-24",13143
"This is What Your Marketing Mindset Should ALWAYS Be","https://www.youtube.com/watch?v=OPsSGhMfiv4","2023-01-23",5495
"This Email Marketing Tip Takes 10 Minutes","https://www.youtube.com/watch?v=1CE5TYipgAA","2023-01-23",3286
"How I Built a Website That Generates 4 Million Visitors a Month","https://www.youtube.com/watch?v=7mMFfJE8cEc","2023-01-21",21006
"My Favorite Webinar Tip","https://www.youtube.com/watch?v=xEtsliDozvQ","2023-01-20",3227
"Neil Patel's Double-Your-Traffic Master Class","https://www.youtube.com/watch?v=nKETvpq0kZU","2023-01-20",8828
"Don't Be Like Baskin Robbins! #shorts #marketingstrategy","https://www.youtube.com/watch?v=VEcfyI1_DOg","2023-01-18",2946
"Does Being Good On Camera Impact Your Success On Social Media? #shorts #socialmedia","https://www.youtube.com/watch?v=WlAbCRiggdY","2023-01-17",3981
"chatGPT Is TERRIBLE For Email Marketing! #shorts #chatgpt","https://www.youtube.com/watch?v=rpV2jhb5TQ8","2023-01-17",10072
"Do This Email Marketing Strategy for 100 Days","https://www.youtube.com/watch?v=A4wg8gF5GU8","2023-01-16",8067
"Watch This Video Only If You Want To Boost Your Website Conversions...#shorts #digitalmarketing","https://www.youtube.com/watch?v=AYGGrrTb4o8","2023-01-15",3241
"Turn On PUSH NOTIFICATIONS To Get More Traffic! #shorts #websitetraffic","https://www.youtube.com/watch?v=I8XFcrF1o1c","2023-01-15",3392
"The Best Way to Use WordPress","https://www.youtube.com/watch?v=iyuxWZ--5-8","2023-01-14",16238
