"Title","video_url","Published_date","Views"
"Mastering Email Marketing: Here’s What’s Working NOW - Email Marketing Unlocked","https://www.youtube.com/watch?v=-dosxMP3lhE","2021-02-06",15582
"3X Your Email Results By Applying These Frameworks & Workflows Hacks - Email Marketing Unlocked","https://www.youtube.com/watch?v=LqFX-81m2Qk","2021-02-04",10045
"How to Maximize Your Customer Lifetime Value with Email Marketing - Email Marketing Unlocked","https://www.youtube.com/watch?v=nhfs2dyx9Cg","2021-02-01",10270
"High-Converting Workflows & Sequences That You Can Copy, Paste & Send  - Email Marketing Unlocked","https://www.youtube.com/watch?v=S4HcIG1lv2w","2021-01-30",30927
"Lead Generation Tactics I Used To Acquired Over 2 Million Subscribers - Email Marketing Unlocked","https://www.youtube.com/watch?v=dG-6A8_R_MY","2021-01-28",25696
"How To Go From Zero to 50,000 Email Subscribers - With Email Marketing Unlocked","https://www.youtube.com/watch?v=Gxd4NeKQg58","2021-01-25",42689
"How to Find All the Keywords That Your Competitors Rank For (But That You Don't)","https://www.youtube.com/watch?v=vF1URMDVO7A","2021-01-23",23294
"How to Optimize Your Website in Less Than 30 Minutes","https://www.youtube.com/watch?v=gKGtX4PNu0g","2021-01-21",43856
"How to Find Lucrative Link-Building Opportunities in Under 60 Seconds","https://www.youtube.com/watch?v=MFLXnMh-BHo","2021-01-18",12270
"How Content Marketing Will Change in 2023","https://www.youtube.com/watch?v=OZNVuHfQ4IA","2021-01-16",61494
"How SEO Will Change in 2023","https://www.youtube.com/watch?v=RjIs4S2z1W0","2021-01-14",75312
"How Digital Marketing Will Change in 2023","https://www.youtube.com/watch?v=KzRka1lpdb4","2021-01-11",216214
"Growing Your Brand on Facebook - Module 2 - Lesson 3 - Facebook Unlocked","https://www.youtube.com/watch?v=NWMkd58lxSQ","2021-01-09",12139
"The Beginner's Guide to Facebook Ads - Module 2 - Lesson 2 - Facebook Unlocked","https://www.youtube.com/watch?v=IuS6CO14e1s","2021-01-07",18470
"How to Get More Organic Reach & Visibility on Facebook - Module 2 - Lesson 1 - Facebook Unlocked","https://www.youtube.com/watch?v=RpVx_sLP9os","2021-01-04",36072
"The Highest Reach and Engagement Content Types - Module 1 - Lesson 3 - Facebook Unlocked","https://www.youtube.com/watch?v=QyJziMOSN_8","2020-12-28",23282
"Setting Up Your Business on Facebook - Module 1 - Lesson 2 - Facebook Unlocked Course","https://www.youtube.com/watch?v=g5UXuPp62VQ","2020-12-24",29349
"My FREE Facebook Marketing Course - Facebook Unlocked - Getting Started - Module 1 - Lesson 1","https://www.youtube.com/watch?v=LInnulL_6is","2020-12-21",50876
"How to Grow Your SEO Traffic by Updating Your Old Content","https://www.youtube.com/watch?v=l8JUF0bNIo4","2020-12-19",25563
"How to Beat Google by Leveraging User Metrics","https://www.youtube.com/watch?v=RegMu2Ye6HE","2020-12-17",9211
"How To Protect & Grow Your Business With Digital Accessibility & SEO","https://www.youtube.com/watch?v=C3DIBs-sPzo","2020-12-14",8070
"How to Find 1000s of Lucrative Keywords in Under a Minute","https://www.youtube.com/watch?v=30cqsQvOsrU","2020-12-12",22242
"How to Generate Millions of Visitors Like Wikipedia","https://www.youtube.com/watch?v=K4HTG_m_w4Q","2020-12-10",19598
"Why You Shouldn't Use Exact Match Domains (Don't Make This SEO Mistake)","https://www.youtube.com/watch?v=z5P68CSI2BY","2020-12-07",30555
"How To Optimize For The Page Experience Algorithm (Google's Upcoming Algorithm Update)","https://www.youtube.com/watch?v=-xrEkm8S40U","2020-12-05",22408
"How Many Links You Actually Need To Rank Page One On Google","https://www.youtube.com/watch?v=hngajJJgV6c","2020-12-03",16615
"A Unique Type of Content That Will Generate You 100,000 Visitors Per Month","https://www.youtube.com/watch?v=cR9LswOB-wI","2020-11-30",21229
"The Secret Local SEO Recipe - Module 2 - Lesson 3 - Local SEO Unlocked","https://www.youtube.com/watch?v=00ntiTMDyNU","2020-11-28",10740
"The Easy Way to Rank Local Websites - Module 2 - Lesson 2 - Local SEO Unlocked","https://www.youtube.com/watch?v=8PKEi1denlQ","2020-11-26",11738
"How to Create Content That Ranks in Local Areas - Module 2 - Lesson 1 - Local SEO Unlocked","https://www.youtube.com/watch?v=RXE1uqN3qzQ","2020-11-23",14662
"How to OWN Google My Business Rankings - Module 1 - Lesson 3 - Local SEO Unlocked","https://www.youtube.com/watch?v=cgifDKJZaZU","2020-11-21",21987
"Local SEO Signals (And How to Master Them) - Module 1 - Lesson 2 - Local SEO Unlocked","https://www.youtube.com/watch?v=F7vbg3wskZk","2020-11-19",24915
"Welcome to my FREE Local SEO Course - Local SEO Unlocked - Module 1 - Lesson 1","https://www.youtube.com/watch?v=c-h3GxHofcA","2020-11-16",56944
"How to Optimize For Google's 200 Ranking Factors (And Watch Your Rankings Skyrocket)","https://www.youtube.com/watch?v=WgAjHAnrGqU","2020-11-14",13391
"An Easy Way to Find More Keywords (Without Spending Lots of Time or Using a Ton of Tools)","https://www.youtube.com/watch?v=LwRRLh960Xw","2020-11-12",14052
"An Easy Way to Rank For Competitive Keywords (Without Being a Professional SEO)","https://www.youtube.com/watch?v=p1te4WYipVk","2020-11-09",39039
"Advanced LinkedIn Tactics - Module 2 - Lesson 3 - LinkedIn Unlocked","https://www.youtube.com/watch?v=hGr4GMT62D4","2020-11-07",15104
"Marketing On LinkedIn - Module 2 - Lesson 2 - LinkedIn Unlocked","https://www.youtube.com/watch?v=5N4x7g2x2g4","2020-11-05",15565
"How to Use LinkedIn for Deals & Sales - Module 2 - Lesson 1 - LinkedIn Unlocked","https://www.youtube.com/watch?v=a3MLOWzC9yk","2020-11-02",14855
"How To Get B2B Leads & Clients On LinkedIn - Module 1 - Lesson 3 - LinkedIn Unlocked","https://www.youtube.com/watch?v=fuPxKEp9xKE","2020-10-31",28187
"Creating the Perfect LinkedIn Profile - Module 1 - Lesson 2 - LinkedIn Unlocked","https://www.youtube.com/watch?v=TJnmoiL4_h8","2020-10-29",28691
"LinkedIn Advanced Strategies to Turn Business Connections Into Leads & Customers - FREE Course","https://www.youtube.com/watch?v=d_7GbF-12CI","2020-10-26",36178
"A Simple Way to Build More Links","https://www.youtube.com/watch?v=jPtLDr3MBd8","2020-10-24",24093
"Start Selling 20% More Online in Less Than 10 Minutes | Growth Hack Your eCommerce","https://www.youtube.com/watch?v=sGpcJ3SOITA","2020-10-22",18955
"A Simple Hack to Generating 93% More Ad Revenue","https://www.youtube.com/watch?v=gXzKovmO7pM","2020-10-19",16078
"How to Promote YouTube Videos (Even With 0 Subscribers) - Module 2 - Lesson 3 - YouTube Unlocked","https://www.youtube.com/watch?v=qwomTmPOtyA","2020-10-17",22014
"Lessons From MrBeast, Logan Paul & Ed Sheeran - Module 2 - Lesson 2 - YouTube Unlocked","https://www.youtube.com/watch?v=5BfdTwxVicw","2020-10-15",12872
"How to Script & Storyboard Your YouTube Videos - Module 2 - Lesson 1 - YouTube Unlocked","https://www.youtube.com/watch?v=sMbo87-nDwU","2020-10-12",22101
"Top-Performing Content Types for YouTube (The MASTER LIST) - Module 1 - Lesson 3 - YouTube Unlocked","https://www.youtube.com/watch?v=lazS3Gwv0vI","2020-10-10",21105
"How to Build Your YouTube Channel The Right Way - Module 1 - Lesson 2 - YouTube Unlocked","https://www.youtube.com/watch?v=oe5SPPHe6xs","2020-10-08",35561
"How To Go From Zero to 100,000 Subscribers on YouTube - YouTube Unlocked - Module 1 - Lesson 1","https://www.youtube.com/watch?v=BJhTePXFvGo","2020-10-05",62042
"How to Get Millions of Visitors Like Quora","https://www.youtube.com/watch?v=JV6wAqj4y-M","2020-10-03",21467
"Why You Should Write Content For Google and Not Social Media","https://www.youtube.com/watch?v=s37Bemfuph8","2020-10-01",15144
"A Quick Hack That'll Help You Rank For More Keywords","https://www.youtube.com/watch?v=64ZDgNFWdU4","2020-09-28",33292
"How Kylie Jenner Built Her Empire - Module 2 - Lesson 3 - Instagram Unlocked","https://www.youtube.com/watch?v=FNuwQcYkP-s","2020-09-26",18024
"How To Grow Your IG Followers Fast - Module 2 - Lesson 2 - Instagram Unlocked","https://www.youtube.com/watch?v=GfyMgrzP8kw","2020-09-24",33130
"How To Market Your Instagram Content - Module 2 - Lesson 1 - Instagram Unlocked","https://www.youtube.com/watch?v=hJ57exhHbMQ","2020-09-21",29595
"27 Content Types For Instagram - Module 1 - Lesson 3 - Instagram Unlocked","https://www.youtube.com/watch?v=YumNkjy9Skk","2020-09-19",40534
"Build Your Instagram Profile The Right Way - Module 1 - Lesson 2 - Instagram Unlocked","https://www.youtube.com/watch?v=IJkYLI1oM4s","2020-09-17",61406
"Welcome to the Instagram Unlocked: From 0 to 100,000 Followers - New Neil Patel Course","https://www.youtube.com/watch?v=eJ2NNy1F6y4","2020-09-14",89572
"How To Create The Perfect Blog Post","https://www.youtube.com/watch?v=J-2_CrpDAOo","2020-09-12",25283
"The Best Traffic Hack (Works Even If You're a Complete Newbie)","https://www.youtube.com/watch?v=AN-nNFlhq04","2020-09-10",46230
"How to Get More SEO Traffic Using The Ubersuggest Chrome Extension","https://www.youtube.com/watch?v=zHDATkRygTE","2020-09-05",15476
"How to Rank For 1000s of Keywords Using Google Search Console","https://www.youtube.com/watch?v=W4mT6giCDp0","2020-09-03",65762
"How to Create The Perfect Blog Layout","https://www.youtube.com/watch?v=UBcNQwyjNuY","2020-08-31",51263
"How to Track and Grow Your Google Rankings","https://www.youtube.com/watch?v=NhbJm7CdAMo","2020-08-29",18900
"How to Find 1000 Blog Post Ideas in Less Than 1 Minute","https://www.youtube.com/watch?v=a3YwOQeZoG0","2020-08-27",85922
"Advanced Facebook Ads Strategy: How to Retain Your Subscribers Forever","https://www.youtube.com/watch?v=Ir2-kVybZOU","2020-08-24",23928
"Go Omni Channel With Your Content Marketing - Module 4 - Lesson 3 - Content Marketing Unlocked","https://www.youtube.com/watch?v=wfVXWz1xLKA","2020-08-22",10063
"Get On Forbes, HuffPost & NYTimes For Free - Module 4 - Lesson 2 - Content Marketing Unlocked","https://www.youtube.com/watch?v=s2LRnowQ_B8","2020-08-20",13135
"How To Rank #1 For Competitive Keywords - Module 4 - Lesson 1 - Content Marketing Unlocked","https://www.youtube.com/watch?v=6qSVBtlBvzQ","2020-08-17",21760
"Tools To Improve Your Content Marketing  - Module 3 - Lesson 3 - Content Marketing Unlocked","https://www.youtube.com/watch?v=NRU7Bsb9OEo","2020-08-15",13200
"18 Link Building Strategies (Templates Included) - Module 3 - Lesson 2 - Content Marketing Unlocked","https://www.youtube.com/watch?v=SxEEg1tOV70","2020-08-13",16278
"Promoting Your Content With Zero Budget - Module 3 - Lesson 1 - Content Marketing Unlocked","https://www.youtube.com/watch?v=mbIt8Sd2N2w","2020-08-10",27614
"Creating Content With Guest Contributors - Module 2 - Lesson 3 - Content Marketing Unlocked","https://www.youtube.com/watch?v=v1WyWFHiWa4","2020-08-08",17659
"Rank In Competitive Markets With Topical Clusters - Module 2 - Lesson 2 - Content Marketing Unlocked","https://www.youtube.com/watch?v=nuU_yXiTDv4","2020-08-06",20959
"18 Content Types to Dominate Content Marketing - Module 2 - Lesson 1 - Content Marketing Unlocked","https://www.youtube.com/watch?v=U0ekBz_wWwI","2020-08-03",29921
"How To Rank Your Existing Content - Module 1 - Lesson 3 - Content Marketing Unlocked","https://www.youtube.com/watch?v=W13rm0OZ6dI","2020-08-01",28581
"How Content Marketing Started - Module 1 - Lesson 2 - Content Marketing Unlocked","https://www.youtube.com/watch?v=tDvBdnLZLp4","2020-07-30",28010
"Welcome to the Content Marketing Unlocked! - Free Content Marketing Course with Neil Patel","https://www.youtube.com/watch?v=9_rULUbLqE4","2020-07-27",54094
"How to Outrank and Steal Traffic From Your Competition","https://www.youtube.com/watch?v=CaPRbcxUGeE","2020-07-25",48259
"How to Optimize Your On-Page SEO in Less Than 10 Minutes","https://www.youtube.com/watch?v=QpLBzNrzj4c","2020-07-23",49077
"How to Find Lucrative Keywords That Are Easy to Rank For","https://www.youtube.com/watch?v=3mDauNkvK7I","2020-07-20",49875
"21 eCommerce Case Studies - Module 4 - Part 3 - eCommerce Unlocked","https://www.youtube.com/watch?v=u3UjgzlkTzg","2020-07-18",20112
"How To Build Paid Campaigns On YouTube, Etsy & Instagram - Module 4 - Part 2 - eCommerce Unlocked","https://www.youtube.com/watch?v=NOUG_wCgrEI","2020-07-16",9890
"Skyrocket your eCommerce with Shopping/Product Campaigns - Module 4 - Part 1 - eCommerce Unlocked","https://www.youtube.com/watch?v=eoCSHaLawmI","2020-07-13",14514
"B2B VS B2C eCommerce Marketing - Module 3 - Part 3 - eCommerce Unlocked","https://www.youtube.com/watch?v=4G9o-aQqjSE","2020-07-11",14132
"Marketing on Etsy, Walmart, eBay & Facebook Commerce - Module 3 - Part 2 - eCommerce Unlocked","https://www.youtube.com/watch?v=hNTezOCVWNQ","2020-07-09",11603
"How To Increase Your eCommerce Revenue With Amazon - Module 3 - Part 1 - eCommerce Unlocked","https://www.youtube.com/watch?v=k9tqQW4FqlM","2020-07-06",22052
"Content Promotion For eCommerce - Module 2 - Part 3 - eCommerce Unlocked","https://www.youtube.com/watch?v=5lyrhobB91g","2020-07-04",14201
"Ranking Your eCommerce Store On Google - Module 2 - Part 2 - eCommerce Unlocked","https://www.youtube.com/watch?v=8kozMQHR_bA","2020-07-02",24587
"Our Top 10 Marketing Lessons For 2021 (We’re Live!)","https://www.youtube.com/watch?v=QXPtuA5gvBU","2020-06-30",9940
"Double Your eCommerce Sales With A Few Simple Tweaks - Module 2 - Part 1 - eCommerce Unlocked","https://www.youtube.com/watch?v=KE12TB3U0qc","2020-06-29",27842
"22+ Marketing Channels For eCommerce  - Module 1 - Part 3 - eCommerce Unlocked","https://www.youtube.com/watch?v=XaoACB6dRx0","2020-06-27",34590
"How To Leverage The Top Retailers In The World - Module 1 - Part 2 - eCommerce Unlocked","https://www.youtube.com/watch?v=OpRn6sEjL1A","2020-06-25",32990
"Welcome to Ecommerce Unlocked: Your Free Ecommerce Marketing Course","https://www.youtube.com/watch?v=qTLffZkxnT0","2020-06-22",83557
"Keywords Insights by Ubersuggest Chrome Extension: How to get Keyword Ideas From the SERP","https://www.youtube.com/watch?v=eXBgXnKGTAw","2020-06-20",49831
"Designing Your Customer Experience & Case Studies - Module 7 - Part 3 - SEO Unlocked","https://www.youtube.com/watch?v=CRz0pn3N5bs","2020-06-18",15739
"How To Create A Compelling Brand - Module 7 - Part 2 - SEO Unlocked","https://www.youtube.com/watch?v=ttT3IbkZ_Qo","2020-06-15",16495
"A Deep Dive Into Branding, Data & Experience - Module 7 - Part 1 - SEO Unlocked","https://www.youtube.com/watch?v=738TjOhTq3k","2020-06-13",19922
"How to Use Advanced Features in Google Analytics - Module 06 - Lesson 3 - SEO Unlocked","https://www.youtube.com/watch?v=hAkiH_3hC9E","2020-06-11",28130
"How to Setup Google Search Console - Module 06 - Lesson 2 - SEO Unlocked","https://www.youtube.com/watch?v=7TKyZR5XQqQ","2020-06-08",41069
"How To Get The Most Out Of Google Analytics - Module 06 - Lesson 1 - SEO Unlocked","https://www.youtube.com/watch?v=a9yVBuk5Amo","2020-06-06",49625
"Get THOUSANDS of Backlinks On Semi-Autopilot - Module 05 - Lesson 3 - SEO Unlocked","https://www.youtube.com/watch?v=SbDIDbiVPzs","2020-06-04",31275
"How to Get POWERFUL Backlinks for Faster Rankings - Module 05 - Lesson 2 - SEO Unlocked","https://www.youtube.com/watch?v=qO5xeRYk20Q","2020-06-01",39754
"Over 4 Million Backlinks Built With This Simple Process - Module 05 - Lesson 1 - SEO Unlocked","https://www.youtube.com/watch?v=h-4ksx-b_ns","2020-05-30",54320
"Discover Your Competitive Strategy - Content Marketing Part 2 - Lesson 3 - SEO Unlocked","https://www.youtube.com/watch?v=aNBotpi7J98","2020-05-28",24623
"How to Edit Your Content For SEO - Content Marketing Part 2 -  SEO Unlocked","https://www.youtube.com/watch?v=-1hw7akbdBQ","2020-05-25",35787
"The 10 Commandments of Content Marketing - Content Marketing Part 2 - Lesson 1 -  SEO Unlocked","https://www.youtube.com/watch?v=28MeI9YccNY","2020-05-23",44341
"Advanced Content Marketing Tactics - Content Marketing Part 1 - Lesson 2 - SEO Unlocked","https://www.youtube.com/watch?v=cJbKV2_B-xc","2020-05-21",37902
"Content Marketing Part 1 - SEO Unlocked - Free SEO Course with Neil Patel","https://www.youtube.com/watch?v=zks1MFJsyUc","2020-05-18",80592
"Mastering Technical SEO Audits - On-page SEO Part 3 - SEO Unlocked - Free SEO Course with Neil Patel","https://www.youtube.com/watch?v=k04rHijEPSw","2020-05-16",160986
"On-page and technical SEO Part 2 - SEO Unlocked - Free SEO Course with Neil Patel","https://www.youtube.com/watch?v=utLaKIJKygA","2020-05-14",74778
"On-page and technical SEO Part 1 - SEO Unlocked - Free SEO Course with Neil Patel","https://www.youtube.com/watch?v=PXDPqXHLSOY","2020-05-11",192866
"Keyword Research Part 2 - SEO Unlocked - Free SEO Course with Neil Patel","https://www.youtube.com/watch?v=U655ixy-sdE","2020-05-09",126853
"Keyword Research Part 1 - SEO Unlocked - Free SEO Course with Neil Patel","https://www.youtube.com/watch?v=CYicoAcAi0A","2020-05-07",428373
"What is SEO? An Introduction to SEO","https://www.youtube.com/watch?v=pIbQfOcsEsE","2020-05-04",219646
"Welcome to the SEO Unlocked! Free SEO Course with Neil Patel | SEO Training","https://www.youtube.com/watch?v=Q_lySNxCag0","2020-05-02",311335
"Using Your Own Brand As Your SEO Secret Weapon","https://www.youtube.com/watch?v=35YU8Lhk594","2020-04-30",19832
"6 Actionable Steps For Better Rankings With Small Websites","https://www.youtube.com/watch?v=mo_aZOeknBs","2020-04-27",34223
"Client says, Let Me Think About it. and You say, ...","https://www.youtube.com/watch?v=Kb_eZzKsdmc","2020-04-23",14718
"14 Chrome Extensions That Will Save HOURS of Marketing Work","https://www.youtube.com/watch?v=hPFozx7tJ0Q","2020-04-20",110137
"7 Google Ads Hacks That’ll Make Your Campaigns Scale Profitably","https://www.youtube.com/watch?v=S-hn2ThmQEw","2020-04-16",251333
"How to Get Backlinks From Any Website (Big or Small)","https://www.youtube.com/watch?v=VXnUyD4x68g","2020-04-13",56933
"9 Things You Didn’t Know About The World’s Top Websites in Search Traffic","https://www.youtube.com/watch?v=xBt0oE3t7Bw","2020-04-11",21025
"The Biggest SEO And Digital Marketing SCAM (That You’re Still Falling For)","https://www.youtube.com/watch?v=znKM2TQX8kQ","2020-04-09",36860
"How Did Amazon Get So Big? (The Marketing Secrets Behind Amazon’s Growth)","https://www.youtube.com/watch?v=A0T3dTrVDHc","2020-04-06",20676
"96% Of Your Landing Page Visitors Will NEVER Convert (And How to Improve That)","https://www.youtube.com/watch?v=dobgpL_Rqmk","2020-04-04",35935
"How to Choose a Great Business Name | Creating an Amazing Brand","https://www.youtube.com/watch?v=txS7IsRumS8","2020-04-02",157140
"How to Rank Smaller Websites on Google in 2023 - FAST Method for Non-Techies","https://www.youtube.com/watch?v=totiNw9Rypc","2020-03-30",137615
"How to Make Your Website SEO-Friendly When You Can’t Code | Neil Patel","https://www.youtube.com/watch?v=Cfjn_515kr4","2020-03-28",24791
"How Long Does SEO Take to Work For a New Website?","https://www.youtube.com/watch?v=wc_uo1prLg8","2020-03-26",278932
"4 Design Tweaks That Can Boost Your SEO Traffic","https://www.youtube.com/watch?v=Ok13Y3J2fJs","2020-03-23",17681
"How Does Google Make Money? Google Business Model Explained","https://www.youtube.com/watch?v=nh_h2l74lW4","2020-03-21",47257
"8 Things to Remove From Your Website Immediately If You Want to Rank on Google","https://www.youtube.com/watch?v=5F2Y5vsOSiE","2020-03-19",215750
"Why I Stopped Doing Link Building (And Should You Too?)","https://www.youtube.com/watch?v=2rcVOpgpQoQ","2020-03-16",16823
"How to Generate Leads When You Have Little to No Traffic","https://www.youtube.com/watch?v=ax9k-lCGAGA","2020-03-14",69822
"How I Rank #1 For Very Competitive Keywords on YouTube","https://www.youtube.com/watch?v=oc1KaNa91uE","2020-03-12",33942
"7 Marketing Trends to Help you DOMINATE Social Media in 2023","https://www.youtube.com/watch?v=10IuyBkrB7o","2020-03-09",28030
"How to Design A Beautiful Homepage That Ranks on Google - The Non-Designer’s Guide","https://www.youtube.com/watch?v=D7GLEoN8yvA","2020-03-07",75733
"The #1 Biggest SEO Mistake Nearly Everyone Makes | Avoid This At All Costs","https://www.youtube.com/watch?v=X6B0TOGsbRw","2020-03-05",19201
"The Definitive Guide to Ubersuggest for SEO and Content Marketing","https://www.youtube.com/watch?v=_ve9cmRaem0","2020-03-02",64447
"STOP Using Facebook Ads - The Best Alternative Ad Platforms","https://www.youtube.com/watch?v=nbXX68QJjAQ","2020-02-29",131720
"The Definition of Digital Marketing by Neil Patel","https://www.youtube.com/watch?v=ORYkfcBOXh4","2020-02-27",33837
"4 USELESS Marketing Tools You’re Still Using (STOP Wasting Your Money)","https://www.youtube.com/watch?v=6Q3H_RrV15Y","2020-02-24",22911
"How To Build Thousands of Backlinks Without Even Asking For Them (5 Actionable Tactics)","https://www.youtube.com/watch?v=wzYZkO1T4_4","2020-02-22",50376
"Has Blogging Changed Too Drastically in 2023? (The Explanation Behind Your Weak Results)","https://www.youtube.com/watch?v=ednS83_2Y04","2020-02-20",26059
"Can Social Media Still Bring You ANY Website Traffic in 2023","https://www.youtube.com/watch?v=PVby6g0XEsA","2020-02-17",17402
"The Two Marketing Careers That Will CRUSH IT in 2023","https://www.youtube.com/watch?v=mAn3zmkj4p8","2020-02-16",41668
"Can You STILL Do Digital Marketing for Free? (The REAL Cost of Digital Marketing)","https://www.youtube.com/watch?v=2rQjjH--HiA","2020-02-13",20907
"How To Write Content That Ranks Page #1 on Google","https://www.youtube.com/watch?v=pSWCotmPC58","2020-02-10",102932
"FREE Resources to Learn Marketing in 2023 | Digital Marketing Courses and Certification","https://www.youtube.com/watch?v=SgDDfVCAkfk","2020-02-08",267036
"How to Win on SEO Without Spending Money - The Penniless Marketer Full Strategy","https://www.youtube.com/watch?v=ZDs34NWtAW4","2020-02-06",21066
"8 Things To Master in SEO - Do You Know Them?","https://www.youtube.com/watch?v=7lPNw2ElaVg","2020-02-03",35103
"6 Reasons Why Your Site Will NEVER Rank (STOP Doing This) | Neil Patel's SEO Tips","https://www.youtube.com/watch?v=1BlLJjOQdes","2020-02-01",41461
"The Cheapest Way to Write Lots of Content At Scale","https://www.youtube.com/watch?v=YRZlBjsY_nc","2020-01-30",27982
"The 6 Time Wasters of SEO -  STOP Doing These Activities","https://www.youtube.com/watch?v=_yXNA4wWS6M","2020-01-27",41081
"5 Dumbest Mistakes Entrepreneurs Make With Their SEO","https://www.youtube.com/watch?v=W00hLr627K0","2020-01-25",23793
"The Best FREE Traffic Sources for New Websites","https://www.youtube.com/watch?v=X9Wk8K_TxlE","2020-01-23",69597
"5 Industries That Are Getting Crushed by Google in their SEO","https://www.youtube.com/watch?v=gZvXcLJiYR0","2020-01-20",24236
"How to Build an Email List Fast and for Free — My Secrets to Reaching 270k+ Subscribers","https://www.youtube.com/watch?v=Ec9nqdwIjQI","2020-01-18",105652
"How to Do an SEO Audit In Under 30 Minutes And Discover Hidden Opportunities to Rank #1","https://www.youtube.com/watch?v=zTuNlT29ZWc","2020-01-16",80729
"I Spent $3 Million on this Marketing Tactic - Here’s What I’ve Learned","https://www.youtube.com/watch?v=ZliTye4NEEg","2020-01-13",14147
"Copy the 5 Winning Strategies Behind My 238% Traffic Growth in 2023","https://www.youtube.com/watch?v=idpg3IyTU10","2020-01-12",24935
"How to Instantly Find Dozens of Content Ideas (That Your Audience Will LOVE)","https://www.youtube.com/watch?v=Cz1PIlVRaVY","2020-01-09",30268
"The Beginner's Guide to Content Marketing in 2023 | Neil Patel","https://www.youtube.com/watch?v=3pVQm18SQok","2020-01-06",75362
"Content Marketing is Changing - This is Where it is Heading in 2023","https://www.youtube.com/watch?v=RKnryDGr2DM","2020-01-04",42423
"A Detailed, Newbie’s Guide to Building Your Brand in 2023","https://www.youtube.com/watch?v=ycD-6vLYASA","2020-01-02",24666
"How Digital Marketing Will Change in 2023 (You're Not Going to Like It)","https://www.youtube.com/watch?v=5Vbd5Y8XVfg","2019-12-30",137368
"How to Improve Your Wordpress SEO in 30 Minutes | Rank INSTANTLY on Google","https://www.youtube.com/watch?v=t9UA_HgRixs","2019-12-28",155649
"4 Simple Hacks to Bring Dead Pages Back to Life With Massive SEO Gains","https://www.youtube.com/watch?v=Q0H_-2d2-KY","2019-12-26",12807
"The 5 BEST Digital Marketing Side Hustles $20 to $195 Per Hour!","https://www.youtube.com/watch?v=62Ua_FdZgxc","2019-12-23",39274
"One Tool To Make Your Website a Sales and Marketing Machine","https://www.youtube.com/watch?v=qUtZS7rKbnE","2019-12-21",40135
"How to Create a Marketing Strategy For a New eCommerce Website","https://www.youtube.com/watch?v=ZWYdJ3VBScY","2019-12-19",78331
"My 7 Favorite Free SEO Tools to Get Page 1 Rankings on Google","https://www.youtube.com/watch?v=4M1Z5_-lJ5w","2019-12-16",39070
"How to Optimize Your Blog to Get Explosive Traffic Growth in 2023","https://www.youtube.com/watch?v=792f2y2Pn74","2019-12-14",24784
"How to Optimize For Google’s E A T Algorithm","https://www.youtube.com/watch?v=vvKpzFtH7OQ","2019-12-12",28195
"STOP Paying for SEO Tools - The Only 4 Tools You Need to Rank #1 in Google","https://www.youtube.com/watch?v=5h4Wyi3jZzs","2019-12-09",194118
"How To Build Pages That Rank #1 On Google Consistently | SEO Tips","https://www.youtube.com/watch?v=LEUb_wTHv4I","2019-12-07",51160
"What are the MAJOR changes in SEO for 2023?","https://www.youtube.com/watch?v=TSJEQFtbOLA","2019-12-05",85044
"Wix vs Wordpress vs Squarespace  Which One is The Best For SEO","https://www.youtube.com/watch?v=iN8zqppelP4","2019-12-02",73997
"The Social Network That Will Explode in 2023 - Should You Leverage It?","https://www.youtube.com/watch?v=seBGD5K_o6c","2019-11-30",24733
"SEO Beyond Google: How to Rank On The Best Alternative Search Engine | YouTube SEO","https://www.youtube.com/watch?v=SESao9ByF2U","2019-11-28",14699
"How to Do Marketing In Over Saturated Social Networks (WITHOUT Paid Ads)","https://www.youtube.com/watch?v=jiFUlFJIJZo","2019-11-25",11576
"Will Small Businesses Still Profit From Facebook Ads in 2023?","https://www.youtube.com/watch?v=7tACyXcjZF4","2019-11-23",38666
