"Title","video_url","Published_date","Views"
"Google trends is 🔑","https://www.youtube.com/watch?v=KhrDMqGjLo0","2022-04-18",14753
"Instagram Trends To Try This Year 2023","https://www.youtube.com/watch?v=rD20yLOjFis","2022-04-16",11003
"Focus on your customers 💯","https://www.youtube.com/watch?v=RSOndEHQNx0","2022-04-14",3704
"Generate 6 Months' Worth of Content in 3 Days (Content Strategy 2023)","https://www.youtube.com/watch?v=r_fT7to6m8w","2022-04-14",68891
"Use a CDN, it’ll save you 🔑","https://www.youtube.com/watch?v=pt3X4B_9AJg","2022-04-13",7244
"You’ll love this hack 🚀","https://www.youtube.com/watch?v=S6REqdSTngc","2022-04-12",11895
"How to Convert Your Leads Into Sales With These 5 CRM Features","https://www.youtube.com/watch?v=TfQQMJ9b_8E","2022-04-11",10722
"8 Ways to Increase Your Website Traffic FAST and FOR FREE","https://www.youtube.com/watch?v=egKFQRuCERE","2022-04-09",31841
"Anything for this future CEO ❤️","https://www.youtube.com/watch?v=RSd2KqV_B6w","2022-04-08",7570
"How to Find Unlimited Content Ideas for Social Media in 2023","https://www.youtube.com/watch?v=n7LetryuALA","2022-04-07",15066
"Personal or a corporate brand? Build both.","https://www.youtube.com/watch?v=g7X5WXldDow","2022-04-07",6506
"Have you noticed this before?","https://www.youtube.com/watch?v=00p5sVAyjZ4","2022-04-06",5681
"Who doesn’t want more traffic?","https://www.youtube.com/watch?v=9xxQSLv2qZ4","2022-04-05",5237
"Product is king.","https://www.youtube.com/watch?v=JK2V-QLw7vk","2022-04-04",13141
"The Perfect Landing Page Blueprint","https://www.youtube.com/watch?v=ceueGx6gD54","2022-04-04",17664
"7 Free Apps That’ll Help You Write Content Faster","https://www.youtube.com/watch?v=If2wziIAFzA","2022-04-02",73930
"Instagram Content Strategy 101 (How I Took My Instagram From 0 to 300,000 Followers)","https://www.youtube.com/watch?v=NT9pucaSoXw","2022-03-31",14886
"These words are one of the most powerful sales tactics 🚀","https://www.youtube.com/watch?v=WN3pQCXvel0","2022-03-31",7273
"Good marketing isn’t always about having the best copy or creative.","https://www.youtube.com/watch?v=05rBpsFZf5M","2022-03-30",6538
"How to Write a Blog Post Fast","https://www.youtube.com/watch?v=hwVb9kJHmfY","2022-03-28",33920
"7 A.I. Marketing Tools That Will BLOW YOUR MIND","https://www.youtube.com/watch?v=smyN7eFh6-Q","2022-03-26",85453
"Which do you prefer: a fancy office to work in... or to get paid MORE money? 👇","https://www.youtube.com/watch?v=sdjMGibhK50","2022-03-25",5858
"How to Find Unlimited YouTube Video Topics (2023) | Video Ideas For YouTube","https://www.youtube.com/watch?v=80TQo5ZeAeo","2022-03-24",8297
"I Spent $500,000 in TV Ads to Promote My Ad Agency… This is what happened","https://www.youtube.com/watch?v=qIGucc-ssjY","2022-03-21",7447
"11 USEFUL Digital Marketing Tools When You Have No Team","https://www.youtube.com/watch?v=Ul_Qg4h0TvA","2022-03-19",63566
"Top 5 Best FREE WEBSITES to Learn a New Marketing Skill","https://www.youtube.com/watch?v=ldaOfPmCGUg","2022-03-17",31999
"How to Become a Social Media Manager in 2023","https://www.youtube.com/watch?v=f9wgg8rNCcM","2022-03-14",36408
"How To Start A Digital Marketing Agency From Scratch In 2023","https://www.youtube.com/watch?v=qyF7Tfb3QRc","2022-03-12",55393
"How to Rank Your WordPress Website on Google","https://www.youtube.com/watch?v=deEOjN08_VM","2022-03-10",23918
"3 Great Website Traffic Sources You're Probably Not Using","https://www.youtube.com/watch?v=GyjZJs9bG98","2022-03-07",34087
"How LONG Did It Take to Get My First 10,000 Subscribers on YouTube?","https://www.youtube.com/watch?v=qkxmUPotRDE","2022-03-05",16739
"Can You Start Digital Marketing in 2023 With JUST a Phone?","https://www.youtube.com/watch?v=OYrrjAvDFgo","2022-03-03",14858
"3 Things You Shouldn’t be Doing in Marketing for 2023 | And What To Do Instead","https://www.youtube.com/watch?v=-Yfjwob2JyE","2022-02-28",9817
"The Best Sales Funnel for e-Commerce","https://www.youtube.com/watch?v=nIbHYwemlD0","2022-02-26",28761
"My Instagram Strategy at 0 Followers VS. 290,000 Followers","https://www.youtube.com/watch?v=qistbQs-yyg","2022-02-24",28826
"How to Increase Facebook Engagement and Get More Likes in 2023","https://www.youtube.com/watch?v=HvOjcigOsQw","2022-02-21",31729
"Social Media Trends in 2023","https://www.youtube.com/watch?v=HvUrSEuhXuU","2022-02-19",46584
"This is What $1,500 Gets You in Website Traffic: Facebook Ads VS Google Ads","https://www.youtube.com/watch?v=jNvcsKl47aY","2022-02-17",81780
"How to Plan 1 Week of Social Media Content in 60 Minutes (Tools and Hacks)","https://www.youtube.com/watch?v=QPgwoxERxnw","2022-02-14",61162
"Paid Ads VS SEO: Which is Better for Lead Generation?","https://www.youtube.com/watch?v=ICwBA4192To","2022-02-12",21563
"How to Speed Up Your Wordpress Website (in just 5 steps)","https://www.youtube.com/watch?v=Ysu7eo1z2Hk","2022-02-10",35887
"7 Social Media Content Ideas That’ll Attract Likes, Organic Reach, and Engagement","https://www.youtube.com/watch?v=qwZtdO4I_LU","2022-02-07",32543
"Content Marketing VS SEO // Which One Drives More Traffic?","https://www.youtube.com/watch?v=b4-_hjLk_ck","2022-02-05",13470
"The 6 Highest-Paying Affiliate Platforms to Use in 2023","https://www.youtube.com/watch?v=SgLvECW16S4","2022-02-03",62722
"Can You Rank a Website WITHOUT Writing Content?","https://www.youtube.com/watch?v=f7GWmDuBoL4","2022-01-31",35429
"How to Convince Website Owners to Link Out to Your Website","https://www.youtube.com/watch?v=mGDgOtUbkRw","2022-01-29",15498
"How I Turn a Boring Product Into a Marketing Success Behind My Most Successful Campaigns","https://www.youtube.com/watch?v=-H-XPd4E5Xc","2022-01-27",9411
"What You Should Do When People Have Money And Can’t Afford Your Product | Sales Advice","https://www.youtube.com/watch?v=d-IieuMzknk","2022-01-24",7866
"THIS Will Completely Change Social Media Marketing in 2023 (If It Hasn’t Already...)","https://www.youtube.com/watch?v=bphUenvcLO8","2022-01-22",40646
"The Most Realistic Advice On How to Start a New Website (And Actually Get Traffic)","https://www.youtube.com/watch?v=mvg1sUCwWX0","2022-01-20",26038
"The 6 Stages of Learning Digital Marketing - Which One Are You In?","https://www.youtube.com/watch?v=nMzp1yfflco","2022-01-17",14279
"Why Your Content Gets ZERO Attention and Traffic (Even When It’s Fully Optimized for SEO)","https://www.youtube.com/watch?v=H-HT6P1VRV4","2022-01-15",17340
"7 Tips to Work 10x Faster in SEO: More Traffic Spending Less Time","https://www.youtube.com/watch?v=86AxV_3tySM","2022-01-13",17969
"The Biggest Opportunity in Paid Social Media Ads Since The Death of Organic Reach","https://www.youtube.com/watch?v=VferSvpZOqI","2022-01-10",23213
"Marketing Color Psychology: The Meaning Behind Colors (And How They Affect Consumers)","https://www.youtube.com/watch?v=iu2taMncoFk","2022-01-08",22988
"This Works Better Than SEO (And Gives You 10x The Amount of Traffic) | My BEST Traffic Source","https://www.youtube.com/watch?v=S_tbp2NOSPI","2022-01-06",41664
"20 Years Of Marketing - 7 Most Important Lessons Learned","https://www.youtube.com/watch?v=VS4ECrG_0uM","2022-01-03",31534
"How to Get Your First 1,000 Visitors With SEO and Content Marketing","https://www.youtube.com/watch?v=l0OmpwWeU38","2021-12-30",26170
"Why You Should Stop Studying Digital Marketing (What To Do Instead While Getting 10x The Results)","https://www.youtube.com/watch?v=_2BIMXX7lbQ","2021-12-27",64480
"A Minimalist’s Approach to SEO: The Only 3 Things You Should do Every Week To Get Traffic","https://www.youtube.com/watch?v=MN-g7XXUskc","2021-12-23",27141
"Is Digital Marketing Going to Be Saturated in 2023?","https://www.youtube.com/watch?v=IzG8hxj5xpQ","2021-12-20",59906
"The BEST Marketing Strategy is Often The SIMPLEST - Here’s Why","https://www.youtube.com/watch?v=eiMYkbudKu8","2021-12-18",9433
"Take THIS QUICK TEST and FIND OUT How to CHANGE Your Landing Page’s Performance","https://www.youtube.com/watch?v=yw-Pk1lgsvE","2021-12-16",9425
"Finding The Easiest Opportunities for Link Building In Less Than 3 Minutes","https://www.youtube.com/watch?v=ztYTLwVihS0","2021-12-13",17732
"How to Climb Google’s Rankings From Pages #2 to Page #1","https://www.youtube.com/watch?v=VBSkT08tRqU","2021-12-11",18964
"One FREE Tool to STEAL Your Competitor’s Best Keywords","https://www.youtube.com/watch?v=fvn0A9Zjiow","2021-12-09",24822
"Auditing Your Website’s SEO For Rankings (BEYOND Just Technical Fixes)","https://www.youtube.com/watch?v=j2U3gXLi4eE","2021-12-06",9112
"How to Reverse-Engineer The Strategy of The Most Successful Competitors in Digital Marketing","https://www.youtube.com/watch?v=YIxUedvNi1g","2021-12-04",11179
"One e-Commerce Hack That Will Increase Your Sales","https://www.youtube.com/watch?v=lBY2MYcNyHE","2021-12-02",11629
"How Much Time Should You Spend on SEO in Order to Rank #1?","https://www.youtube.com/watch?v=ws26duw7mAw","2021-11-29",20498
"You Will NEVER Rank For These Types of Keywords (STOP Setting Yourself Up For Failure!)","https://www.youtube.com/watch?v=32URKPTximM","2021-11-27",14815
"What’s Going to CHANGE in Marketing in 2023 (The Good, The Bad, and The Ugly)","https://www.youtube.com/watch?v=2MHMyvbF-HM","2021-11-25",27661
"How to Increase Traffic and Sales From Google With WooCommerce (And With Google Ads)","https://www.youtube.com/watch?v=UFIoJUhKreY","2021-11-25",11685
"STOP Trying to Compete Against These Websites in SEO (And Finally Start Getting Traffic)","https://www.youtube.com/watch?v=rSGFJQt1Lh8","2021-11-22",13816
"You NEED to Learn How to Write This Type of Content…. RIGHT NOW!!","https://www.youtube.com/watch?v=1odgi9VSx7Q","2021-11-20",20978
"10 Free Tools That’ll Help You Get Your First 10,000 Social Media Followers","https://www.youtube.com/watch?v=U8Ze50i1jro","2021-11-18",54153
"One SEO Trend That Is About to Change Everything in 2023 - And How to Use It In Your Favor","https://www.youtube.com/watch?v=c4w9GaabAV4","2021-11-15",24060
"10 Small Things On Your Website That Are Ruining Your Traffic (Remove These Today!)","https://www.youtube.com/watch?v=s_u_UQUeF64","2021-11-13",25642
"How to Stop Being Just a Content Writer and Become a Marketer","https://www.youtube.com/watch?v=9azXElM2kxU","2021-11-11",19516
"How Much Time Do You Need to Invest In SEO With a New Website That Has No Traffic","https://www.youtube.com/watch?v=UUZubwI6DLs","2021-11-08",32828
"Why Some SEO Gurus Have Been LYING To Your Face This Whole Time","https://www.youtube.com/watch?v=MjMeQitV1lw","2021-11-06",14185
"My 4 Favorite SEO Tools (And The Ones That Are a Time Waste)","https://www.youtube.com/watch?v=C03x9stIzys","2021-11-04",16403
"Don’t Build Backlinks This Year - Do This Instead","https://www.youtube.com/watch?v=QnBHcjQOIBM","2021-11-01",65451
"7 Ecommerce Marketing Secrets You Can Learn From Big Brands","https://www.youtube.com/watch?v=c_rSzi5RwtU","2021-10-30",12149
"Stop Obsessing Over Traffic So You Can Start Getting Sales With Your Online Business","https://www.youtube.com/watch?v=rAJT4Y4G5IE","2021-10-28",7910
"How to Promote Your Blog Content When Nothing is Working","https://www.youtube.com/watch?v=l6qTxQk2gfk","2021-10-25",12056
"8 Paid Ad Secrets You Can Learn From Big Brands","https://www.youtube.com/watch?v=mCdpocxd7Ks","2021-10-23",12742
"How to Write Content That Ranks in 2023’s Crazy SEO Landscape","https://www.youtube.com/watch?v=qjYGcWuZ2_U","2021-10-21",55662
"How To Get a Digital Marketing Job with No Experience","https://www.youtube.com/watch?v=WPoTi68IPpI","2021-10-18",46789
"10 Psychological Triggers to MAKE PEOPLE BUY From YOU! (How to Increase Conversions)","https://www.youtube.com/watch?v=yE7gNbQ24G8","2021-10-16",16926
"A Simple Strategy to Getting More Customers For Your Ad Agency","https://www.youtube.com/watch?v=Xz_W96Zmz3s","2021-10-14",16103
"Watch Me Build a Marketing Strategy in 10 Minutes For a Completely Random Business","https://www.youtube.com/watch?v=UgkNGB3LvKs","2021-10-11",31693
"How Al is Changing Marketing and SEO (And How to Use it In Your Business)","https://www.youtube.com/watch?v=aB16TtWHv9Q","2021-10-09",21262
"A Realistic Approach to SEO For Busy Solo Entrepreneurs","https://www.youtube.com/watch?v=2Kp4arQ2sM8","2021-10-07",15300
"EVERYTHING You've Been Taught About Content Promotion is WRONG","https://www.youtube.com/watch?v=ADr1NSFYTis","2021-10-04",7118
"The Most Valuable Digital Marketing Skills in 2023 (That Every Company Is Looking For)","https://www.youtube.com/watch?v=nYN7fLt_oZI","2021-10-02",42136
"5 High-Paying Digital Marketing Jobs That You Can Do From Home","https://www.youtube.com/watch?v=YeoCcj-4IGA","2021-09-30",78494
"How to Write Blog Posts That Are Better Than Any Other Content Piece On The Web (And Rank Page #1)","https://www.youtube.com/watch?v=7DjgqRPHQGI","2021-09-27",20358
"The Optimization TRAP: When SEO Actually HURTS Your Traffic","https://www.youtube.com/watch?v=s7sitpg1knA","2021-09-25",12302
"4 eCommerce SEO Techniques for Beginners (Ranking Your Products and Getting FREE Google Traffic)","https://www.youtube.com/watch?v=FFWg6Dzw--g","2021-09-23",28192
"7 SEO Secrets You Can Learn From Big Brands","https://www.youtube.com/watch?v=c_BaHl0YPs8","2021-09-20",10296
"How to Develop & Sell a Digital Product, Step by Step (1 Million Revenue Formula)","https://www.youtube.com/watch?v=H8XjS-SpoJI","2021-09-18",25919
"How to Write Amazing Blog Posts WITHOUT Being an Expert in Your Niche","https://www.youtube.com/watch?v=uEXzdo8aV8k","2021-09-16",57384
"A Simple Strategy to Scale Your E-Commerce Business (And Prepping for the 2023 Holiday Season)","https://www.youtube.com/watch?v=Z50M18CNgqg","2021-09-13",11640
"The ONLY Features You Need to Use in SEO Tools","https://www.youtube.com/watch?v=uWxyKa7osh4","2021-09-11",17782
"WordPress SEO Tutorial for Beginners | Step-by-Step to Ranking a WordPress Site","https://www.youtube.com/watch?v=OZL33QIwDic","2021-09-09",25479
"Should You Design Your Landing Pages From Scratch or Use Templates?","https://www.youtube.com/watch?v=3d9V7G2rOkM","2021-09-06",12636
"10 Most Profitable SEO Niches to Start an Online Business","https://www.youtube.com/watch?v=9WNpEyNUIt4","2021-09-04",34778
"The Content Marketing TRAP: Why Writing Content Can Drive ZERO Traffic","https://www.youtube.com/watch?v=a5PsN-Zuga8","2021-09-02",13912
"How To COMPLETELY RECOVER Your Lost SEO Traffic","https://www.youtube.com/watch?v=jS0neQUIbIw","2021-08-30",18522
"5 tools To Create a Profitable Online Business","https://www.youtube.com/watch?v=mcIyvkwYPB8","2021-08-28",19772
"Advice Every Online Business Owner Should’ve Heard Before Starting SEO","https://www.youtube.com/watch?v=zthU8pc3o0Q","2021-08-26",15775
"7 SEO Secrets Every Successful Online Business Employs","https://www.youtube.com/watch?v=rP9uXmFYCXo","2021-08-23",12285
"How I Earn Passive Income Every Day with SEO - And You Can Too 😉","https://www.youtube.com/watch?v=_OkIEULWAQI","2021-08-21",27744
"Is It Too Late to Start Doing SEO in 2023? (You May Not Like The Answer 😬)","https://www.youtube.com/watch?v=MoF_eXTIpgc","2021-08-19",22543
"If You Have ZERO Website Visitors, Do THIS First | Optimizing a New Website For Organic Traffic","https://www.youtube.com/watch?v=97yG9ktIqjQ","2021-08-16",46660
"NOT Every Keyword is Worth Pursuing in SEO (Here’s Why)","https://www.youtube.com/watch?v=oWtCsU3tb24","2021-08-14",10067
"The Most Effective Ways to Market Your Business With No Budget","https://www.youtube.com/watch?v=0QN3KeAtuD8","2021-08-12",19043
"Sometimes the Best SEO Strategy Is To ABANDON Some Keywords","https://www.youtube.com/watch?v=ywIKQLRsdGw","2021-08-09",10246
"When You Have Thousands of Website Visitors but Can’t Sell More Than $100/Month","https://www.youtube.com/watch?v=xIbxLUVQ1Nk","2021-08-07",10269
"10 EASY SEO IDEAS That Will BLOW UP Your Traffic in 2023","https://www.youtube.com/watch?v=9r2pdM5pVJc","2021-08-05",47391
"What Would Neil Patel Do If He Owned Your Website (And You Should Start Doing Too)","https://www.youtube.com/watch?v=X7SY-8_o07U","2021-08-02",25131
"The Best Social Media Platforms For Advertising | Choosing the Right Ad Platform For Your Brand","https://www.youtube.com/watch?v=O6-PxcW1dZ4","2021-07-31",13762
"Social Media Marketing Tips For Every Brand (And What You Should Avoid at All Costs)","https://www.youtube.com/watch?v=FbBVrn_zaUk","2021-07-29",17513
"Effective Growth Hacking Tips to Increase Your Traffic","https://www.youtube.com/watch?v=Tbja-0mTkjw","2021-07-26",8949
"Simple Social Media Patterns You Need To Know to Grow Your Reach, Followers, and Engagement","https://www.youtube.com/watch?v=SiPvYXsiA_s","2021-07-24",13057
"7 Essential Skills Digital Content Writers Need","https://www.youtube.com/watch?v=eyZyIZeu7D4","2021-07-22",27874
"3 SEO Trends in Automation for 2023 (Trend #3 Is Coming Sooner Than You Think)","https://www.youtube.com/watch?v=Dv-44E0lPog","2021-07-19",20666
"The Role of Creativity in Digital Marketing","https://www.youtube.com/watch?v=xCiwfnFR8os","2021-07-17",13930
"A Step-by-Step SEO Strategy For Beginners | Getting Traffic With Old and New Websites","https://www.youtube.com/watch?v=Eh6nlUyqP4M","2021-07-15",24800
"How to Get More From Your Livestream After the Broadcast","https://www.youtube.com/watch?v=BKR7wlTg8gk","2021-07-12",4893
"A New Way To Build Links (And Spend Less Time Finding Opportunities)","https://www.youtube.com/watch?v=KwCjzeXcWpE","2021-07-10",17797
"Digital Marketing Trends You Can't Ignore in 2023","https://www.youtube.com/watch?v=BjKZ7cNt5ro","2021-07-08",15217
"The Best Keywords Aren't Popular Keywords | The Best Keyword Strategy You've Seen","https://www.youtube.com/watch?v=5lEWjtwKlBQ","2021-07-05",20472
"10 Post Pandemic Marketing Tips for Small Businesses | Turn Your Business Around Through Marketing","https://www.youtube.com/watch?v=XPyEjqwy-JY","2021-07-03",38493
"The Quickest Way to Create Popular Web Pages (And Get Tons of Traffic)","https://www.youtube.com/watch?v=fOGF1Sq499g","2021-07-01",18729
"The Future of Digital Marketing Will Surprise You","https://www.youtube.com/watch?v=g2AJYuOfBXI","2021-06-28",372811
"How to Beat Your Competition in Blogging","https://www.youtube.com/watch?v=SE7t5kHTvSs","2021-06-26",12489
"How to Navigate Digital Marketing","https://www.youtube.com/watch?v=Kcn9M_pqyMQ","2021-06-24",9134
"The Biggest Impact on SEO","https://www.youtube.com/watch?v=DKPT6vaWcWk","2021-06-21",20804
"Quick Hacks to get Paying Customers - Interview with Tai Lopez","https://www.youtube.com/watch?v=FVlztc_ewbc","2021-06-19",40475
"Social Media Strategies To Boost Your SEO","https://www.youtube.com/watch?v=UlmlzJTBL8M","2021-06-17",14007
"What To Expect From SEO Technology in 2023","https://www.youtube.com/watch?v=utRVs85Q2Cs","2021-06-14",21628
"The Easiest Way to Get More SEO Traffic","https://www.youtube.com/watch?v=IHl9xb9VmJw","2021-06-12",21811
"How to Boost Your SEO Traffic with Sleeper Content (And Stop Promoting Worthless Content)","https://www.youtube.com/watch?v=kUih7iP-YZY","2021-06-10",16849
"My Biggest SEO Mistake (And Why Your Organic Traffic Might Be Garbage)","https://www.youtube.com/watch?v=EsLhrmdCn3M","2021-06-07",24850
"My Favorite SEO Report - Uncover Your Competitors' SEO Strategy in a Few Clicks","https://www.youtube.com/watch?v=WmztGhy9WNY","2021-06-05",18143
"How to Protect Your SEO Rankings (While Using Google to Help You)","https://www.youtube.com/watch?v=z7XseRkOkU4","2021-06-03",8951
"4 Daily SEO Tasks That You Need to Do (And That Produce Results)","https://www.youtube.com/watch?v=ljFUHMCvhAE","2021-05-31",27947
"How to Continually Find New Keyword Opportunities (That You'll Be Able to Rank For)","https://www.youtube.com/watch?v=84JZvEaj8As","2021-05-29",8158
"How to Track and Improve Your Rankings","https://www.youtube.com/watch?v=CcvVgMUzjiI","2021-05-27",7597
"How to Get More Instagram Story Mentions (Fast and for FREE)","https://www.youtube.com/watch?v=Pwwbquo360g","2021-05-24",30455
"Be anything you want to be","https://www.youtube.com/watch?v=7YYWyZ3An_I","2021-05-24",20541
"I’m going to make my kids pick up trash","https://www.youtube.com/watch?v=_BTVFTFMk50","2021-05-22",16209
"Advanced Growth Tactics - Steal The Top-Performing Tech Companies' Best-Kept Secrets","https://www.youtube.com/watch?v=DHf8AGtvreU","2021-05-22",5959
"Buying a $1000 course won’t make you rich, it will just cost you $1000","https://www.youtube.com/watch?v=WboiojWeKzA","2021-05-21",16872
"How to Use Technology to Grow Faster - Low-Cost Growth Hacks That Scale - Growth Hacking Unlocked","https://www.youtube.com/watch?v=WZOd7vdg11k","2021-05-20",8040
"The Untold Laws of Growth Hacking - Propelling Your Business to Exponential Growth","https://www.youtube.com/watch?v=C6eersDUe9k","2021-05-17",8185
"Funding Scale and Growth: Beyond the Series B Round - Growth Hacking Unlocked","https://www.youtube.com/watch?v=aP4BLKVXPSA","2021-05-15",4974
"How to Raise Money as an Entrepreneur to Fuel Your Growth - Growth Hacking Unlocked","https://www.youtube.com/watch?v=Ol2kGMDvX4o","2021-05-13",8002
"Welcome to Growth Hacking Unlocked! Free Course with Neil Patel | Growth Hacking Training","https://www.youtube.com/watch?v=gaOXEceU6Ic","2021-05-10",18567
"Mastering Conversion Rate Optimization in 2 Weeks - CRO Unlocked","https://www.youtube.com/watch?v=685tvu__Nss","2021-05-08",6266
"Bullet-proof Ways to Increase eCommerce Sales (Without Getting More Traffic) - CRO Unlocked","https://www.youtube.com/watch?v=1Zr35pNe9-0","2021-05-06",6242
"Conversion Hacks  - CRO Unlocked","https://www.youtube.com/watch?v=Mfe9gM0VnDw","2021-05-03",7438
"How to Use Crazy Egg  - CRO Unlocked","https://www.youtube.com/watch?v=RVamsWm_TDg","2021-05-01",13736
"CRO Best Practices  - CRO Unlocked","https://www.youtube.com/watch?v=GijcPbdadz0","2021-04-29",17694
"CRO Unlocked - Free Conversion Rate Optimization Course by Neil Patel - Increase Website Conversions","https://www.youtube.com/watch?v=E_CyyiRXH0U","2021-04-26",30188
"How to Get More Backlinks (FAST)","https://www.youtube.com/watch?v=1Q6minLTBM4","2021-04-24",23240
"The SEO Checklist - How to Fix All of Your SEO Errors","https://www.youtube.com/watch?v=vbJp-jFMXEE","2021-04-22",30142
"SEO For Beginners - The Easiest Way to Generate Traffic","https://www.youtube.com/watch?v=7LAkDz3iyGs","2021-04-19",25530
"The Secret to Being Popular on YouTube","https://www.youtube.com/watch?v=3nykPLWfPu4","2021-04-17",14531
"The Painful Truth About SEO","https://www.youtube.com/watch?v=IAJIJIDss7E","2021-04-15",15084
"How I Generated 37,186,336 Video Views Without Going Viral","https://www.youtube.com/watch?v=lzb1OhuldXY","2021-04-12",22969
"10 Title Tag Tweaks That'll Boost Your SEO Traffic","https://www.youtube.com/watch?v=K2d4BLtQLR0","2021-04-10",52131
"How to Convert Blog Readers Into Customers","https://www.youtube.com/watch?v=3MGT8jnzetk","2021-04-08",9749
"How to Build a Global Brand (7 Shortcuts I'm Using to Build My Brand Internationally)","https://www.youtube.com/watch?v=kBUJ1lPUi8E","2021-04-05",18661
"How to Come Up With Content Ideas That Drive Traffic","https://www.youtube.com/watch?v=7l5btHy2rxQ","2021-04-03",16236
"How to Generate 355 Backlinks With 29 Dollars","https://www.youtube.com/watch?v=JlxTM_DKILs","2021-04-01",52465
"How to Create The Ideal Blog Homepage","https://www.youtube.com/watch?v=UHuz6oJ_3wE","2021-03-29",25310
"How SEOs Should Use Google Analytics","https://www.youtube.com/watch?v=P54LGZFLiqI","2021-03-27",25641
"How I Collected 714,000 Emails Through A Simple Quiz","https://www.youtube.com/watch?v=Gr64i-ZiG68","2021-03-25",22477
"How to Monetize Your AMP Traffic","https://www.youtube.com/watch?v=JQzCms9skTU","2021-03-22",7637
"Here's What You Need to Outrank Your Competition","https://www.youtube.com/watch?v=8WwVWGw8MqQ","2021-03-20",16360
"Do You Really Need High Domain Authority Links?","https://www.youtube.com/watch?v=HVkEcTRngsY","2021-03-18",14511
"How Many Anchor Text Rich Links Do You Really Need?","https://www.youtube.com/watch?v=jYmBcEj9ygs","2021-03-15",12866
"How to Write Blog Posts That Consistently Rank Well on Google","https://www.youtube.com/watch?v=CjzjUbA8nzA","2021-03-13",37790
"How to Find The Ideal Backlink","https://www.youtube.com/watch?v=p4LUA_cZh74","2021-03-11",12854
"Here's How You Assess and Improve a Website's SEO - Neil Patel's Website SEO Breakdown Session","https://www.youtube.com/watch?v=Wxf9AISXBuU","2021-03-08",12181
"Is SEO Really Working For You?","https://www.youtube.com/watch?v=u0uw-RicDKc","2021-03-06",15496
"Turn Your Idea Into a Real Business - 10 Steps from 0 to 100s of Sales Opportunities","https://www.youtube.com/watch?v=H_AUV7Iq2Ec","2021-03-04",62608
"Neil Patel on His First Job Creating Content - Selling Strategies","https://www.youtube.com/watch?v=669n5497uAs","2021-03-01",8922
"7 Landing Page Hacks That'll Double Your Sales - Part 2","https://www.youtube.com/watch?v=4imowpDWrDg","2021-02-27",55655
"7 Landing Page Hacks That'll Double Your Sales - Part 1","https://www.youtube.com/watch?v=SbJnXHfDJPg","2021-02-25",452960
"The BEST Way to Grow Your Instagram With Neil Patel","https://www.youtube.com/watch?v=ahPVHMHyhqE","2021-02-22",19840
"The New Form of Content Marketing","https://www.youtube.com/watch?v=blo4PoOfxM8","2021-02-20",26188
"How to Get More SEO Traffic Even When You Can't Rank #1","https://www.youtube.com/watch?v=jtkNZRLxZpo","2021-02-18",17688
"The Dumbest SEO Hack (That Works)","https://www.youtube.com/watch?v=H096tfFaKPw","2021-02-15",35351
"How to Create The Optimal SaaS Pricing Page","https://www.youtube.com/watch?v=AxTrGSdZC2E","2021-02-13",10871
"How Many Keywords Should A Blog Post Contain? | The Right Way to Use Keywords in your Blog","https://www.youtube.com/watch?v=BuW0FAmo2Ak","2021-02-11",32262
"A Dead Simple SEO Strategy That'll Generate 1 Million Visitors","https://www.youtube.com/watch?v=YA1AvMuMPrk","2021-02-08",46795
