"Title","video_url","Published_date","Views"
"How To Find the Perfect Affiliate Product to Sell That Your Audience Will Love","https://www.youtube.com/watch?v=6zIU6TVxhDI","2019-11-21",97052
"Types of Keywords That Never Sell (Stop Wasting Your Time With Them)","https://www.youtube.com/watch?v=L5kro6xW8eU","2019-11-18",18187
"The Mom & Pop’s Guide to Massive Organic Traffic Through SEO and Content Marketing","https://www.youtube.com/watch?v=4FC2wfBvHAI","2019-11-16",15482
"STOP Trying to Build Marketing Funnels (And do THIS Instead)","https://www.youtube.com/watch?v=p1ChsIfhu2Q","2019-11-14",479092
"9 SEO Metrics You Need to Measure When Launching a New Website","https://www.youtube.com/watch?v=l3T0Hw4A-QQ","2019-11-11",22157
"7 Skills Every Marketer Must Master (Or Else Get Crushed by The Competition)","https://www.youtube.com/watch?v=kolM9NuXXeo","2019-11-09",26835
"How to Stop Overthinking Your Marketing And Do The Work 5x Faster | FAST Business Growth","https://www.youtube.com/watch?v=o2fUCKgi25k","2019-11-07",15868
"How to Find Hundreds of Thousands of SEO Keywords For Free","https://www.youtube.com/watch?v=0HRCWqFUlOY","2019-11-04",30995
"This Social Network’s Organic Reach Will Drop Dramatically in 2023 - Here’s Why","https://www.youtube.com/watch?v=rdTamh3QiIA","2019-11-02",19017
"9 Amazing Google Chrome Extensions That’ll Improve Your Traffic","https://www.youtube.com/watch?v=wePnT4uSNYA","2019-10-31",53358
"7 Advanced Link Building Tactics That Skyrocket Rankings","https://www.youtube.com/watch?v=huslO12gw3U","2019-10-28",17991
"How to do SEO on a One Page Website","https://www.youtube.com/watch?v=Is0y5KPTP_I","2019-10-26",36104
"7 Marketing Lessons Learned From a Google Employee","https://www.youtube.com/watch?v=2dZo6XtGtVY","2019-10-24",18583
"The Advanced SEO Formula That Helped Me Rank For 477,000 Keywords","https://www.youtube.com/watch?v=rJtW05sxLuQ","2019-10-21",26497
"7 SEO Experiments to Test in 2023","https://www.youtube.com/watch?v=o_S2uyuLiFw","2019-10-19",31651
"My 7 Top-Secret Strategies on How to Get More Facebook Likes","https://www.youtube.com/watch?v=LpDIdMrxQCc","2019-10-17",29572
"How to Build 41,142 Backlinks From One Simple Hack","https://www.youtube.com/watch?v=_Jc6UQNRCv8","2019-10-14",66490
"How to Write Headlines People Can’t Help but Click [Powerful Formulas Included]","https://www.youtube.com/watch?v=JOkowdWfD98","2019-10-12",35782
"The Ultimate Wordpress Marketing Setup: 7 Advanced Plugins to Catapult Traffic and Sales","https://www.youtube.com/watch?v=DNHLoSpyw4k","2019-10-10",38948
"Silicon Valley Growth Hacks to Build Multi-Million Dollar Companies | Neil Patel and Aaron Ross","https://www.youtube.com/watch?v=llcSQs4I9Z8","2019-10-09",7072
"How To Turn Ice Cold Visitors Into Loyal Customers","https://www.youtube.com/watch?v=Qf9IOEohZBM","2019-10-07",10720
"How to Leverage Instagram to Actually Make You More Money","https://www.youtube.com/watch?v=HyIj1MgrDww","2019-10-05",15420
"What I’m Most Excited About in 2023 as a Digital Marketer","https://www.youtube.com/watch?v=vgd-IhqEUBI","2019-10-03",27649
"How to Make Sure Algorithm Changes Don’t Destroy Your Business","https://www.youtube.com/watch?v=sHbtxNmPeNE","2019-09-30",8839
"Personal Branding  How to Go From Zero to Hero in No Time","https://www.youtube.com/watch?v=8KvyKt1c9ao","2019-09-28",46193
"How to Monetize Your Blog Without Destroying Your User Experience","https://www.youtube.com/watch?v=hbgvd-wbBGU","2019-09-26",32534
"How to Get Your First 1,000 Visitors Without Spending Money | How to Get Traffic FAST","https://www.youtube.com/watch?v=Rpxd0cT_XAw","2019-09-23",31914
"The Craziest Marketing Experiments I Have Ever Done and Why They Worked","https://www.youtube.com/watch?v=kA-2JAz92RU","2019-09-21",13817
"How to Dominate Facebook Marketing Despite Its Algorithm Hating You","https://www.youtube.com/watch?v=PiDctbBkE1U","2019-09-19",20097
"How to Rank High on Google Without Writing Content","https://www.youtube.com/watch?v=LSY-WaZz4YE","2019-09-16",30263
"6 Reasons You Still Aren’t Ranking: The Cold, Hard Truth","https://www.youtube.com/watch?v=TaK0ss9IEF4","2019-09-14",25766
"The Easiest Way to Get Started With Affiliate Marketing | A Step-by-Step Guide","https://www.youtube.com/watch?v=vFWskR9I_bM","2019-09-12",89402
"7 eCommerce Email Marketing Tactics That Work Like a Charm","https://www.youtube.com/watch?v=DjJDO0QNxpE","2019-09-09",56723
"How to Build Links Without Trying to Build Links | Get HUNDREDS of Links Organically","https://www.youtube.com/watch?v=JNFtYUFZJ90","2019-09-07",17828
"How to Rank on Page 1 of Bing | Bing SEO","https://www.youtube.com/watch?v=srRwLFNLing","2019-09-05",31216
"The Future of Marketing - in 2021 and Beyond","https://www.youtube.com/watch?v=bGQG_-OG6fs","2019-09-03",124987
"The Anatomy Of A High Converting Landing Page | Conversion Rate Optimization Tips","https://www.youtube.com/watch?v=hcPxMuxh5Tc","2019-09-02",249969
"The Number 1 Hack to Converting Visitors into Leads | Lead Generation Tips","https://www.youtube.com/watch?v=DgfmNF2yVS8","2019-08-31",26301
"7 Dead Simple Ways to Bring People Back to Your Site | Increase Your Website Traffic","https://www.youtube.com/watch?v=nzYTy4ZXr74","2019-08-29",11928
"How to Rank for Thousands of Keywords Without Building Links","https://www.youtube.com/watch?v=Prp2lkzNQv4","2019-08-26",36304
"How to Leverage Content Marketing When You Have No Traffic (Small or New Websites)","https://www.youtube.com/watch?v=DGaYx22GXNw","2019-08-24",17757
"How to Get The Most Out of Your Instagram Followers","https://www.youtube.com/watch?v=BjngjBzZpVw","2019-08-22",11254
"7 Landing Page Flaws That’ll Kill Your Conversions | Landing Page Creation Tips","https://www.youtube.com/watch?v=U5t2IQv6kJQ","2019-08-19",74124
"How to Do SEO For A Tiny Site With No Backlinks | Neil Patel SEO Tips","https://www.youtube.com/watch?v=Y772PSqmudo","2019-08-17",306840
"How to Rank Your Old Content (And Start Ranking for Hundreds Of New Keywords)","https://www.youtube.com/watch?v=GbbM9L5e5cU","2019-08-15",13123
"The Anatomy Of A Perfect SEO Campaign | Neil Patel","https://www.youtube.com/watch?v=V2udMQNVCAc","2019-08-12",19349
"One Simple Hack To Leverage Social Media When You Have no Money or Followers","https://www.youtube.com/watch?v=As4C0ymiiVE","2019-08-10",24537
"7 Advanced Ways to Get Free Traffic That Converts | Neil Patel","https://www.youtube.com/watch?v=rAF41CmKiIo","2019-08-08",93272
"7 Marketing Tools That’ll Instantly Boost Your Traffic | Neil Patel","https://www.youtube.com/watch?v=VXk5kVrxab0","2019-08-05",73109
"The Secret to Making Paid Advertising Work","https://www.youtube.com/watch?v=5qFWeF8gGTM","2019-08-03",33858
"Is Instagram Marketing Really Worth it?","https://www.youtube.com/watch?v=Y11g2oVqKFs","2019-08-01",25321
"How to Market Yourself in the most Competitive Industries","https://www.youtube.com/watch?v=XPp9YaQm3WE","2019-07-29",16400
"Why I Decided To Disrupt the SEO Industry | My Marketing Plans for 2023","https://www.youtube.com/watch?v=jLHAu_wjG-w","2019-07-27",27341
"Here’s What I Would Do If I had To Start Over and Rebuild My Business (It’s NOT What You Think)","https://www.youtube.com/watch?v=YbPP_5htg-8","2019-07-25",16239
"The Fastest Ways to Bring Traffic to a New Website","https://www.youtube.com/watch?v=LdnWx49LUJc","2019-07-22",590183
"Why Your Facebook Ads Don’t Work (and How to Make Them Profitable)","https://www.youtube.com/watch?v=HYmWww4e3Is","2019-07-20",91278
"eCommerce SEO: How to Bring Organic Traffic to Your Online Store","https://www.youtube.com/watch?v=gyoMdEaU7YQ","2019-07-18",71605
"How to Build Backlinks Without Paying for Them","https://www.youtube.com/watch?v=MjO8lIQ68-8","2019-07-15",397621
"Is Blogging Still Worth it?","https://www.youtube.com/watch?v=LxlhjyxKlFI","2019-07-13",68027
"How to Find Endless Content Ideas With One FREE Tool","https://www.youtube.com/watch?v=Vt2GOyLIHWk","2019-07-11",155678
"Selling The Invisible: The 5 Best Ways To Sell Your Services","https://www.youtube.com/watch?v=LMAPoKW1CUY","2019-07-08",147932
"How Many Blog Posts Should You Write Per Month?","https://www.youtube.com/watch?v=EihqZWH6aT4","2019-07-06",57016
"The Perfect SEO Setup for Wordpress: 8 Plugins to Skyrocket Your Rankings and Traffic","https://www.youtube.com/watch?v=JiqNIUQNQ7I","2019-07-04",406752
"How to Ace a Digital Marketing Job Interview","https://www.youtube.com/watch?v=FInxmMiX0SM","2019-07-01",130390
"How to Increase Your eCommerce Sales by 10% With Email Marketing","https://www.youtube.com/watch?v=_6e3WTYucP0","2019-06-29",10556
"Watch This If Your Paid Ads Aren’t Generating Any Sales","https://www.youtube.com/watch?v=S79xcD28Afc","2019-06-27",33167
"Marketing Storytelling: How to Craft Stories That Sell And Build Your Brand","https://www.youtube.com/watch?v=7QDNVMVF7ss","2019-06-24",87999
"The Ultimate SEO Checklist For New Websites | Get Traffic & Rankings FAST","https://www.youtube.com/watch?v=hci-LWf1v7E","2019-06-22",44927
"What is Black Hat SEO Costing You? (How to Outrank Black Hat SEO Competitors)","https://www.youtube.com/watch?v=Te30x0Ij7jc","2019-06-20",12468
"How to Generate 10K visitors from a Brand New Blog In Under 6 Months","https://www.youtube.com/watch?v=NGynMaatjKs","2019-06-17",113887
"How To Repurpose Your Blog Content For Social Media | Content Marketing Strategy","https://www.youtube.com/watch?v=e5mE_C3Jikw","2019-06-15",12979
"The Hard Truth About Marketing & What Will Stop Working In The Near Future","https://www.youtube.com/watch?v=2jzzB_AeChA","2019-06-13",19042
"How to Get 4 Million Visits Per Month With One Simple Keyword Hack","https://www.youtube.com/watch?v=zK4oTuiFV1E","2019-06-10",328867
"The Most On Demand Digital Marketing Skills in 2023 (High-Income Skills to Master)","https://www.youtube.com/watch?v=yyitwdk4QmY","2019-06-08",134576
"4 Marketing Strategy Principles - My Template for Marketing Anything","https://www.youtube.com/watch?v=gNAE8g2tytA","2019-06-06",57064
"5 Techniques to Promote Your Content When You Don’t Have Any Money","https://www.youtube.com/watch?v=BUdRnkjHQKo","2019-06-03",22622
"The Truth About Funnel Hacking: Is it Possible to Copy Someone Else's Business Model?","https://www.youtube.com/watch?v=yPH7v6Yx1kM","2019-06-01",22051
"Learn SEO For Free! How to Jumpstart Your SEO Career Without Spending a Dime [2023 Edition]","https://www.youtube.com/watch?v=7a07862HFNc","2019-05-30",27040
"The Worst SEO Advice Ever! (That You May Be Following)","https://www.youtube.com/watch?v=JEq6xzfL6tQ","2019-05-27",30464
"The Only Rule In Marketing You Have To Follow (Ignore This And Your Marketing Won't Work)","https://www.youtube.com/watch?v=3lZoSQkl3_0","2019-05-25",27756
"How to Start A Digital Marketing Agency As a Beginner in 2023 (Your FIRST $10k+/month)","https://www.youtube.com/watch?v=YymWhauqjoA","2019-05-23",185816
"8 Things About SEO to Unlearn in 2023 (And What You Should Learn RIGHT NOW)","https://www.youtube.com/watch?v=y9unxhm-yA0","2019-05-20",30145
"Pricing Strategies - How to Price Your Product or Services For Maximum Profit","https://www.youtube.com/watch?v=0NGQLgrHRe4","2019-05-18",63943
"My Marketing Plan Process - 6 Steps to Marketing Any Business (Products or Services)","https://www.youtube.com/watch?v=qn_Po40ZI2E","2019-05-16",78190
"Do Yourself a Favor: STOP Trying to Rank #1 For Keywords on Google (SEO Strategy 2023)","https://www.youtube.com/watch?v=cBP7NUS5FkI","2019-05-12",24298
"The Hard Truth About Passive Income | Is It Still Possible To Make Money With Blogging?","https://www.youtube.com/watch?v=jCkUg7_LkAE","2019-05-11",33988
"Ranking #1 With a New Website on Google in 2023 | Is it Even Possible?","https://www.youtube.com/watch?v=91W0sa9Qfg8","2019-05-09",75320
"6 Facebook Ads Tools and Strategies to Beat Your Competition in 2023 (Spy FB Ads & Crush Them!)","https://www.youtube.com/watch?v=Qt5aL_MBS7A","2019-05-06",153570
"Use These 7 Tools to Spy On Your Competitors and Steal Their Best Marketing Tactics","https://www.youtube.com/watch?v=QiyyJUnvmB0","2019-05-04",95829
"How I Gain 1,254 Followers Per Week on Instagram Organically in 2023 (Fast & 100% Free)","https://www.youtube.com/watch?v=28lYwVjkTxM","2019-05-02",208602
"A Simple Hack to Finding the Right Keywords to Rank #1 on Google (The Best FREE SEO Tool)","https://www.youtube.com/watch?v=2Wtjc1o2oI0","2019-04-29",74320
"Why The Links You’re Building Don’t Bring You Any Traffic (Building High-Quality Backlinks)","https://www.youtube.com/watch?v=pymmd-3Hrvw","2019-04-27",27697
"Do THIS if Your eCommerce Product Doesn’t Sell (And Watch Your Conversions Skyrocket)","https://www.youtube.com/watch?v=oqx7IjS6SOg","2019-04-25",14432
"How to Start A Career in Digital Marketing in 2023 | Digital Marketing Training by Neil Patel","https://www.youtube.com/watch?v=DoLzQN1m7sU","2019-04-22",321551
"7 Online Marketing Mistakes You Need to Stop Making | Neil Patel","https://www.youtube.com/watch?v=E5zf5xgOCyE","2019-04-20",20896
"How to Come Up With YouTube Video Topics That Will Rank High, Bring You More Views & Engagement","https://www.youtube.com/watch?v=h0FggHZhvtc","2019-04-18",20044
"Can You Still Make a Living Off Affiliate Marketing? The TRUTH About Affiliate Marketing","https://www.youtube.com/watch?v=NYIj66KP-Tk","2019-04-15",57225
"1 Simple Hack to Getting 1000 Likes on Facebook","https://www.youtube.com/watch?v=3UNBH439N38","2019-04-13",885736
"How to Spy on Your Competitors' SEO & Steal Their Traffic Through Competitor Analysis","https://www.youtube.com/watch?v=UEpNM5yvyh8","2019-04-11",88460
"99.9% Of eCommerce Products Will NEVER Sell Without this! | eCommerce Marketing Strategy","https://www.youtube.com/watch?v=GkOM7q9BYGQ","2019-04-08",236176
"7 social media predictions that will happen by the end of 2019","https://www.youtube.com/watch?v=qw_1jGlpV9Y","2019-04-06",34621
"7 Lessons I Learned from Losing a Million Dollars Before I Was 21 [Young Entrepreneur Motivation]","https://www.youtube.com/watch?v=AV2VkoQR1xU","2019-04-04",12738
"5 Beginner SEO Mistakes That Are Ruining Your Website Traffic And What You Should Do Instead","https://www.youtube.com/watch?v=yX20m5mprCE","2019-04-01",79153
"Why Offering Discounts Will Put You Out of Business | Discounting for Online and Offline Businesses","https://www.youtube.com/watch?v=zLz3JSvNUMM","2019-03-30",19181
"Why Your Social Media Content Is Garbage and How to Fix It! (Social Media Marketing Strategy)","https://www.youtube.com/watch?v=u_9zUbjk15E","2019-03-28",27856
"The Number One Reason 99% of Your Visitors Don’t Buy from You [Fast Conversion Rate Optimization]","https://www.youtube.com/watch?v=3yT22HOenzE","2019-03-25",28023
"You Don’t Need a Morning Routine to Be Successful But You Do Need This","https://www.youtube.com/watch?v=jhXe1Xz4iCQ","2019-03-23",16117
"The Three Unseen Laws of Entrepreneurship | Neil Patel","https://www.youtube.com/watch?v=ETHO5QMCUEk","2019-03-21",10471
"The Best Way to Get More Instagram Followers [2023 Update]","https://www.youtube.com/watch?v=psSkPDBT70g","2019-03-18",62286
"Sell Me This Pen – The Key to Selling Anything | Sales Techniques","https://www.youtube.com/watch?v=459P5Ve0lgc","2019-03-16",92502
"The Three Unseen Laws of SEO (Ignore These and Ranking #1 on Google Won’t Happen)","https://www.youtube.com/watch?v=NeikF24UzUA","2019-03-14",72568
"The Real Reason Your Blog Doesn’t Rank (How to Write a Blog Post that Ranks in 2023) | SEO Tutorial","https://www.youtube.com/watch?v=HrHylFShZcA","2019-03-11",98484
"Discounting is for Dummies – Here’s Why And What to Do Instead | Sales Training","https://www.youtube.com/watch?v=vwZeqbYZS_Q","2019-03-09",25983
"The Power of No – The Best Sales Tactic | Neil Patel","https://www.youtube.com/watch?v=uLgUg5QZ19o","2019-03-07",20008
"7 Things to Do Before Becoming an Entrepreneur","https://www.youtube.com/watch?v=N6V7gXaz_io","2019-03-04",32548
"How Books Can Make You More Money Even If You Don't Read Them | Neil Patel","https://www.youtube.com/watch?v=MNyZqibqqmQ","2019-03-02",16263
"7 Rules of Money | Neil Patel","https://www.youtube.com/watch?v=Hl5jsFQVHYw","2019-02-28",13139
"Social Media Marketing in 2019: Here’s What You Haven’t Tried | Neil Patel","https://www.youtube.com/watch?v=9UtMEwH5cyw","2019-02-26",25619
"How to Grow Your Business Using Video on LinkedIn | Neil Patel","https://www.youtube.com/watch?v=3-N5ynWSS00","2019-02-23",17867
"How To Maximize Your Reach and Sales Using Video Marketing | Neil Patel","https://www.youtube.com/watch?v=3mMjthcKUiI","2019-02-21",22843
"How to Growth Hack Your Personal Brand | Neil Patel","https://www.youtube.com/watch?v=hMxLBY1_yK0","2019-02-18",15682
"What Does Content Marketing Look Like in 2019 | Neil Patel","https://www.youtube.com/watch?v=tRXT58fDzjg","2019-02-16",76738
"Get More Social Media Traffic Using These 7 Free Tools | Neil Patel","https://www.youtube.com/watch?v=gCJgHbjXWec","2019-02-14",207927
"Top 5 Digital Marketing Conferences You Should Attend | Neil Patel","https://www.youtube.com/watch?v=91riCuKUKU4","2019-02-11",10446
"How to Take Your Digital Marketing to The Next Level | Neil Patel","https://www.youtube.com/watch?v=jmRunRQU1wc","2019-02-09",18591
"6 Advanced SEO Techniques To Use In 2023 | Neil Patel","https://www.youtube.com/watch?v=vsnjC10bC9M","2019-02-07",111441
"How to Become an SEO Expert in 2023 | Neil Patel","https://www.youtube.com/watch?v=bQTnkN1nUek","2019-02-04",118561
"How to Work with Multi-Million Dollar Companies | Neil Patel","https://www.youtube.com/watch?v=BAgMFNMHxho","2019-02-02",12091
"7 Social Media Hacks That’ll Make Your Business Grow Faster | Neil Patel","https://www.youtube.com/watch?v=3x9AWh7g1YQ","2019-01-31",201743
"How to Become The Next Neil Patel | My Personal Branding Secrets","https://www.youtube.com/watch?v=-Zn12KKyA84","2019-01-28",24173
"DON’T Use Paid Ads My #1 Organic Marketing Strategy | Neil Patel","https://www.youtube.com/watch?v=fGOv5oU5vww","2019-01-26",238859
"How to Write a Blog Post From Start to Finish | Neil Patel","https://www.youtube.com/watch?v=Q8rN3JKqUc8","2019-01-24",1351158
"SEO in 2019 What Will and Won’t Work | Neil Patel","https://www.youtube.com/watch?v=I0joqcqpiO4","2019-01-21",136462
"How I Generated 37,391 Visitors to My Blog Post | Neil Patel","https://www.youtube.com/watch?v=QJUIk3qhQ-w","2019-01-19",46030
"How to Develop a Growth Hacking Mentality | Neil Patel","https://www.youtube.com/watch?v=qQqRKOYBeOU","2019-01-17",34402
"Does Blogging Still Work In 2019 | Neil Patel","https://www.youtube.com/watch?v=i4CY-XD6agM","2019-01-14",97588
"How to Own the Front Page of Google Not Just Rank #1 | Neil Patel SEO Basics","https://www.youtube.com/watch?v=akj2Q3Ha9Ho","2019-01-12",37953
"How to Grow Your Website in a Competitive Space | Neil Patel","https://www.youtube.com/watch?v=TMYn3gfd520","2019-01-10",36372
"How to Grow Your Business With PayPal","https://www.youtube.com/watch?v=48V15AyyJ4I","2019-01-09",9980
"How to Get More Downloads For Your Podcast | Neil Patel","https://www.youtube.com/watch?v=z1ofTIsaf_Y","2019-01-07",15588
"The Best SEO Tools for Beginners | Neil Patel","https://www.youtube.com/watch?v=jbB-ZZ4k8X0","2019-01-05",114858
"How to Get More Views on Your Instagram Stories | Neil Patel","https://www.youtube.com/watch?v=Wstj3a07_b8","2019-01-03",51510
"The Difference Between Ranking on Google vs YouTube | Neil Patel","https://www.youtube.com/watch?v=2s6h_DIZDAA","2018-12-31",22477
"Stop Making These Social Media Marketing Mistakes | Neil Patel","https://www.youtube.com/watch?v=TnQt_-uwR7g","2018-12-29",82332
"How to Choose the Right Digital Marketing Agency for Your Business | Neil Patel","https://www.youtube.com/watch?v=KNYC72i7lHE","2018-12-27",29539
"The 3 SEO Tools I Use Rank #1 on Google | Neil Patel","https://www.youtube.com/watch?v=GK-0Ix1fUz8","2018-12-24",60374
"Organic VS Paid Marketing Search Strategies The Pros and Cons | Neil Patel","https://www.youtube.com/watch?v=7V3HMRJ8U40","2018-12-22",66349
"My Favorite SEO Hack to Increase Website Traffic | Neil Patel","https://www.youtube.com/watch?v=WTWZQ_4_zNk","2018-12-20",41940
"Is Growth Hacking Dead? | Neil Patel","https://www.youtube.com/watch?v=cAq0ulz6Hpw","2018-12-17",18976
"Rank #1 on Google Using 7 Free SEO Tools | Neil Patel","https://www.youtube.com/watch?v=snqHKBYfkQw","2018-12-15",454033
"How to Leverage Facebook Groups for Building an Email List | Neil Patel","https://www.youtube.com/watch?v=MjQRmT82JBM","2018-12-13",18179
"How Digital Marketing Will Change in 2019 | Neil Patel","https://www.youtube.com/watch?v=b-gwbVJqi9Y","2018-12-10",299079
"Why I Use Instagram For B2B | Connecting Through Social Media","https://www.youtube.com/watch?v=dDDpdAnb_Es","2018-12-08",14846
"Growth Hacking Strategies | Tips to Get More Traffic, Customers and Traction","https://www.youtube.com/watch?v=YbvPok3xo5g","2018-12-04",107752
"My Favorite Marketing Channel (It's NOT What You Think)","https://www.youtube.com/watch?v=p0Qgg3XSft4","2018-12-01",20852
"How to Rank on Google’s First Page for Competitive Terms","https://www.youtube.com/watch?v=OOnOnOIqV-k","2018-11-29",16727
"How to Create a Digital Product That Generates (AT LEAST) $100,000 Per Month","https://www.youtube.com/watch?v=dU4rWLHAcoo","2018-11-27",1306254
"When is the RIGHT Time to Hire a Business Lawyer?","https://www.youtube.com/watch?v=_TmX1PcjIhk","2018-11-24",4715
"How to Create a High Converting Affiliate Marketing Sales Funnel","https://www.youtube.com/watch?v=ULrck4Vzyu0","2018-11-22",18267
"7 Valuable Landing Page Hacks to DOUBLE Your Sales","https://www.youtube.com/watch?v=K7LmWEPII7g","2018-11-20",23397
"The #1 Tip To Grow Your Business and Attract New Customers","https://www.youtube.com/watch?v=av9WfdR4cVk","2018-11-17",11635
"From Brick and Mortar to an Online Business in a Digital World","https://www.youtube.com/watch?v=xQDwBwaT3yc","2018-11-15",7961
"7 SEO Experiments To SKYROCKET Your Traffic","https://www.youtube.com/watch?v=R1oWfzR98v4","2018-11-13",34458
"Why You Should NEVER Burn Bridges In Business","https://www.youtube.com/watch?v=dn6cwcon5IM","2018-11-10",8783
"Why I HATE Adsense (And REFUSE To Use It On My Website)","https://www.youtube.com/watch?v=oafFXuOygJM","2018-11-08",55105
"Advanced Content Marketing Strategy (Step-By-Step) | A Look Into Neil Patel's Brain","https://www.youtube.com/watch?v=iwdtj5I-HYg","2018-11-06",43941
"One (SHOCKING) Reason Large Companies Fail","https://www.youtube.com/watch?v=gbNMCvAFo_I","2018-11-03",7217
"Accepting Bitcoin as Payment: Smart Business Move or (HUGE) Mistake?","https://www.youtube.com/watch?v=-BnBgmjZZD8","2018-11-01",13745
"How to Get More Traffic by Blogging LESS | 4 (Sneaky) Tips","https://www.youtube.com/watch?v=ey1GbXO-Y7M","2018-10-30",129023
"Employees FIRST? (My #1 Tip for Business Owners)","https://www.youtube.com/watch?v=yqUpNw8cikU","2018-10-27",5812
"How to Find the (PERFECT) Niche for Your Business","https://www.youtube.com/watch?v=y626q-G5ZpM","2018-10-25",51356
"How to Recover Your (DYING) Facebook Traffic","https://www.youtube.com/watch?v=g-0n8p_liYE","2018-10-23",15035
"Why You Should (Always) Dress For Success","https://www.youtube.com/watch?v=BAqKCaJ0vRU","2018-10-20",21495
"How Much Should You Invest In Marketing? (PROVEN Strategy)","https://www.youtube.com/watch?v=vTrLHTv3TOw","2018-10-18",20685
"How to Become a Multi-Millionaire by LOSING Money","https://www.youtube.com/watch?v=AbcoFUHcs9M","2018-10-16",20023
"How To Undercut Your Competitors Price (And Still Make Money)","https://www.youtube.com/watch?v=TLTL8mzkVLE","2018-10-13",10112
"Improve Bounce Rate With One (Simple) Hack","https://www.youtube.com/watch?v=8Zg8aVvxFgI","2018-10-11",15659
"7 Unknown Marketing Tools to SKYROCKET Your Traffic","https://www.youtube.com/watch?v=cBC-E1bTSi0","2018-10-09",29492
"How To Grow Your Business Through Word-Of-Mouth Marketing","https://www.youtube.com/watch?v=_6NHKgUH8ts","2018-10-06",26648
"How to Manage (Multiple) Social Media Accounts","https://www.youtube.com/watch?v=5dyn03RSWVA","2018-10-04",119692
"The Best Alternative to Google Ads (My #1 Growth Hack)","https://www.youtube.com/watch?v=5lW635Uo7dw","2018-10-02",167633
"WordPress Mistakes to AVOID for Startup Websites","https://www.youtube.com/watch?v=SEqUoEYdPzo","2018-09-29",21959
"Backlink HACKS (The Easy way to Index Faster)","https://www.youtube.com/watch?v=qgPoztS9CWM","2018-09-27",40799
"One (Simple) Hack to Get More Website Traffic FAST","https://www.youtube.com/watch?v=BbGCl5BP3Mk","2018-09-25",50467
"Business Never Sleeps (How to Stay Ahead of Your Competitors)","https://www.youtube.com/watch?v=i3CLLgq_UUI","2018-09-22",8086
"How to Commission and Structure a (High-Performing) Sales Team","https://www.youtube.com/watch?v=7te138iaH-s","2018-09-20",57431
"How to Start Social Media Marketing  (4 ESSENTIAL Tips for Beginners)","https://www.youtube.com/watch?v=-tdFvJLw2UQ","2018-09-18",698250
"Where (and When) To Cut Costs When Your Business is Struggling","https://www.youtube.com/watch?v=Y9XduPWaMOA","2018-09-15",6132
"Facebook Video Monetization (How Profitable is it REALLY?)","https://www.youtube.com/watch?v=6tx9BAyDOIY","2018-09-13",71478
"5 Insider Tips: How to Go From Page 2 to Page 1 of Google","https://www.youtube.com/watch?v=pxN6wX92wu8","2018-09-11",29465
"How Passion Keeps Me Going (Grind Through)","https://www.youtube.com/watch?v=7paQn8lEgyo","2018-09-08",5492
"International SEO Strategy (Get Started NOW)","https://www.youtube.com/watch?v=OSOrolTuk9o","2018-09-06",19184
"How To Measure ROI of Your Content Marketing (NEVER Waste Time or Money Again)","https://www.youtube.com/watch?v=_OF2hf8GqCk","2018-09-04",16574
"NEVER Rely on a Single Traffic Source for Your Business","https://www.youtube.com/watch?v=NNCz339pxDo","2018-09-01",8282
