"Title","video_url","Published_date","Views"
"Stocks Vs Mutual Funds | Where to Invest Money? | Share Market Tips & Advice","https://www.youtube.com/watch?v=pE9REHhtP-0","2021-07-18",431128
"How to Earn Money From Mobile Phone? | Earn Online Income without Investment | Best Earning App","https://www.youtube.com/watch?v=RNNFmD9kG2M","2021-07-16",3399628
"How to Invest in IPO (Initial Public Offering)? | Apply for #IPO on Angel Broking","https://www.youtube.com/watch?v=zoMazjAInPE","2021-07-15",108194
"Don't Invest in IPO ⚠️ without Knowing these Hidden Facts!| #IPO Review | Stock Market","https://www.youtube.com/watch?v=jT6R9bg2dYs","2021-07-14",284725
"Secret Tricks to Invest in IPO for 100% Allotment of Shares | #StockMarket Secrets","https://www.youtube.com/watch?v=nEw3OjLiihc","2021-07-13",243691
"Why #WarrenBuffett does not Invest in IPO? Why not to Invest in IPO?","https://www.youtube.com/watch?v=ogqbJ11kJm4","2021-07-12",140899
"Zomato IPO Review & Details | How to Earn Money from Investment in #Zomato IPO?","https://www.youtube.com/watch?v=blto1EwxEdg","2021-07-11",619764
"What is IPO? | How to Invest in IPO & Earn Money? | #IPO Investment Explained for Beginners","https://www.youtube.com/watch?v=gWrR5qPEmWE","2021-07-10",1348804
"How to become a Real Millionaire from #StockMarket? | Investing in Passive Mutual Funds","https://www.youtube.com/watch?v=Qu73OnycnjU","2021-07-08",3744515
"How Much #Money Should I Spend on #Marriage? | Reality of Big Fat Indian Weddings","https://www.youtube.com/watch?v=TS_HnNx3SYk","2021-07-07",162584
"How to Live a Loan Free Life? | Freedom From Debt Trap | #FinancialEducation","https://www.youtube.com/watch?v=RYOxth2DD9U","2021-07-06",146795
"Should I Take Loan or Not? | How to Make Money with Loans? | Benefits of Taking Loans","https://www.youtube.com/watch?v=y4ridNS-lAI","2021-07-05",682174
"Will India Ban Bitcoin? Future of #Bitcoin and Cryptocurrencies in India","https://www.youtube.com/watch?v=RY75E_pbVOI","2021-07-04",118980
"How to Retire Early, Young & Rich?🔥 | How to be Rich & Successful | Pushkar Raj Thakur Interview","https://www.youtube.com/watch?v=PgR3jsre5pk","2021-07-03",109126
"What is Forex? Forex Trading for Beginners | How to Make Money Online?","https://www.youtube.com/watch?v=vX0mVnOelHA","2021-07-01",2221291
"What is the Right Age for Marriage? | Best Advice before Marriage","https://www.youtube.com/watch?v=b6RadohEVww","2021-06-29",434549
"Sex Before Marriage Wrong or Right?","https://www.youtube.com/watch?v=DNM1rJRPZ8s","2021-06-28",9958807
"इतने पैसे और कोई Earning App नहीं दे रही! | Link is in the Pinned Comment Also 👉🏻","https://www.youtube.com/watch?v=VPv9e421gB8","2021-06-27",1030486
"Where to Invest Money in Your 20s? | Millionaire's Guide for Investment | #FinancialEducation","https://www.youtube.com/watch?v=x8T79O-U_yo","2021-06-26",527837
"Save Your Bank Balance | #RiskManagement & Insurance for Financial Security","https://www.youtube.com/watch?v=J3ZZeSN-NcM","2021-06-25",102512
"How to be #Rich? Game Plan for Financial Freedom | #FinancialEducation","https://www.youtube.com/watch?v=IxnPjnpHh3Y","2021-06-24",235614
"3 Best Earning Apps | Make #Money Online Daily | Earn #ExtraIncome | Work From Home","https://www.youtube.com/watch?v=DAOS_QonMA8","2021-06-22",699756
"Easiest #StockMarket Strategy | Automatic Support Resistance with #PivotPoints","https://www.youtube.com/watch?v=g7ROmikPfm4","2021-06-21",896412
"5 Financial Lessons from Covid | How to be Real Rich? | #FinancialFreedom Tips","https://www.youtube.com/watch?v=zQ07H6cKvn0","2021-06-20",102803
"Earn Money Online with #CopyTrading | Simple Earning Method | Earn Extra Income","https://www.youtube.com/watch?v=TbETYM4_0i0","2021-06-20",745173
"#StockMarket for Beginners | #BollingerBands Trading Strategy | Technical Analysis","https://www.youtube.com/watch?v=9TCLTz3GG3g","2021-06-17",871979
"Make Money in #StockMarket 😎 using #Ichimoku Cloud Trading System","https://www.youtube.com/watch?v=HT0WnagbS4M","2021-06-17",464837
"#SuperTrend Indicator |. Easiest Technical Analysis for Beginners | #StockMarket","https://www.youtube.com/watch?v=okzG0vb55Vk","2021-06-15",773958
"RSI Indicator in Live #StockMarket | Technical Analysis for Beginners","https://www.youtube.com/watch?v=WZkXcfr4r3c","2021-06-14",1928213
"Risk Hai to Ishq Hai? | Risk Management in #StockMarket | Risk to Reward Ratio","https://www.youtube.com/watch?v=s7KApswForA","2021-06-13",476516
"Earn Money in Stock Market using  #MACD Indicator | #TechnicalAnalysis","https://www.youtube.com/watch?v=V8lSmfxZBFw","2021-06-11",811492
"Copy Warren Buffett's Strategy for Stock Selection | Learn to Earn Money in #ShareMarket","https://www.youtube.com/watch?v=llbyg99eeQg","2021-06-10",188992
"#EarnMoney in Stock Market Crash | Short Selling & Option Trading Demo in #Upstox","https://www.youtube.com/watch?v=3KrYKN6PNGs","2021-06-09",365922
"Which #Shares to Buy Today? | Best Shares for Long Term Investment | #StockMarket for Beginners","https://www.youtube.com/watch?v=OYfuDzJujjs","2021-06-08",847043
"How to #EarnMoney Online? | Domain Purchase & Selling for Business | #DigitalMarketing","https://www.youtube.com/watch?v=7MPk-aMaMbc","2021-06-06",219437
"How #China is Cheating the World to Become Super Power?","https://www.youtube.com/watch?v=0LAMkIIOXlM","2021-06-04",214312
"Second Hand Car Vs New Car | Know these 5 Things Before You Buy Any Car | #FinancialEducation","https://www.youtube.com/watch?v=RCIN63wnB08","2021-06-02",2192708
"Technical Analysis for Beginners in Stock Market | Share Market Techniques","https://www.youtube.com/watch?v=mRfVY9Wbnrs","2021-05-31",11765194
"What is Share Market? #StockMarket Explained in Hindi from Beginners | How to Make Money?","https://www.youtube.com/watch?v=Zt6bVL39b9M","2021-05-30",606517
"The Road to #FinancialFreedom & The Money Trap | #Financial Education","https://www.youtube.com/watch?v=8mXXALPWsII","2021-05-28",177899
"Why Government will Not Ban #Twitter, Facebook, Youtube & Instagram? | New IT Rules","https://www.youtube.com/watch?v=h4y6rK88ICo","2021-05-26",130452
"Book Profits using #Straddle & #Strangle Option Strategy | Share Market | Live Demo on #Upstox","https://www.youtube.com/watch?v=2d6-eEpvWoM","2021-05-25",1368643
"How to get Personal Loan without Guarantee? Apply Quick Online Personal Loan","https://www.youtube.com/watch?v=LiP4jDe-hf8","2021-05-24",145097
"#NFT Explained in Hindi | How to #MakeMoney with Non Fungible Tokens? | Ethereum Blockchain","https://www.youtube.com/watch?v=XWQCD-TYXhA","2021-05-23",883968
"#Cryptocurrency Fundamental Analysis | Which Coin to Buy? | Bitcoin Study | Financial Education","https://www.youtube.com/watch?v=26pKp6dy9JA","2021-05-22",675260
"#OptionsTrading Live for Beginners | How to Make Money in #ShareMarket? | Live Demo on #Upstox","https://www.youtube.com/watch?v=ZsqSucH58D4","2021-05-21",10029139
"Why is Bitcoin Crashing? Reasons of Cryptocurrency Market Crash | ChinaBan on Cryptocurrency","https://www.youtube.com/watch?v=x_ARPrlDXtE","2021-05-20",568863
"#Intraday Trading for Beginners | How to Earn Profits from #StockMarket? | Live Trading","https://www.youtube.com/watch?v=SvcCriKKBaA","2021-05-19",7487759
"How to Get Rich from #StockMarket? | Which Shares to Buy? | #GoSelfMadeUniversity 🔥","https://www.youtube.com/watch?v=ndjPh_aGp-w","2021-05-18",1008880
"How to Buy U.S. Stocks in India? | American #ShareMarket Investment | #GoSelfMadeUniversity","https://www.youtube.com/watch?v=6_1nBmnTYgw","2021-05-18",647697
"Motivational #Rap Song 🎵| #GoSelfMade Revolution | Latest Songs 2021🔥","https://www.youtube.com/watch?v=q_qU_qCMFG4","2021-05-17",799970
"#DogeCoin to the Moon | Secret Game Plan of #ElonMusk on #Bitcoin | Best Cryptocurrency","https://www.youtube.com/watch?v=xoJ_8sybu2E","2021-05-16",1405145
"Don't be a Fool | #ShareMarket Fraud | Stock Market Scams | Investing Tips & Advice","https://www.youtube.com/watch?v=PzbImHIkLC0","2021-05-14",868317
"Best Cryptocurrency | Doge Coin to the Moon & This Coin to the Mars | Reality of Bitcoin","https://www.youtube.com/watch?v=87fbXbK2Z-U","2021-05-13",1230438
"How to choose Best #Multibagger Stocks? | What Stocks to Buy for Investment? | #ShareMarket Trading","https://www.youtube.com/watch?v=V7WzKFIw-uk","2021-05-12",856537
"How to Buy You First Stock on #Upstox? | Step by Step #StockMarket for Beginners | Buy Shares Online","https://www.youtube.com/watch?v=oGkM7XY3aus","2021-05-12",1066834
"Earn ₹5000 Daily Online 🔥 | No Investment Earning App | #AffiliateMarketing Business","https://www.youtube.com/watch?v=nr9yop_8mUw","2021-05-12",1073129
"How to Choose the Right Stocks for Investment? | Fundamental Analysis | #ShareMarket Tips & Tricks🔥","https://www.youtube.com/watch?v=Lg5rUbqfRVA","2021-05-11",2945320
"Which Shares to Buy? | PE Ratio | How to Find #IntrinsicValue of a Stock? | Fundamental Analysis","https://www.youtube.com/watch?v=axxX6WeJXIY","2021-05-10",1724981
"Earning From #ShareMarket | Make Money in Stock Market | Passive Income | #GoSelfMadeUniversity","https://www.youtube.com/watch?v=rLb7aIKDV7Q","2021-05-09",1868225
"Earn Regular Income from #ShareMarket | Power of #Dividend Stocks 🔥 | #GoSelfMadeUniversity","https://www.youtube.com/watch?v=ZQw2Bv9_UlU","2021-05-08",1653218
"#Earn Money in Stock Market | #ShareMarket Tips | #GoSelfMadeUniversity","https://www.youtube.com/watch?v=u13v-evbAIQ","2021-05-07",274151
"Stock Market for Beginners | What is #ShareMarket? | #GoSelfMadeUniversity 🔥","https://www.youtube.com/watch?v=AWptCG5jEKQ","2021-05-06",1441743
"Why #Pakistan 🇵🇰 is a Poor Country? | How to Make #India 🇮🇳 Rich? | #GoSelfMadeUniversity","https://www.youtube.com/watch?v=SmYEOqexDUc","2021-05-05",2086080
"4 Lakhs in 2 Days 🔥 | #Earn Money Online | Zero Investment Business Passive Income | Work From Home","https://www.youtube.com/watch?v=GBRf5OBF9fs","2021-05-05",5263137
"Secret Business Strategy to Make #Money | #BlueOceanStrategy | #GoSelfMadeUniversity","https://www.youtube.com/watch?v=husZ2U3NJ4c","2021-05-04",167108
"The Game of #StartUp Funding? | How to Get Money for #Business? | #GoSelfMadeUniversity","https://www.youtube.com/watch?v=RK2rF4vCmr4","2021-05-04",108118
"Secret Weapon to Make #Money & Become #Rich | Time Leverage Passive Income | #GoSelfMadeUniversity","https://www.youtube.com/watch?v=GWBk_U9bSIQ","2021-05-03",882845
"Cheapest Country in the World | Case Study on #Venezuela 🇻🇪  | #FinancialEducation","https://www.youtube.com/watch?v=tgBgrp62LoU","2021-05-03",1995394
"How to Start a Profitable #Business? | #Entrepreneurship Secrets | #GoSelfMadeUniversity","https://www.youtube.com/watch?v=gAWPm4tp3bE","2021-05-02",501368
"Earn Rs 5000 Daily #ExtraIncome without Investment | Work From Home | #EarnMoney Online","https://www.youtube.com/watch?v=FA8OPtTYcMY","2021-05-02",2039206
"How to Become a Millionaire? | The Most Practical Advice | #GoSelfMadeUniversity","https://www.youtube.com/watch?v=4o0TqimfM_4","2021-05-02",647741
"Learn Practical Human #Psychology | Personality Development","https://www.youtube.com/watch?v=uc1lLq0zLZU","2021-05-01",3058158
"Complete #FinancialEducation Mastery to be #Rich | The #GoSelfMadeUniversity  🔥","https://www.youtube.com/watch?v=tyc5n_5xmWU","2021-05-01",191629
"The Hidden Game of #Money 💰 | Secrets Banks & Government Hide | #GoSelfMadeUniversity","https://www.youtube.com/watch?v=qszRqzpUxZE","2021-05-01",276401
"#StockMarket #Crash is Coming? | #Economy Waterfall | Financial Education","https://www.youtube.com/watch?v=Wd9IzyP_3KY","2021-04-30",366866
"Old Vs New #EducationSystem | Learn what Makes You #Successful in Life Not Stupid!","https://www.youtube.com/watch?v=1U_LkkRGzcY","2021-04-30",67291
"How to Increase Brain 🧠 Power? 14 #Brain Rules 🔥 | Human Psychology","https://www.youtube.com/watch?v=_egg3V59Cv4","2021-04-29",1672394
"How to get Business #Loan without Collateral | PM #MUDRA Yojana (PMMY) | Financial Education","https://www.youtube.com/watch?v=gPx5vCnVMIc","2021-04-29",400448
"#Psychology of Love | How to #Impress & Attract Anyone? | Personality Development","https://www.youtube.com/watch?v=IFgRYe7cGg0","2021-04-28",726968
"Mata Ki Chowki | Maiya Teri Jai Jaikaar | Pushkar Raj Thakur Family Function","https://www.youtube.com/watch?v=_zV9rUf1njY","2021-04-27",71052
"How to Earn 3X Money from #Youtube & #Facebook Algorithm? | Earn Online Income Daily from Home","https://www.youtube.com/watch?v=U-zGkqbH-Dc","2021-04-26",220066
"#Bitcoin Trading to Earn Money | When to Buy or Sell Crypto Currency | Financial Education","https://www.youtube.com/watch?v=pa1vgM6eUxU","2021-04-25",2089854
"The Game of Black Money | #FinancialEducation","https://www.youtube.com/watch?v=gfP_5Q2xZgU","2021-04-25",377785
"How Businessman Pay Low/Zero Taxes & Still Become Rich? | Financial Education","https://www.youtube.com/watch?v=diyNzcd64T4","2021-04-24",572057
"Zero Investment Business Idea | Financial Education","https://www.youtube.com/watch?v=FjfEEmvLRBY","2021-04-23",975585
"Double Your Money in Stock Market | Share Market 📈 Tips | Financial Education","https://www.youtube.com/watch?v=sDDZdty-J8M","2021-04-22",526408
"Zero Investment Business | How to Make Money in #RealEstate? 🏡 | Financial Education","https://www.youtube.com/watch?v=ZbdLDPBScUc","2021-04-21",777423
"The Game of #Bitcoin? Should I Invest in #CryptoCurrency or Not? | Financial Education","https://www.youtube.com/watch?v=cUBM8PpIbPk","2021-04-21",3723097
"Can You Catch Covid Twice? | Can Corona Happen Again?","https://www.youtube.com/watch?v=D09igx9ucFM","2021-04-20",52688
"Coronavirus Second Wave Hit | Shocking Ground Reality | #Remdesivir Shortage","https://www.youtube.com/watch?v=lrIpb13EI8k","2021-04-19",52587
"Politics & Coronavirus | पूरे 1 साल का Report Card","https://www.youtube.com/watch?v=Usec4tr_Ja0","2021-04-18",39665
"My Schedule for Next 2 Days! 🔥✨","https://www.youtube.com/watch?v=cyjWm26ejFI","2021-04-17",38292
"#CitiBank Closing Retail Banking from India! What will happen to your Money?","https://www.youtube.com/watch?v=M8uG8F0_fBg","2021-04-16",213206
"Coronavirus ख़त्म होगा या व्यापारी?","https://www.youtube.com/watch?v=q0oRZ0hAT8Y","2021-04-15",79334
"Side Effects of #Coronavirus Vaccine? | COVID-19 #Vaccine Danger in India","https://www.youtube.com/watch?v=S4I_X0zrXjk","2021-04-14",1099327
"#High Alert! #Sextortion Increasing Rapidly Online | Beware ⚠️","https://www.youtube.com/watch?v=23w3woNV0pA","2021-04-12",657911
"How to Double Your Money? 💰 | How to be Rich? | Financial Education","https://www.youtube.com/watch?v=FgiGzsw2Jxc","2021-04-11",1087852
"#Rocketry Movie Complete Story | #NambiNarayanan Case Study","https://www.youtube.com/watch?v=GKlV-aKCZPo","2021-04-07",53730
"Should I #Buy or #Rent a #House 🏠? Where to #InvestMoney in #RealEstate?","https://www.youtube.com/watch?v=66n6a3PkPV4","2021-04-05",3704927
"Complete Financial Education जो आपका दिमाग हिला देगी | Rich Vs Poor Mindset","https://www.youtube.com/watch?v=7orpIslLZjE","2021-03-31",8142299
"5 Books to be Rich | Must Watch","https://www.youtube.com/watch?v=zfDEF0aARvQ","2021-03-29",664971
"7 Ways to Earn from Credit Card | Pushkar Raj Thakur","https://www.youtube.com/watch?v=KWdf8Owa6Ig","2021-03-27",717325
"Are you ready for the Lockdown again?","https://www.youtube.com/watch?v=GcDvvodoroo","2021-03-25",46600
"The Ultimate Training for Network Marketing Success | Pushkar Raj Thakur","https://www.youtube.com/watch?v=0rI44G3tzXI","2021-03-23",41106
"#CleanShave 🧔 Challenge Accepted after 5 Years | Look 👀 at the Reaction of Everyone","https://www.youtube.com/watch?v=qvMftYdkQrM","2021-03-22",78425
"5 Things Foreigners Should Learn From India || Pushkar Raj Thakur","https://www.youtube.com/watch?v=94q_indcRcE","2021-03-19",48321
"The Ignored Secret about Happiness","https://www.youtube.com/watch?v=KTHdjXMkkHM","2021-03-17",29518
"Save 1,000 Crores by this Simple Idea 💡","https://www.youtube.com/watch?v=Yf2Uod6ubpc","2021-03-15",29659
"3 Money Secrets Only Rich People Know","https://www.youtube.com/watch?v=pDcRtxqPLIo","2021-03-06",178087
"Best Advice before Buying a New Car","https://www.youtube.com/watch?v=X4xwalxyu4o","2021-03-05",45599
"How to become the Richest Man in the World? | Case Study on Elon Musk","https://www.youtube.com/watch?v=LyV97bRnhrE","2021-03-02",406457
"औक़ात | A Motivational Story","https://www.youtube.com/watch?v=revS_Uud0aM","2021-03-01",59233
"Earn Online with #AffiliateMarketing Business","https://www.youtube.com/watch?v=xQjbz4T2M24","2021-02-25",276014
"Instant Joining Formula | Exact Scripts | Network Marketing","https://www.youtube.com/watch?v=KspoD_RdikY","2021-02-16",157683
"Focus on the CASH | Network Marketing","https://www.youtube.com/watch?v=N8dQiolBpYU","2021-02-14",24122
"Mobile Phone से Business करना सीखों","https://www.youtube.com/watch?v=EfGIIvLRwGw","2021-02-09",298223
"माँ - बाप की Value | A Motivational Story","https://www.youtube.com/watch?v=enM3UVUjuSU","2021-02-07",34781
"#Surprise 🥰 Meet Our New Family Member #Grace","https://www.youtube.com/watch?v=u-Hm7AuMiG4","2021-02-04",124624
"Job करनी चाहिए या Business | Business V/s Job","https://www.youtube.com/watch?v=raPhgLua3jE","2021-02-01",812793
"Degree matter नहीं करती! Motivational Video","https://www.youtube.com/watch?v=raQ2pII7FaM","2021-01-26",2784120
"Top 5 Myths about Money 💰 to be Rich | Financial Education","https://www.youtube.com/watch?v=e_DVQIOKkZI","2021-01-21",42636
"काश ये बात मुझे 5 साल पहले पता होती। Digital Entrepreneurship","https://www.youtube.com/watch?v=bGQpVvXzCQo","2021-01-15",56531
"Did China Kill Jack Ma?","https://www.youtube.com/watch?v=VtIgwNLzRa4","2021-01-09",33889
"Farmers Protest: Problems and Solutions | Why Farmers are Protesting?","https://www.youtube.com/watch?v=ra9xAhouGyE","2021-01-07",19572
"Earn Passive Income | Active V/s Passive Income Options","https://www.youtube.com/watch?v=-sMGNowYuWs","2021-01-04",437715
"सोच बदल देगी ये लड़की की कहानी | Life Changing Story","https://www.youtube.com/watch?v=jGysDNDmgP0","2021-01-02",28019
"How to Choose a Right Career? | Best Career Opportunities","https://www.youtube.com/watch?v=Zx6aaamuaxo","2020-12-31",54750
"Unlimited Joining from Facebook in Network Marketing | Chatbot Technology","https://www.youtube.com/watch?v=L2X6uuisQ9M","2020-12-27",156443
"किसान आंदोलन की असली सच्चाई | Complete Case Study | Farmers Protest on 3 Bills","https://www.youtube.com/watch?v=LVf5_WrzcZw","2020-12-25",155496
"Increase Your Value | The Greatest Motivational Video 🔥","https://www.youtube.com/watch?v=E-KIjMfZ-mk","2020-12-22",297212
"Never Give Up | Motivational Video | Story of 2 Frogs 🐸","https://www.youtube.com/watch?v=J0RRSZpotUA","2020-12-18",51685
"5 Zero Investment Business for 2021🔥","https://www.youtube.com/watch?v=XyyK8STHF94","2020-12-12",1512392
"Secret of SelfMade Millionaires 🔥","https://www.youtube.com/watch?v=Ed-VfZHb8tg","2020-12-11",131838
"Steps to Success by Gautam buddha | A Motivational Story","https://www.youtube.com/watch?v=FSZzsifBmAs","2020-12-10",97833
"Comfort Zone a Motivational Story | Pushkar Raj Thakur","https://www.youtube.com/watch?v=Esjd-2Vnqn8","2020-12-08",41296
"🔥Education System for Network Marketing for Super Success 🔥","https://www.youtube.com/watch?v=JgmUaiJ-OIE","2020-12-07",39952
"Angry Man V/s Gautam Buddha","https://www.youtube.com/watch?v=oPRtQmMKNlY","2020-12-05",28977
"Over Thinking | A Motivational Story","https://www.youtube.com/watch?v=9WSA8BMB8_0","2020-12-03",32899
"A Business Motivational Story","https://www.youtube.com/watch?v=Jl4YT8z0uYg","2020-11-28",155226
"Salary | A Motivational Story | Pushkar Raj Thakur","https://www.youtube.com/watch?v=pREZSPkKDA8","2020-11-25",46772
"How to Double Your Sales in Network Marketing?","https://www.youtube.com/watch?v=4JdQOZKWzIk","2020-11-21",16119
"10 Business Ideas for 2021 | Learn Digital Marketing Practical Use for Business","https://www.youtube.com/watch?v=j_eiQKQ9OUE","2020-11-20",183515
"7 Advice to Become Successful | Success v/s Failure","https://www.youtube.com/watch?v=f8AmHotzsKI","2020-11-15",38644
"Never Say No to an Opportunity | Motivational Story","https://www.youtube.com/watch?v=AkK7-22T794","2020-11-03",56122
"Will Power | Motivational Video","https://www.youtube.com/watch?v=EwBCMA55Ncg","2020-10-28",16959
"हमेशा खुश कैसे रहें? | How to be Happy Always? | Motivational Story | Pushkar Raj Thakur","https://www.youtube.com/watch?v=RvKmYrA1MwA","2020-10-27",17721
"3 Signs that Shows You will be a Millionaire | How to be Rich?","https://www.youtube.com/watch?v=GlR1i3drV1A","2020-10-24",119483
"Attract the Success in Network Marketing by 5 Tasks","https://www.youtube.com/watch?v=0kAGOFKkf00","2020-10-21",329536
"Attitude रखो तो ऐसा | The Warrior Positive Attitude","https://www.youtube.com/watch?v=fJU8jVDMrFE","2020-10-19",23618
"#8 Confidence like a Warrior | Confidence Building for Job Interview","https://www.youtube.com/watch?v=SZ39aruk67Q","2020-10-13",16180
"Advice for Youth 🔥✨","https://www.youtube.com/watch?v=tIWmVYWfKZs","2020-10-11",36343
"# 7 Job Interview Question Answer Preparation | What is Your Salary Expectation?","https://www.youtube.com/watch?v=SOLO63dYE8E","2020-10-10",63552
"#6 Job Interview Common Questions Answers | What are Your Career Goals | Interview Mastery","https://www.youtube.com/watch?v=NWL4WvoAzx4","2020-10-09",89360
"New Career Options | Career Guidance | Business Exploration Workshop","https://www.youtube.com/watch?v=EoK7TA79gsQ","2020-10-07",158423
"#5 Job Interview Common Question | Where Do You See Yourself in 5 Years? | Pushkar Raj Thakur","https://www.youtube.com/watch?v=19g0UoeQukU","2020-10-06",39771
"#4 Self Introduction देना सीखें । How to Introduce Yourself in Interviews | Pushkar Raj Thakur","https://www.youtube.com/watch?v=hpL-diJFHYI","2020-10-05",139288
"#3 Job Interview Common Questions | What If We Reject You |  Pushkar Raj Thakur","https://www.youtube.com/watch?v=Ppd8zeerx6M","2020-10-04",30343
"#2 Why Should We Hire You? | Job Interview Common Questions | Pushkar Raj Thakur","https://www.youtube.com/watch?v=au9RLWTZZHw","2020-10-03",117082
"#1 Sell This Pen to Me | Job Interview Common Question | Pushkar Raj Thakur","https://www.youtube.com/watch?v=fNCGQJnrqzM","2020-10-02",290615
"TedX TIET Personality Development Workshop | Next Level Personality Transformation  in Hindi","https://www.youtube.com/watch?v=ybabl28z550","2020-09-16",41349
"Affiliate Marketing Business | Free Master Class | Learn New Skills","https://www.youtube.com/watch?v=SZJ8ZmtX_30","2020-09-14",186826
"Job Interview Common Questions | Tell Me About Yourself? Best Answer on Youtube | Pushkar Raj Thakur","https://www.youtube.com/watch?v=I5tckFv79DU","2020-09-10",35142
"Amitabh Bachchan Speech | Life Changing Motivation","https://www.youtube.com/watch?v=NUv1ZRdgvAg","2020-08-31",77181
"कभी हार मत मानना है | Epic Motivational Story | मोटिवेशनल कहानी","https://www.youtube.com/watch?v=nJx0P34ZxXw","2020-08-28",34325
"Sales Man to Sales Master | 2D Follow Up Technique | Advanced 4 Steps Sales Training","https://www.youtube.com/watch?v=yLUHW83AAM8","2020-08-27",55684
"Best Income Opportunities of 2020 | Earn Online | Work From Home | Part Time or Full Time","https://www.youtube.com/watch?v=4i5lGOAfXvc","2020-08-19",388583
"Be Ready for Greatest Online Earning Opportunity 🔥| #GoSelfMade Mission 🔥","https://www.youtube.com/watch?v=vQ6fhMvofzU","2020-08-13",46491
"Mindset बदल देगी ये कहानी | Motivational Story in Hindi | Pushkar Raj Thakur","https://www.youtube.com/watch?v=4OYl-JkPjII","2020-08-05",228376
"जीवन का सबसे बड़ा सबक़ ! | Shri Krishna Lesson | Life Changing Motivational Story","https://www.youtube.com/watch?v=O6gmWl1CnFg","2020-08-01",44788
"Rules Of Money 💰 | How to be Rich? | Financial Education","https://www.youtube.com/watch?v=06q5Jik-uS0","2020-07-28",212024
"How to Cure #Depression? Complete Guide | Overcome Depression with Easy Steps","https://www.youtube.com/watch?v=66OV4GKHrlA","2020-07-25",33000
"मौक़ा | Opportunity | Life Changing Motivational Story","https://www.youtube.com/watch?v=2p432INRIPs","2020-07-21",1039805
"Business Motivation | Josh Talks | Pushkar Raj Thakur | Real Life Success Story","https://www.youtube.com/watch?v=1NXSGrNk3AI","2020-07-19",65772
"Stop Negative Thinking 🤔","https://www.youtube.com/watch?v=_QwufH306eM","2020-07-16",30502
"ज़िंदगी को एक अलग तरीक़े से जीना सीखो | Best Motivational Video","https://www.youtube.com/watch?v=Kpfhe9Ru1SY","2020-07-14",31325
"Body Language हो तो ऐसी | Body Language Tips by Pushkar Raj Thakur | Personality Development","https://www.youtube.com/watch?v=hhJ0O-w49FM","2020-07-09",184941
"How to Talk to Anyone with Confidence? | 3 Psychological Tricks | Communication Skills | PRT","https://www.youtube.com/watch?v=d45jrXuQewo","2020-07-06",1022085
"#DigitalMarketing Career Guidance for Beginners  | ft. #IntellectualIndies | #SahilKhanna","https://www.youtube.com/watch?v=AycgMTN9UIU","2020-07-05",66334
