"Title","video_url","Published_date","Views"
"ग़लतियाँ हमेशा ग़लत नहीं होती | Life Changing Motivational Video | Pushkar Raj Thakur","https://www.youtube.com/watch?v=lWGnS1VlgXg","2020-07-02",35700
"India को इस देश से ये सीखना चाहिए । How to Win Over Corona Virus? | How to Save Economy?","https://www.youtube.com/watch?v=jD1UsEcnSSc","2020-06-30",14923
"आलस ख़त्म करने के आसान उपाय | End #Laziness 100% | Stop Wasting Time | #TimeManagement Techniques","https://www.youtube.com/watch?v=TZNAmdLmZP0","2020-06-28",140785
"Dream Ring Ceremony  | Big Fat Indian Wedding | Pushkar Raj Thakur","https://www.youtube.com/watch?v=ebtSHek5W2s","2020-06-25",148889
"सिर्फ़ मेहनत करने से नहीं मिलती Success | Real Secret to Success | Motivational Video","https://www.youtube.com/watch?v=o_QeGPmHIKo","2020-06-24",42819
"अपनी Value बढ़ाना सीखों । Best Motivational Story","https://www.youtube.com/watch?v=1R3cDWtmPC8","2020-06-21",286544
"Award Winning Pre Wedding Movie | Pushkar Raj Thakur","https://www.youtube.com/watch?v=-fEdrcx-gW8","2020-06-08",309094
"जो होता है अच्छे के लिए होता है | Motivation | Pushkar Raj Thakur","https://www.youtube.com/watch?v=xCovTLFjy04","2020-05-30",30192
"यह Video उनके लिए जिन्हें ज़िंदगी में रास्ता नहीं दिख़ रहा! | Motivation | Pushkar Raj Thakur","https://www.youtube.com/watch?v=1T6_ZHEA-lw","2020-05-27",54276
"Comfort Zone | Hindi Motivational Video","https://www.youtube.com/watch?v=8pTBAe17C9Q","2020-05-24",57460
"ये Jobs अगले 10 साल में जाने वाली है। Jobs in Danger | Pushkar Raj Thakur","https://www.youtube.com/watch?v=Anyj5kNC0UY","2020-05-21",54860
"ये 10 बातें तुम्हारा वक़्त बदल देंगी। Pushkar Raj Thakur","https://www.youtube.com/watch?v=Dhb_zJc6qpw","2020-05-19",133216
"Watch this Video before it is too late! ⚠️ | Eye Opening Video","https://www.youtube.com/watch?v=QMP3ucD3VSU","2020-05-15",31466
"Economy की हालत Coke की Bottle की तरह हो गई है। | Pushkar Raj Thakur","https://www.youtube.com/watch?v=1uI9CazmIJc","2020-05-11",34442
"Govt. ज़्यादा नोट छाप कर ग़रीबों की मदद क्यूँ नहीं कर रही?","https://www.youtube.com/watch?v=JsObfvZwWjY","2020-05-09",28446
"अगर आप Lockdown में Bore हो रहे हो तो यह Video ज़रूर देखें!","https://www.youtube.com/watch?v=ruBokqOSDQ4","2020-05-06",32213
"Free Master Class on How to Earn Online?","https://www.youtube.com/watch?v=YcnTFA4S7as","2020-05-03",594121
"Effects of Corona Virus | Pushkar Raj Thakur","https://www.youtube.com/watch?v=CjnE-mlauj0","2020-04-28",34326
"Failure to Success | Real Life Story | Pushkar Raj Thakur","https://www.youtube.com/watch?v=OHdMAeQvoWA","2020-04-24",78003
"Best Motivational Seminar | Pushkar Raj Thakur","https://www.youtube.com/watch?v=DZAicuUbBdU","2020-04-20",391326
"ग़रीब ग़रीब क्यूँ हो रहा है?","https://www.youtube.com/watch?v=fhC9KZxbhxI","2020-04-16",82249
"Pushkar Raj Thakur Live Session on Youtube | Positivity & Possibilities","https://www.youtube.com/watch?v=8yCLs6mBQZg","2020-04-15",62941
"Top 10 Rules of Success","https://www.youtube.com/watch?v=yIbhTR2apcQ","2020-04-13",83294
"Top 10 Rules for Success by Pushkar Raj Thakur","https://www.youtube.com/watch?v=dGiZDfvTlx4","2020-04-10",69986
"Affiliate Marketing | घर पर बेठे पैसा कमाना का सबसे आसान तरीक़ा! Earn Extra Income","https://www.youtube.com/watch?v=9bYIxrj0L3Y","2020-04-08",90136
"Earn Extra Income | घर से अपना Online Business शुरू करना सीखें | Work From Home Business Opportunity","https://www.youtube.com/watch?v=YAofl2NsfW8","2020-04-06",103933
"Pushkar Raj Thakur Dream Wedding with his Dream Girl | Pushkar Raj Thakur","https://www.youtube.com/watch?v=Fe-sgHhTgrg","2020-04-02",671565
"क्या सच में गर्मी बढ़ने से Corona Virus ख़त्म हो जायेगा?","https://www.youtube.com/watch?v=ou-47R3S2-k","2020-03-31",38726
"बार बार #Lockdown अब आगे क्या होगा? Case Study on Corona Virus Effect on Indian Economy","https://www.youtube.com/watch?v=bu-ggZ4mWWE","2020-03-28",139082
"Corona Virus Poetry ⚠️ | क्या करें और क्या ना करें? | Must Watch","https://www.youtube.com/watch?v=fPGRfiDysKM","2020-03-25",32658
"घर बैठे पैसे कैसे कमाए? । How to Earn Money at Home?  Home Based Business | Work From Home | Money","https://www.youtube.com/watch?v=QL-f2rqyXow","2020-03-22",304897
"Change Your Life | Money Mastery 2020 Seminar | Pushkar Raj Thakur","https://www.youtube.com/watch?v=o6xB_GVwl_0","2020-03-18",70595
"Dreams | Money Mastery 2020 | Best Motivational Video on Youtube Ever","https://www.youtube.com/watch?v=kM6Sp8Aeuek","2020-03-16",321093
"Corona Virus का असली सच | Complete Case Study on CoronaVirus | Affect on India and Treatment","https://www.youtube.com/watch?v=fhPm5xTnW00","2020-03-09",403513
"क्या कर्मो का फल मिलता है? | Law Of Karma | An Inspirational Story | Must Watch","https://www.youtube.com/watch?v=7SdzAPM_Q7c","2020-02-27",36919
"तेरे सीने में आग 🔥 ना लगा दी तो ये बंदा ही बेकार है!🔥#PushkarRajThakur","https://www.youtube.com/watch?v=H-Xm5oq6eBE","2020-02-24",81662
"The Most Powerful 🔥 Motivational Speaker In The World | Pushkar Raj Thakur","https://www.youtube.com/watch?v=AzeZPor-K-Q","2020-02-21",51478
"Newton’s 3rd Law of Success by Pushkar Raj Thakur | Law of Karma | Motivation for Success","https://www.youtube.com/watch?v=FLFR24q6KOE","2020-02-20",34000
"Newton’s 2nd Law of Success by Pushkar Raj Thakur | Motivation for Success","https://www.youtube.com/watch?v=VJvDyguyeo4","2020-02-18",31504
"Newton’s First Law of Success by Pushkar Raj Thakur","https://www.youtube.com/watch?v=Lu0rDsHCL_w","2020-02-17",44973
"5 Greatest Sales Lessons | How to Sell Anything? | Sales Techniques Training","https://www.youtube.com/watch?v=bjrw4ZaVpMM","2020-02-16",1020715
"Most Powerful Motivational Speech Ever | Best Motivational Video on Youtube  | Pushkar Raj Thakur","https://www.youtube.com/watch?v=XS-ZKavSh4o","2020-02-12",153488
"6 Reasons जिसकी वजह से ज़िन्दगी झंड हो जाती है | Network Marketing | Pushkar Raj Thakur","https://www.youtube.com/watch?v=3ZcWgxyx4dw","2020-02-10",52836
"अब हर Customer खरीदेगा | Human Psychology | Network Marketing | Pushkar Raj Thakur","https://www.youtube.com/watch?v=M_v_nbUbCYE","2020-02-05",47742
"Human Psychology | How Brain Works | Sales Motivation | Network Marketing | Pushkar Raj Thakur","https://www.youtube.com/watch?v=rFAIkV8ZTPE","2020-01-24",385163
"The Secret Mindset Of Massive Success by Pushkar Raj Thakur | Take The Leap Mindset Training","https://www.youtube.com/watch?v=w4IlpXydOG8","2020-01-16",122287
"तुम्हारी ज़िंदगी का Purpose क्या है? What is the Purpose of Your Life? Best Answer on Youtube 👌","https://www.youtube.com/watch?v=fkUx98CwGPU","2020-01-14",113921
"सुबह की प्रार्थना | Morning Prayer for Money 💰 Love ❤️ Success 📈 Happiness ✨ | Pushkar Raj Thakur","https://www.youtube.com/watch?v=LSMfoVyMUaw","2020-01-08",91588
"अगर साल में 1 बार भी यह काम कर दिया तो दुनिया बदल दोगे | Best Advice To Change The World🌍 | PRT","https://www.youtube.com/watch?v=XHJK31NXrPk","2020-01-04",37648
"This Habit Will Make You Rich! Pushkar Raj Thakur","https://www.youtube.com/watch?v=vTzndbmzN3s","2019-12-31",161486
"अंजान लोगो से कैसे बात करें | How to Talk to Anyone? | Talk to Strangers | Communication Skills PRT","https://www.youtube.com/watch?v=jYfWS1Lbw_E","2019-12-28",1235773
"How to Crack Any Interview? | Interview Questions | Personality Development | Communication Skills","https://www.youtube.com/watch?v=ZtkNgvf_0ss","2019-12-16",33897
"माँ-बाप | A Thought Provoking Video by Pushkar Raj Thakur | Parents |  Hindi Motivational Video","https://www.youtube.com/watch?v=hn80iUYORSY","2019-12-15",37893
"इस Video के बाद तुम्हें कोई नहीं रोक पायेगा | Best Motivational Video Story | Pushkar Raj Thakur","https://www.youtube.com/watch?v=zv-F_k5xF60","2019-12-14",47757
"एक ऐसी कहानी जो आपको अंदर तक हीला देगी | Reality of Women in India | Shocking Story","https://www.youtube.com/watch?v=xkQvM_A-ans","2019-12-13",45651
"7 Habits Of Mentally Strong People | Pushkar Raj Thakur","https://www.youtube.com/watch?v=i7GfI_m05XE","2019-12-11",83832
"यह 7 बातें हमेशा याद रखना  | Life Changing Video | Pushkar Raj Thakur","https://www.youtube.com/watch?v=244H6QdI6sc","2019-12-09",70935
"Himeesh Madaan Real Life Story | Tips for Students | Motivation | Interview | Secret to Success PRT","https://www.youtube.com/watch?v=PVuxzcjptX4","2019-12-07",128385
"Learn to Multiply Money 💰 | Pushkar Raj Thakur","https://www.youtube.com/watch?v=OERrHqs98JM","2019-11-24",648968
"Heart Touching Video | From Failure to Success | Pushkar Raj Thakur | Hindi Poem | हिंदी कविता","https://www.youtube.com/watch?v=CaYyLiugqH8","2019-11-23",49991
"IDSA🇮🇳 Special Meeting | Harshvardhan Jain | Deepak Bajaj | Divya Tegonity | Pushkar Raj Thakur 🔥","https://www.youtube.com/watch?v=ghyPNfdOdPU","2019-11-20",254019
"7 Traits of UnSuccessful People | Success Habits | Motivation | Pushkar Raj Thakur","https://www.youtube.com/watch?v=SO4D5zA4UMQ","2019-11-16",91666
"Career Counselling by Pushkar Raj Thakur  | Student Motivation","https://www.youtube.com/watch?v=3iWSxamM5pg","2019-11-14",161705
"Best Advice for Students | Stop Fooling Your Parents | Study Motivation | How to Study | Education","https://www.youtube.com/watch?v=SbPnkqCyOuI","2019-11-13",478060
"Make Yourself More Productive | Pushkar Raj Thakur","https://www.youtube.com/watch?v=F464sRgGnR8","2019-11-12",35503
"Change Your Life | Who is Pushkar Raj Thakur? | Life of an Entrepreneur | Real Life Success Story 🔥","https://www.youtube.com/watch?v=J1CQiOahmxg","2019-11-06",2375549
"1 Million Subscribers Celebration Party | Gold Play Button | Best Youtuber | Pushkar Raj Thakur","https://www.youtube.com/watch?v=_JfFYV-g17c","2019-11-04",22991
"Shocking Reality | 5 Levels & Purpose of Your Life | Motivation | Pushkar Raj Thakur","https://www.youtube.com/watch?v=kfgeo-ZZSO8","2019-10-24",164759
"जो सच आपसे अभी तक छुपाया गया | Shocking Reality of India | Economy Crisis | PRT | Must Watch","https://www.youtube.com/watch?v=Ai-fZYcj-A8","2019-10-22",117329
"Mind Shift Motivational Seminar 🔥 | Change Your Life | Network Marketing | Pushkar Raj Thakur","https://www.youtube.com/watch?v=5I8ZSW2k_fc","2019-10-20",163386
"7 Things To Quit Today | Life-Changing Tips | Pushkar Raj Thakur","https://www.youtube.com/watch?v=JKey3FU5owU","2019-10-17",60239
"How To Become A Millionaire | Network Marketing | Pushkar Raj Thakur","https://www.youtube.com/watch?v=jor0Cfs2P_M","2019-10-16",34505
"Life Changing Tips | Advice for Youth | Student Motivation 🔥 | Pushkar Raj Thakur","https://www.youtube.com/watch?v=GUUoAgr0S7M","2019-10-15",72841
"यह 6 काम तुरंत छोड़ दो | Life-Changing Advice | Pushkar Raj Thakur","https://www.youtube.com/watch?v=r5ePa6Jm1Fs","2019-10-14",122172
"Morning Habits For Success In Life | Morning Motivation | Pushkar Raj Thakur","https://www.youtube.com/watch?v=Vyerw6XfL0Q","2019-10-12",118419
"अपने दिल की आवाज़ कैसे सुने? | How to Listen your Inner Voice || Pushkar Raj Thakur","https://www.youtube.com/watch?v=ox81kEtYglQ","2019-10-07",27536
"Secrets To Success | Courage | Failure To Success | Pushkar Raj Thakur | GoSelfMade","https://www.youtube.com/watch?v=D1rFiMq14UU","2019-10-06",34002
"7 Rules Of Highly Successful People | Pushkar Raj Thakur","https://www.youtube.com/watch?v=mGKI7pDzwqQ","2019-10-02",38405
"अपने दिमाग को Strong कैसे बनायें | 6 Things Mentally Strong People Do | Pushkar Raj Thakur","https://www.youtube.com/watch?v=CgBNHMdpv3c","2019-10-01",63188
"7 Rules हमेशा खुश रहने के लिए | Happiness Motivational Video | Pushkar Raj Thakur","https://www.youtube.com/watch?v=lqF8wbg7hfE","2019-09-30",32153
"World’s Most Powerful Motivational Shayari in Hindi | Pushkar Raj Thakur","https://www.youtube.com/watch?v=v_e-A5ZEsEs","2019-09-28",91229
"Honeymoon Trip 😍| Best Hill Station 🏔","https://www.youtube.com/watch?v=q4x-hF0vTG0","2019-09-27",37523
"How To Change People | The Last Course/Book | Pushkar Raj Thakur | Day 40","https://www.youtube.com/watch?v=LeA8jvN89GQ","2019-09-27",48789
"New Friends कैसे बनाएं? | Secrets To Make New Friends | The Last Course/Book | Pushkar Raj Thakur","https://www.youtube.com/watch?v=GWFZeg8cfNU","2019-09-26",46912
"Secrets Of Happy Relationships | Relationship Tips | The Last Course/Book | Pushkar Raj Thakur","https://www.youtube.com/watch?v=ODLw0TjFUB8","2019-09-25",44377
"How To Make People Like You Instantly | The Last Course/Book | Pushkar Raj Thakur | Day 37","https://www.youtube.com/watch?v=a_AxGbOxLEE","2019-09-24",62593
"Ameer लोग क्या सोचते है ? | Think Like A Millionaire | The Last Course/Book | Pushkar Raj Thakur","https://www.youtube.com/watch?v=GeKJmdHbS3c","2019-09-23",49104
"How to Double Money? 💵 | Become Rich Fast | The Last Course Book | Pushkar Raj Thakur | Day 35","https://www.youtube.com/watch?v=Rb9IC2-BIbA","2019-09-22",51572
"Tips to become Rich & Successful 💰 | How to Create Network | The Last Course Book | Day 34","https://www.youtube.com/watch?v=S5DN_A46V9Q","2019-09-21",42058
"How to Make Money 💰 | Best Advice to be Rich Fast | The Last Course/Book | PRT | Day 33","https://www.youtube.com/watch?v=In3DHnvZuA4","2019-09-20",885966
"Paise कैसे कामएं ? | How To Make Money ? | The Last Course/Book | Pushkar Raj Thakur | Day 32","https://www.youtube.com/watch?v=epz-I0xpf-k","2019-09-19",61058
"Secrets of Money 💰 | Wealth Creation | The Last Course/Book For Your Best Life | PRT | Day 31","https://www.youtube.com/watch?v=DRj3sFZDUYc","2019-09-18",45239
"Make People Love You | How To Improve Sense Of Humour| Personality Development |The Last Course/Book","https://www.youtube.com/watch?v=trSdyTm_Xjs","2019-09-17",74441
"Communication Skills Improvement | Story Telling | The Last Course/Book| Pushkar Raj Thakur | Day 29","https://www.youtube.com/watch?v=kTo3DxqAH0Q","2019-09-16",560197
"Shyness ख़त्म आज से | Become an Alpha | Personality Development | The Last Course/Book | Day 28","https://www.youtube.com/watch?v=ePRzitBhPqY","2019-09-15",241656
"10 Ideas Classy बनने के लिए | How To Be Classy? | The Last Course/Book | Pushkar Raj Thakur | Day 27","https://www.youtube.com/watch?v=ruHQCR8aqww","2019-09-14",63820
"अपने Ghussey को कैसे Manage करें ? Anger Management | The last Course/Book | PRT | Day 26","https://www.youtube.com/watch?v=pGPQfPb_6Fk","2019-09-13",43617
"How to Convince Anyone? The Last Course/Book For Your Best Life | Pushkar Raj Thakur | Day 25","https://www.youtube.com/watch?v=xEzFZerFltY","2019-09-12",65890
"The Art & Science of Selling | कही भी किसको भी कुछ भी बेचना सीखें | How to Sell Anything | PRT Day24","https://www.youtube.com/watch?v=64axmgqTX5Y","2019-09-11",89982
"चालाकी से बात करना सीखो | 7 Magical Secrets of Communication Skills | Personality Development |Day23","https://www.youtube.com/watch?v=hR0SGY6BmiQ","2019-09-10",765090
"यह सिख लिया तो लोग तुम्हारे दीवाने हो जायेंगे | Positive Aura Creation | The Last Course | Day 22","https://www.youtube.com/watch?v=51z91O0fGus","2019-09-09",96222
"The Ultimate Video on Leadership | Pushkar Raj Thakur | The Last Course Book | Day 21","https://www.youtube.com/watch?v=AySvsX4jerA","2019-09-08",59408
"Live Like A Lion | Best Motivational Video Ever | The Last Course/Book | Pushkar Raj Thakur | Day 20","https://www.youtube.com/watch?v=0JEtQ7aZbFM","2019-09-07",54919
"The Power Of Focus | Best Motivational Video | The Last Course/Book | Pushkar Raj Thakur | Day 19","https://www.youtube.com/watch?v=15Mw83-vwtE","2019-09-06",68478
"The Power Of Compounding Effect | The Last Course/Book for Your Best Life|Pushkar Raj Thakur Day 18","https://www.youtube.com/watch?v=2fpdZrCnNGU","2019-09-05",143727
"The Reason You’re Poor | How to be Rich | Sharpen Your Axe Formula | Pushkar Raj Thakur | Day17","https://www.youtube.com/watch?v=gL1-xSDfJU4","2019-09-04",63827
"Keep Pushing Forward | Best Motivational Video | Prioritise Goals & Build Momentum | Day 16 | PRT","https://www.youtube.com/watch?v=VUmfixVanWc","2019-09-03",48100
"वक़्त को अपना ग़ुलाम बनाओ | Time Management | The Last Course Book for Your Best Life | PRT | Day 15","https://www.youtube.com/watch?v=s0I9gi0Wbr0","2019-09-02",60679
"10X Growth | Increase Your Income | How to be Rich | Jam Session | The Last Course Book | Day 14","https://www.youtube.com/watch?v=KilI71QECu4","2019-09-01",69313
"अपनी औक़ात बढ़ाना सीखो | Increase Your Time's Value | The Last Course Book For Your Best Life Day 13","https://www.youtube.com/watch?v=80IlOnmAK2Y","2019-08-31",187347
"अपने दिमाग को कैसे तेज़ करें?| Brain Power Concentration & Focus | Students Study Productivity Tips","https://www.youtube.com/watch?v=RTpY8xErDg8","2019-08-30",140324
"Secrets Of Successful People | The Game Changer Habits | The Last Course/Book | Day 11 | PRT","https://www.youtube.com/watch?v=AMwJvVMns_0","2019-08-29",58827
"6 कड़वे सच | Hard Truths of Life | Best Motivational Life-Changing Video Ever","https://www.youtube.com/watch?v=4pUZXQF9jtI","2019-08-29",28731
"Best Millionaire’s Advice | How to Plan | The Last Course Book For Your Best Life | Day 10","https://www.youtube.com/watch?v=lXgdCVCg-Fk","2019-08-28",94770
"पैसो के 7 नियम | 7 Rules Of Money | How to be Rich | Make Money Easy | Pushkar Raj Thakur","https://www.youtube.com/watch?v=iJUkpnfnYx4","2019-08-27",533127
"अपना Routine कैसे ठीक करें? | Get Your Routine Right |The Last Course/Book For Your Best Life |Day 9","https://www.youtube.com/watch?v=ig7mMenYyus","2019-08-27",81388
"जोश और ताकत कैसे बढ़ाएं? | Daily Success Activity | Health & Fitness Exercise | The Last Course Day 8","https://www.youtube.com/watch?v=FWJkHk9zrwI","2019-08-26",62451
"अमीर बनना है तो हर सुबह यह करलो | Success Habits | Daily Studying | Day 7 | Pushkar Raj Thakur","https://www.youtube.com/watch?v=4TwZfX5Dvf0","2019-08-25",105685
"#1 Goal Setting Trick | The Last Course/Book For Your Best Life | Day 6 | Pushkar Raj Thakur","https://www.youtube.com/watch?v=C4fROTw4VfA","2019-08-24",97062
"Become a Lion | Lionize Your Life |  Success | Motivation | Pushkar Raj Thakur","https://www.youtube.com/watch?v=VyrlD8K3r3E","2019-08-23",22730
"2 Minute में सीखें Meditation | The Last Course/Book For Your Best Life | Day 5 | Pushkar Raj Thakur","https://www.youtube.com/watch?v=WDR7PXLW1aA","2019-08-23",56891
"हर सुबह यह ज़रूर करना | Morning Motivation  | The Last Course/Book for Your Best Life | Day 4","https://www.youtube.com/watch?v=3xx1Wm_c9IQ","2019-08-22",114285
"Creative Thinking | Mental Success Training | The Last Course/Book For Your Best Life | Day 3","https://www.youtube.com/watch?v=s69mFXhfwjE","2019-08-21",107163
"10,000 Books की Knowledge सिर्फ 20 Min में | The Last Course/Book For Your Best Life | Day 2","https://www.youtube.com/watch?v=kpr6MwtOayg","2019-08-20",185744
"Belief System Of Successful People | Success Mindset | The Last Course For Your Best Life | Day 1","https://www.youtube.com/watch?v=EvDVB4TFQdg","2019-08-19",164849
"8-X Factors | Life-Changing Motivation | The Last Book/Course For Your Best Life |Pushkar Raj Thakur","https://www.youtube.com/watch?v=o54Ctcz8bA4","2019-08-18",117104
"40 दिन में Successful बनने का रास्ता | Change Your Life | The Last Course For Your Best Life","https://www.youtube.com/watch?v=3vjPVshv5TI","2019-08-17",549008
"BOPP Tips | Public Speaking Tips | Business Opportunity Network Marketing | Pushkar Raj Thakur","https://www.youtube.com/watch?v=XRTdviljMqQ","2019-08-10",32089
"इन 5 बातो को अगर Ignore किया तो अपना ही नुक्सान करोगे | Motivational Video | Pushkar Raj Thakur","https://www.youtube.com/watch?v=k22im4K7KUA","2019-08-09",27344
"मनचाही Naukri कैसे पाएं? How To Get Your Dream Job? | Pushkar Raj Thakur","https://www.youtube.com/watch?v=iZEsJYaRQsA","2019-08-02",27236
"आप इतनी जल्दी Successful कैसे बने ? | Highly Motivational Video | Wealth Creation | Tarun Gill Talks","https://www.youtube.com/watch?v=JbL0VgD18UQ","2019-07-24",106884
"Start Winning Stop Loosing | Achieve Anything | Pushkar Raj Thakur","https://www.youtube.com/watch?v=QR8rY_YTD1M","2019-07-19",57602
"Samay ki kimat | Increase Your Time's Value | Pushkar Raj Thakur","https://www.youtube.com/watch?v=bJSMJz9JLZ8","2019-07-16",58680
"जल्दी Paisa कमाने के 5 रहस्य | इस Video मे जाने | Pushkar Raj Thakur","https://www.youtube.com/watch?v=AQ_v54LtNuo","2019-07-15",90588
"हमेशा Fit एवं Active कैसे रहे? | Lose Weight Fast | Pushkar Raj Thakur","https://www.youtube.com/watch?v=yc-MO7Dfwwo","2019-07-14",36016
"बुरे वक़त से कैसे बाहर निकले? | How To Overcome Bad Time? | Pushkar Raj Thakur","https://www.youtube.com/watch?v=C6NFNizJZec","2019-07-12",25929
"खुद को लगातार Motivated कैसे रखें। How To Stay Motivated All The Time | Pushkar Raj Thakur","https://www.youtube.com/watch?v=agKeKTdZXPM","2019-07-11",38258
"Sales और Marketing मे Ultra Successful कैसे बने? l MLM Shortcuts l  Pushkar Raj Thakur","https://www.youtube.com/watch?v=47FIjoYNQT8","2019-07-09",29011
"सोने से पहले यह ज़रूर करे | Power of Subconscious Mind | Make Dreams a Reality | Pushkar Raj Thakur","https://www.youtube.com/watch?v=Sa8t5JFMlT0","2019-07-07",57832
"Achieve Anything | Secret Success Training | Goal Setting | Pushkar Raj Thakur","https://www.youtube.com/watch?v=961bdAfB7lw","2019-07-05",43088
"99% लोग यह नहीं जानते | अमीर कैसे बने? | How To Be Rich? Pushkar Raj Thakur","https://www.youtube.com/watch?v=7jJG8nXc27I","2019-07-04",1176998
"How To Attract Anyone? Personality Development | Pushkar Raj Thakur","https://www.youtube.com/watch?v=gmZmdn6bV6U","2019-07-03",150419
"1 साल में Financial Status बदल देने वाली Video | How to be Rich Fast | Pushkar Raj Thakur","https://www.youtube.com/watch?v=auFAupdkBiY","2019-07-02",2496541
"How to be Successful | Secrets of Success | Josh Talk |  Pushkar Raj Thakur","https://www.youtube.com/watch?v=mcYjM1gZPl0","2019-06-30",35178
"Bekar Education System | Shocking Video | Best Advice for Students | Pushkar Raj Thakur","https://www.youtube.com/watch?v=YlMSwxD5tiE","2019-06-29",52462
"5 तरीके to be a Millionaire | How to be Rich | Pushkar Raj Thakur","https://www.youtube.com/watch?v=KlN6FR9Np88","2019-06-28",30176
"Aise Padh Rahe Ho To Padhai Chod Do l 5 Tips For Youth | Pushkar Raj Thakur","https://www.youtube.com/watch?v=bajIse8EGvY","2019-06-27",29746
"Best Life Changing Seminar | Motivation Seminar |  Pushkar Raj Thakur","https://www.youtube.com/watch?v=wEdvYC5oHDk","2019-06-23",209635
"7 आदतें Successful लोगो की | Advanced Training | Pushkar Raj Thakur","https://www.youtube.com/watch?v=C7X1AFx4WfM","2019-06-22",91746
"अपने Talent  को पहचानो | Identify Your Talent | Pushkar Raj Thakur","https://www.youtube.com/watch?v=h_V_4kH3Fq4","2019-06-21",42422
"How To Make Your Downline Love You? | Gain Respect ✊ | Network Marketing | Pushkar Raj Thakur","https://www.youtube.com/watch?v=roP7Xe6vfnY","2019-06-15",57476
"आपकी ज़िन्दगी  कैसे बदलती है? | Motivation | Pushkar Raj Thakur","https://www.youtube.com/watch?v=ZwBwnJBUiNo","2019-06-14",26340
