"Title","video_url","Published_date","Views"
"India Vix Masterclass | Learn Advance Option Trading in Stock Market","https://www.youtube.com/watch?v=vK_3eSmG7X0","2023-05-31",59904
"Get 1000+ Free Courses from this Website","https://www.youtube.com/watch?v=5IYRrg_v0MM","2023-05-31",88250
"You Can’t Buy Rolex Even After Having Money! 💰","https://www.youtube.com/watch?v=0dGS00rgRtQ","2023-05-30",165994
"3 Leg Strategy | Debit Spread | Option Trading | Earn Regular Profits from Stock Market","https://www.youtube.com/watch?v=QqvZuYdrGOU","2023-05-30",83873
"Formula to Buy Your Dream Car","https://www.youtube.com/watch?v=5GRBUjb5ie4","2023-05-29",120371
"Intraday Trading with Data Reading | Learn Stock Market","https://www.youtube.com/watch?v=4qACsGl7N3k","2023-05-28",112726
"Gamma Blast Expiry Jackpot Strategy | Option Buying in Stock Market","https://www.youtube.com/watch?v=HzVEPVuG1ZA","2023-05-27",136706
"Formula to Buy Your Dream Home 🏡","https://www.youtube.com/watch?v=QETsXyqRqn0","2023-05-27",155168
"Parkinson's Law","https://www.youtube.com/watch?v=WIU2n2BViGU","2023-05-26",90519
"Iron Condor Strategy with Profitable Adjustments | Learn Trading in Share Market","https://www.youtube.com/watch?v=1jiVUtvOLmk","2023-05-26",73856
"अगर ये किया तो Income Tax Department से Notice पक्का आयेगा!","https://www.youtube.com/watch?v=iMf0GpOCZw8","2023-05-25",188448
"Iron Fly Strategy with Adjustments | Stock Market Trading","https://www.youtube.com/watch?v=1P2q17kSyxI","2023-05-25",87610
"India🇮🇳 Vs China 🇨🇳 Schools","https://www.youtube.com/watch?v=ckn1650zLpM","2023-05-24",9850
"Delta Neutral Strategy for Option Trading | Stock Market से लगातार पैसा बनाना है तो ये सीखों","https://www.youtube.com/watch?v=VYNEvDhcV1k","2023-05-23",102417
"Stock Market से पैसे कमाने के लिएJwellery Shop ही लूट ली","https://www.youtube.com/watch?v=sAdj7rTxBw4","2023-05-23",78466
"Why Tata Doesn’t Make Bikes?","https://www.youtube.com/watch?v=LNneXfaIxv8","2023-05-22",16500
"Beware of Latest Social Media Scams | Email Phishing, Instagram, Facebook, Telegram Scams","https://www.youtube.com/watch?v=2_mDQJ3-0ps","2023-05-21",78864
"₹2000 Notes Ban? Seriously 😏","https://www.youtube.com/watch?v=gwwgDT1wINs","2023-05-21",72240
"No Ban on ₹2000 Notes | Why RBI Withdraw Currency Circulation?","https://www.youtube.com/watch?v=281zL_UMiyw","2023-05-20",126445
"Free की मूँगफली 🤣 | कमाल की Business Strategy","https://www.youtube.com/watch?v=RVuckJU4T14","2023-05-20",111503
"No More Ban on “The Kerala Story”","https://www.youtube.com/watch?v=gtXhwyd-uyQ","2023-05-19",112563
"Options Trading Basics Explained | Share Market for Beginners","https://www.youtube.com/watch?v=yjyPdd7TQu0","2023-05-19",153675
"Top 5 Books For Stock Market","https://www.youtube.com/watch?v=Fr-USZhHTE8","2023-05-19",150221
"Price Action Free Masterclass | Learn Stock Market Trading","https://www.youtube.com/watch?v=vlpO_SNW2SI","2023-05-18",167586
"Assam Police Initiative on Over Weight Police Force including IAS","https://www.youtube.com/watch?v=WNEW97pGX3Q","2023-05-17",162444
"Chart Patterns for Trading | Learn Stock Market","https://www.youtube.com/watch?v=hudt_seQsAc","2023-05-16",157758
"When are you Ready for the Marriage? | Rules for Wedding","https://www.youtube.com/watch?v=tbbA6ASavlw","2023-05-15",99693
"Candlestick Patterns Learning Video | Stock Market Training","https://www.youtube.com/watch?v=WJP-VhMr4nU","2023-05-15",159654
"Sensex 100 to 60,000 | Returns from Stock Market","https://www.youtube.com/watch?v=d7-khpSCdxk","2023-05-13",167312
"Learn Chart Reading | Multi Time Frame Chart Analysis for Trading | Stock Market Technical Analysis","https://www.youtube.com/watch?v=Ak5ZWRHg1B0","2023-05-13",354391
"Option Chain + Price Action Trading Strategy | Learn Stock Market","https://www.youtube.com/watch?v=6aFcpGA0AqY","2023-05-12",143120
"Learn Crypto Trading | How to Trade in Bitcoin & Crypto Derivatives Tutorial","https://www.youtube.com/watch?v=bum9yg4gMyw","2023-05-11",80827
"How Rich Are You? |  आप कितने % लोगो से ऊपर हो Check with Your Salary/ Income or Wealth","https://www.youtube.com/watch?v=NFE64bvoXo0","2023-05-10",93176
"Remember this! Whenever You Sell Your Car or Bike!","https://www.youtube.com/watch?v=96wdZ0hIl5Y","2023-05-10",65949
"Which Stocks to Buy? | How to Select Best Stocks for Investment & Trading?","https://www.youtube.com/watch?v=BzWKsmMr4hk","2023-05-09",68079
"Stock Market Crash Course Book by Pushkar Raj Thakur","https://www.youtube.com/watch?v=aWangOKHrBM","2023-05-09",176093
"अरे एक दिन पूरा तो होने देते आप लोग 🔥🤩 Stock Market Book  | Learn Share Market","https://www.youtube.com/watch?v=pKGjGwPyhzk","2023-05-09",54592
"Investing in Share Market Using Market Mood Index Indicator","https://www.youtube.com/watch?v=r2ACX-QQqIk","2023-05-08",106531
"10 EMA Trading Strategy | Make Money in Stock Market with Anant Ladha","https://www.youtube.com/watch?v=2dnl5TggSJw","2023-05-07",332801
"Instant Earning Apps to Make Money Online","https://www.youtube.com/watch?v=x8W7EpD3Ndc","2023-05-06",504815
"Free Tools for YouTube Views Growth","https://www.youtube.com/watch?v=AGINsZnfxPo","2023-05-06",93331
"Expiry Special Strategy to Trade in Stock Market by CA Nitin Murarka","https://www.youtube.com/watch?v=D5iF_o1Nfc8","2023-05-05",130979
"Virat Vs Gambhir | Who is Right?","https://www.youtube.com/watch?v=HrSZLIDxJaY","2023-05-04",281637
"Go First Airlines Bankruptcy | इन Stocks पर रखो नज़र | Share Market","https://www.youtube.com/watch?v=eSttemeGrus","2023-05-03",85214
"Virat Kohli Vs Gautam Gambhir |  Reason of Fight in IPL CRICKET MATCH","https://www.youtube.com/watch?v=0DP8MSupZU8","2023-05-03",377677
"Earn using Chat GPT & AI Tools | How to Make Money Online?","https://www.youtube.com/watch?v=PmO2YMKoXnc","2023-05-02",456961
"Learn to Earn Money in Stock Market 📈","https://www.youtube.com/watch?v=4DWkc0Q3064","2023-05-01",87818
"My Portfolio Revealed | Mutual Fund SIP Investments | Money in Stock Market","https://www.youtube.com/watch?v=ewnac6e2hmw","2023-04-30",255181
"Youtube Will Pay You To Watch Videos?","https://www.youtube.com/watch?v=_yNluVs7ek0","2023-04-29",206122
"Nifty 30,000 Next Target | Nifty Price Prediction | Share Market Investment","https://www.youtube.com/watch?v=Jh5qXC7rfns","2023-04-29",90760
"Why U.S. Banks are Failing? Reasons for Mass Lay-offs!","https://www.youtube.com/watch?v=UiuhfwAxw9A","2023-04-28",151540
"Crypto Documentary | Bitcoin - Ethereum Blockchain - NFT - Tokens - WEB 3","https://www.youtube.com/watch?v=I1qaigXYXL8","2023-04-27",210618
"How to Check Cibil Score? |  Increase Your Cibil Score","https://www.youtube.com/watch?v=spuNHvILkik","2023-04-26",73711
"Mankind Pharma IPO Review & Details | Stock Market Investment","https://www.youtube.com/watch?v=5rhGv0uRnbo","2023-04-25",209543
"Marry Now Pay Later 😅","https://www.youtube.com/watch?v=oMBt1tE-5iQ","2023-04-24",376276
"Pair Trading in Options | Make Money like Hedge Funds in Share Market","https://www.youtube.com/watch?v=IqbVfLLZgyk","2023-04-23",106899
"Get 31%-41% Discount on New Car Purchase","https://www.youtube.com/watch?v=jcs9hdWN734","2023-04-21",104942
"31%-42% Off on New Car | Legal & Illegal Ways to Save Money & Get Discount on Car Purchase","https://www.youtube.com/watch?v=RbSqZVoJMj8","2023-04-20",353571
"Use ChatGPT to earn money from YouTube & Instagram","https://www.youtube.com/watch?v=KRdjHpyR7Do","2023-04-20",124863
"Dream11 Dark Reality","https://www.youtube.com/watch?v=QV5qJX49jto","2023-04-19",759607
"Why Govt. Will Not Ban Tobacco?","https://www.youtube.com/watch?v=NXW1RLBDwd0","2023-04-18",226653
"Earn 1 Crore on Dream 11 Dark Reality? | How to Win Mega💰? | Fantasy Sports Case Study","https://www.youtube.com/watch?v=ZTS-gJZ9wmA","2023-04-18",1522831
"Non Directional Option Trading Strategy | Iron Condor with a Twist | Share Market","https://www.youtube.com/watch?v=eO8hhNaHQ_s","2023-04-17",158751
"13% Returns on Investment | Xtra Plus Interest Income Explained","https://www.youtube.com/watch?v=gYVr-pPopLM","2023-04-17",167408
"Credit Card Use करते हो तो Credit  Utilisation Ratio को समझ लो | Cibil Score","https://www.youtube.com/watch?v=qYJNoJ-qcIA","2023-04-16",84482
"Market की Range निकालना सीखों! | Option Trading in Share Market","https://www.youtube.com/watch?v=i7JW2mIR88E","2023-04-15",177714
"Get 18-28% Discount on New Mobile Phones & Electronics","https://www.youtube.com/watch?v=_32cG3SRCE0","2023-04-14",241580
"Learn Option Trading from Starting | Beginner in Stock Market","https://www.youtube.com/watch?v=tuMTFtHgqJc","2023-04-13",319350
"Online Food Delivery #Trap","https://www.youtube.com/watch?v=-mbEWqmivEg","2023-04-13",80109
"How Jio will Recover 23,758 Crore from IPL Matches? | Mukesh Ambani Jio Cinema Earnings Explained","https://www.youtube.com/watch?v=xXI9VVfTLzI","2023-04-11",233332
"Earn Passive Income Daily | 13% Returns on Investment | Invest Money | Xtra","https://www.youtube.com/watch?v=8oeayWvF7C8","2023-04-10",417254
"Share Market & Celebrities | Nifty BankNifty Telegram Trading Tips","https://www.youtube.com/watch?v=EgZzaHBFYiQ","2023-04-08",131064
"Bank Nifty Latest Update For Traders","https://www.youtube.com/watch?v=xRUwHMSeMC0","2023-04-08",333766
"ChatGPT Crash Course | How to Make Money with #ChatGPT?","https://www.youtube.com/watch?v=YCaCC8Lk9y8","2023-04-06",762689
"UPI & Rupay Credit Card Masterstroke by India | Visa & Mastercard in Trouble","https://www.youtube.com/watch?v=9ULnN_65fjo","2023-04-05",603577
"5 Minute Mai 5 Lakh Tak Ka Loan | Personal Loan","https://www.youtube.com/watch?v=Y6htDlJ_cDo","2023-04-05",306345
"How to Double Your Money by Investing in Share Market | Best Stocks Portfolio by Pranjal Kamra","https://www.youtube.com/watch?v=95LsGqXupFE","2023-04-05",448250
"ध्यान से सुन लो क्या Scam चल रहा है Telegram पर!","https://www.youtube.com/watch?v=N4_gfB7aTYs","2023-04-04",336247
"Save Money on Online Shopping 🛍️","https://www.youtube.com/watch?v=dWMess2mzJE","2023-04-04",208452
"How to Double Your Money by Investing in Share Market | Best Stocks Portfolio by Pranjal Kamra","https://www.youtube.com/watch?v=mTRIgaAdrSM","2023-04-03",194894
"How To Achieve Your Goals?","https://www.youtube.com/watch?v=4dzzpsCpRD0","2023-04-03",120373
"3 Important Indicators To Trade In Share Market","https://www.youtube.com/watch?v=bssueQbQ_So","2023-04-02",147004
"Learn Stock Market & Finance from Youtube Influencers | Money Management & Income Strategies","https://www.youtube.com/watch?v=2rPROOJ7R9Y","2023-04-01",121187
"Best Option Trading Strategy to Make Money in Share Market","https://www.youtube.com/watch?v=8xL5PywtxrE","2023-04-01",289924
"10 EMA Stratgey to Trade in Share Market by Anant Ladha","https://www.youtube.com/watch?v=mb8SXO_G57Q","2023-03-31",68080
"Beware of Celebrities Promoting #Telegram Groups | Share Market Latest Scam","https://www.youtube.com/watch?v=9324YvE9BXk","2023-03-31",767221
"10 EMA Stratgey to Trade in Share Market by Anant Ladha","https://www.youtube.com/watch?v=YTPpjxP2PdQ","2023-03-30",160655
"#UPI Payments पर 1% Charge लगेगा? | Money Transfer","https://www.youtube.com/watch?v=ScuXVDWKx4M","2023-03-30",710656
"Trading Psychology by @VivekBajaj | Share Market","https://www.youtube.com/watch?v=PCt5609Ih_c","2023-03-29",195398
"How to Start Investing in Share Market? | How to Make Money from Trading? ft. Kunal Saraogi","https://www.youtube.com/watch?v=oomqrwJfdV8","2023-03-28",91642
"How to Get Rich by Investing?","https://www.youtube.com/watch?v=Ujsoupi20Nk","2023-03-28",476992
"Option Trading in Stocks | Best Shares for Swing/Positional Trade in Share Market","https://www.youtube.com/watch?v=B3R7lcdsdsU","2023-03-27",132839
"How to Select Stocks for Intraday Trading? | Learn Option Trading in Share Market","https://www.youtube.com/watch?v=rihkKQAUho8","2023-03-26",268283
"Why Share Market Crashing? | Nifty & Bank Nifty Prediction","https://www.youtube.com/watch?v=nVS-MMttB6c","2023-03-25",289839
"Nifty Intraday Trading | Newton Laws for Option Trading by Nitin Murarka | Share Market","https://www.youtube.com/watch?v=M9LCfeIzmqI","2023-03-24",300206
"Most Useful Mobile #Application | Must Have Phone App","https://www.youtube.com/watch?v=Ry84qeMm8E0","2023-03-24",435867
"Nifty/ BankNifty Option Trading Safest Strategy | Make Money in Share Market by Pushkar Raj Thakur","https://www.youtube.com/watch?v=M-kPPL--nto","2023-03-23",243797
"Your Demat Account will be Closed if You Don’t Do This!","https://www.youtube.com/watch?v=aEPhFcJqRQE","2023-03-22",176954
"Learn Stock Market Basic to Intermediate Live","https://www.youtube.com/watch?v=tcNuJqj6_O4","2023-03-22",293808
"How to Start Investment in Stock Market? | How to Earn Money from Investing in Mutual Funds?","https://www.youtube.com/watch?v=O5D65ksTFQM","2023-03-21",299514
"Demat account will Freeze by if not done this | Zerodha, Upstox, Angel One | Share Market","https://www.youtube.com/watch?v=u18sqC56YDg","2023-03-20",811316
"Live Event | Interaction with Pushkar Raj Thakur | Financial Education","https://www.youtube.com/watch?v=9zhSLk4AwPI","2023-03-20",134120
"Ghanshyam Tech की BankNifty Secret Strategy  Share Marker Trading","https://www.youtube.com/watch?v=VYnSyfRSJAg","2023-03-19",349301
"Free Up Google Drive Storage | Online Hack to Save Money","https://www.youtube.com/watch?v=RZu6bD6jHbs","2023-03-19",366951
"Best Trading Strategy by Power of Stocks | Learn Trading | Subasish Pani Traffic Light Setup","https://www.youtube.com/watch?v=mMqXcoH1H3k","2023-03-18",945035
"BankNifty Big Moves Capturing Strategy | Option Trading Indicator | Share Market","https://www.youtube.com/watch?v=EU3R57BUKGI","2023-03-17",218128
"Ghanshyam Tech Profit from Stock Market | Art of Trading PnL from BankNifty","https://www.youtube.com/watch?v=NNiDygT6ug0","2023-03-16",783794
"17cr Profit from Trading | PnL of Power of Stocks Subasish Pani | Reality of Share Market","https://www.youtube.com/watch?v=Xr7XK7f3fg8","2023-03-15",831906
"Steps to Become a Trader in Stock Market | How to Trade?","https://www.youtube.com/watch?v=--BL4qjDW8c","2023-03-14",981649
"Thank You for Your Love 💕 We’re All Because of You ❤️🫶✨ #ShareMarketGrowthConclave #SMGC2023","https://www.youtube.com/watch?v=46MZdR0LyGQ","2023-03-13",552418
"Option Seller Trap Indicator | Option Buyer Profit Trade in Share Market","https://www.youtube.com/watch?v=taiJ4t-TeYA","2023-03-13",145897
"Stock Market Growth Conclave🔥 #SMGC2023 | PushkarRajThakur | #Sharemarket","https://www.youtube.com/watch?v=i3KY7eufDak","2023-03-12",1201016
"Share Market Built Up Data | Long Build Up - Long Unwinding - Short- Short Covering | Nifty Trading","https://www.youtube.com/watch?v=ldDNcM2Yb5I","2023-03-11",172662
"Earn ₹44 Crore by Investing ₹100 Daily | Stock Market ETF Compounding","https://www.youtube.com/watch?v=bvLD0wxljUQ","2023-03-10",1341510
"Order Book Indicator for Share Market Trading | Advance Level Option Trading Free Course","https://www.youtube.com/watch?v=-n-nGaWI-50","2023-03-09",205525
"Advance Level Option Trading Free Course | Shubham Agarwal Quantsapp | Share Market","https://www.youtube.com/watch?v=dIxRYvFUlOM","2023-03-07",304201
"4 Best Lifetime Free Credit Cards | Earn Money Rewards, Cash Backs & Free Vouchers on #CreditCards","https://www.youtube.com/watch?v=4mVqWfeZAQA","2023-03-05",287696
"Exam में ज़्यादा Marks लाने की ज़बर्दस्त Hack","https://www.youtube.com/watch?v=FGOZ60gtUUE","2023-03-05",174183
"Share Market Open होते ही First Candle Trading Strategy | Option Trading","https://www.youtube.com/watch?v=8lpFBXGTeDY","2023-03-04",425270
"How much Revenue Youtube Generates for Google?","https://www.youtube.com/watch?v=pEOuKoyOJ1E","2023-03-03",536076
"How to Identify Top & Bottom in Share Market? | Market Crash | Reversal Trading | Anant Ladha","https://www.youtube.com/watch?v=MXu6sp0Nxqo","2023-03-02",342400
"SGX Nifty का Price Action पकड़ो, और Indian Stock Market में पैसा बनाओ!","https://www.youtube.com/watch?v=UM5sF1p-Fto","2023-03-01",132443
"What is the Real Cost of Coins? 🪙","https://www.youtube.com/watch?v=bj8bbukHOi8","2023-03-01",197189
"Bitcoin Price Crash होने पर भी Paise Kamana Sikho? | Cryptocurrency Options Trading","https://www.youtube.com/watch?v=2BfU8u4Sf1k","2023-02-28",96745
"The Cost of Mark Zuckerberg Grey T-shirt","https://www.youtube.com/watch?v=QM_jDirC4g8","2023-02-27",1072134
"Earn ₹10 Lakhs by Investing | Best Financial Plan | Share Market","https://www.youtube.com/watch?v=jbecE0zRmwg","2023-02-26",582306
"Stop Paying for Carry Bags! #JagoGrahakJago","https://www.youtube.com/watch?v=z_p1OkJE7pQ","2023-02-25",188285
"Nifty Prediction with Dollar Chart | Forex Currency & Stock Market | Technical Analysis","https://www.youtube.com/watch?v=EFWYOHFv4XI","2023-02-25",108459
"Learn Stock Market Live","https://www.youtube.com/watch?v=yollORoqSQA","2023-02-24",212169
"Credit Card Limit Increase Trap | Credit Card Loan Scam | Financial Awareness","https://www.youtube.com/watch?v=c3BmDztuNm8","2023-02-23",83871
"₹1,40,000 Crore का Profit सिर्फ़ एक Trade से! कैसे? #ShareMarket","https://www.youtube.com/watch?v=k-TsjQagAZ4","2023-02-21",755840
"Indicator Based Option Trading Strategy for Regular Income by Kunal Saraogi | Share Market Strategy","https://www.youtube.com/watch?v=EyYCPbZpf0g","2023-02-21",143362
"Listen Carefully! | Advice from Top Actor ✨🔥","https://www.youtube.com/watch?v=r_m22gOvx7M","2023-02-20",100279
"Psychology Behind Stock Market Loss | #Trading & #StopLoss","https://www.youtube.com/watch?v=6G2zDE1qyp8","2023-02-18",136175
"10 Business which will Never Shut Down | Best Ideas to Make Money","https://www.youtube.com/watch?v=xbhImYWotas","2023-02-18",756463
"Momentum Investing to Make Money in Share Market | Kunal Saraogi","https://www.youtube.com/watch?v=IwVHVQfRkw4","2023-02-17",129947
"Chart Patterns + Best Indicators Trading Setup by Kunal Saraogi | Share Market","https://www.youtube.com/watch?v=YQ89wl4NE1c","2023-02-15",243030
"Do Not Pay Any Fees to bank for closing your loan | #RBI policy","https://www.youtube.com/watch?v=l6oZHPDBO-c","2023-02-13",197505
"Career in Stock Market | ft. Kunal Saraogi | Learn to Make Money from Share Market","https://www.youtube.com/watch?v=Op6g_WewUk4","2023-02-12",233565
"Earn ₹50,000 to ₹1 Lakh Per Month | Small Business Ideas to Make Money","https://www.youtube.com/watch?v=o8Wev3cZZSQ","2023-02-10",996289
"#SpokenEnglish","https://www.youtube.com/watch?v=WoEVDlCIqzo","2023-02-08",884803
"Biggest Stock Market Growth Conclave in Delhi | Learn Share Market Investing & Trading","https://www.youtube.com/watch?v=cwTtq8HZefA","2023-02-07",359012
"Best Investing Strategy in Share Market? | How to Find the Best Stocks to Invest Money?","https://www.youtube.com/watch?v=Q5jcfiY-ftw","2023-02-07",178882
"Adani Vs Hindenburg Complete Analysis  What Should Stocks Investors Do Now?","https://www.youtube.com/watch?v=FlMU5qhKe9E","2023-02-05",795141
"Best Option Trading Setup | Price Action + Option Chain Strategy | Share Market","https://www.youtube.com/watch?v=xGHKhmqR_O0","2023-02-04",383384
"My View on #Adani’s Fall in Today’s Debate on @RepublicWorld with #ArnabGoswami ✨","https://www.youtube.com/watch?v=NGqfH9ZSXS4","2023-02-04",942296
"Silver Price Target | Trading in MCX Commodity Market | Investment Advice","https://www.youtube.com/watch?v=89BdkKvwx00","2023-02-03",86198
"What to do in case of Bank Fraud?","https://www.youtube.com/watch?v=7L7-VKtr8Bc","2023-02-01",121083
"Budget Day Option Trading Strategy by Power of Stocks | Subhasish Pani | Learn Share Market","https://www.youtube.com/watch?v=-bECCxWrgn4","2023-01-31",275758
"Save Income Tax Hack","https://www.youtube.com/watch?v=9v4rOCwFZSk","2023-01-27",277119
"Budget Rally Data for Trading in Share Market | Nifty & Bank Nifty Analysis","https://www.youtube.com/watch?v=oyEQSRALD4E","2023-01-26",204079
"Bank Nifty JackPot Intraday Strategy | Make Money using Option Chain Data & Trend Trading","https://www.youtube.com/watch?v=zIskGPyo5-w","2023-01-25",247099
"BTST Strategy for Option Buying | Share Market","https://www.youtube.com/watch?v=6FIqehLVShw","2023-01-24",290798
"Option Trading Strategies | Big Money in Big Events | Share Market","https://www.youtube.com/watch?v=ix9yE9JqrlA","2023-01-23",278175
"Stock Market में Invest करने से नुक्सान हो गया?","https://www.youtube.com/watch?v=dwMBK_t31g0","2023-01-23",1060068
"Best Stocks to Buy in 2023? Earn Profit by Investing in Share Market","https://www.youtube.com/watch?v=pwxXMK3YEDI","2023-01-21",567069
"Penny Stock Scam in #ShareMarket Exposed | Pump & Dump","https://www.youtube.com/watch?v=Ce6ViMHoMdo","2023-01-18",278259
"Safe Low Risk Option Trading Strategy | Iron Condor Strategy in Share Market","https://www.youtube.com/watch?v=z1NTaz2OgtA","2023-01-18",252568
"Paytm Share Price Will Increase? #StockMarket #Short","https://www.youtube.com/watch?v=5DZ8eNc_ZHY","2023-01-17",262707
"Your Body is Your Real Life Partner ✨Become Fitness Conscious🔥","https://www.youtube.com/watch?v=xRs4pRKJaKY","2023-01-14",839740
"Best Option Trading Strategy for Sideways Market | Make Money in Stock Market","https://www.youtube.com/watch?v=kYWAN2U0TeE","2023-01-13",251485
"80+20% Discount Exposed | Sales Techniques","https://www.youtube.com/watch?v=twX-pyJlpsw","2023-01-13",672765
"Learn Stock Market to Make Money | Stock Market Growth Conclave 2023","https://www.youtube.com/watch?v=f3VIT3lb8Q4","2023-01-10",193579
"Option Trading Strategies for Share Market | Straddle Strangle Explained","https://www.youtube.com/watch?v=RKYbEQrRELM","2023-01-10",250597
"200+ Crore Profit from Stock Market in 5 Min? | Spoofing Scam in Share Market","https://www.youtube.com/watch?v=O47NtSh9qA0","2023-01-09",1795870
"How to Trade with Less Money in Stock Market | Market Wolf Review","https://www.youtube.com/watch?v=sHG7tYCf9lg","2023-01-07",425206
"Holiday Package Scam","https://www.youtube.com/watch?v=F2g0u3z2qHE","2023-01-06",219391
"How Much Gold or Electronics You Can Carry Duty Free to India?","https://www.youtube.com/watch?v=nnEqTrn2mFI","2023-01-06",555113
"Market Crash में पैसा कैसे कमाये? | Option Trading in Share Market","https://www.youtube.com/watch?v=UBgpxX8BuJE","2023-01-05",342713
"Expiry Special BankNifty Option Buying Trading | Profit from OTM in Stock Market","https://www.youtube.com/watch?v=ITprjLrkKjk","2023-01-04",713177
"Earn Passive Income from Investment | Make Money with 12% Club Mobile App","https://www.youtube.com/watch?v=1w-e3IgR5iw","2023-01-03",484151
"Earn Passive Income from Investing Money! | 12% Club Review","https://www.youtube.com/watch?v=HAVLqFrHN3w","2023-01-02",806620
"How to Make Money from Social Media? | Earning from Youtube, Facebook & Instagram","https://www.youtube.com/watch?v=ntlv5wNmUIk","2023-01-01",189676
"Best Intraday Option Trading Strategy for Directional Market | Brahmastra with PCR | Stock Market","https://www.youtube.com/watch?v=1REfmPEfvVk","2022-12-30",415609
"Brahmastra Strategy for Option Trading | Best Stock Market Intraday Strategy","https://www.youtube.com/watch?v=0EXVG4kPAm0","2022-12-28",989191
"Best Option Trading Strategies in Stock Market","https://www.youtube.com/watch?v=kx1bCCt83mA","2022-12-28",369441
"Which Strike to Buy & Sell to Make more Money in Option Trading in Share Market!","https://www.youtube.com/watch?v=BRwnJ4AJ9g0","2022-12-26",345799
"How Much Profit can You Make in Option Trading?","https://www.youtube.com/watch?v=BmvBv8OyeHA","2022-12-25",551798
"Learn Option Strategies to Trade in Stock Market | Bull Put & Bear Call Spreads Explained","https://www.youtube.com/watch?v=zx_SSdolbVg","2022-12-25",378330
"Use Theta & Delta in Your Favour to Make More Money in Option Trading | Share Market","https://www.youtube.com/watch?v=s5EHyCHAcQs","2022-12-24",468380
"Secrets to Make More Money with Option Trading in Share Market","https://www.youtube.com/watch?v=rhioAEy5Pss","2022-12-22",673023
"Option Trading Basic to Advance Level Course | Learn Share Market","https://www.youtube.com/watch?v=HSeiOcN3Y5Y","2022-12-20",1820418
"Expiry Special Strategy for Trading in Stock Market | Option Trading PCR Setup","https://www.youtube.com/watch?v=x4pm7l2f3SU","2022-12-19",345324
"BTST Trade Setup | How to Trade in Stock Market? | Mudit Goyal Share Market","https://www.youtube.com/watch?v=GR6xVHh4jJI","2022-12-18",204562
"Never Miss a Big Move | Chart of Accuracy 2.0 | Investing Daddy Share Market | Option Trading","https://www.youtube.com/watch?v=8bvZEUGsX9g","2022-12-17",463772
"Market कहाँ जायेगी? | Chart of Accuracy with Option Chain | Learn Stock Market with Investing Daddy","https://www.youtube.com/watch?v=lHmcLicOUt4","2022-12-15",845364
"Option Trading without Chart using Option Chain | Support Resistance Stock Market | Investing Daddy","https://www.youtube.com/watch?v=f-7XJ8pRb5Q","2022-12-13",930076
"Reversal Trading with Option Chain | 6 Kinds of Reversals by Investing Daddy to Make Money","https://www.youtube.com/watch?v=VGya30zWaWE","2022-12-11",810613
